conversation_history	query	rewrited_query	answer	unique_idx	candidates
"['turn 1: Select a mailing address through the contact picker for shipping labels. -> Accessing addresses. Tap the mailing address you’d like to use for shipping.', ""turn 2: Set up a 'Weekly Sync-Up' event for an internal discussion on team progress and updates. There is no location. It should run from 1703500000000 to 1703503600000. -> All set! 'Weekly Sync-Up' is on your calendar for December 25, 2023 (9:06\xa0AM–10:06\xa0AM) with no location. Event URI: content://calendar/event/1."", 'turn 3: Open content://calendar/event/1 event. -> Here’s “Weekly Sync-Up”: December\xa025, 2023, 9:06\xa0AM–10:06\xa0AM. No location specified.']"	I need to modify the document at content://texts/story; no additional content is required.	I need to modify the document at content://texts/story; no additional content is required.	{'plan': 'ACTION_EDIT_DOCUMENT', 'arguments': {'document_uri': 'content://texts/story'}}	ACTION_PICK-540-ACTION_INSERT_EVENT-1_NR-ACTION_VIEW_EVENT-1-ACTION_EDIT_DOCUMENT-1_NR	['get_contact_info', 'ACTION_INSERT_CONTACT', 'ACTION_VIEW_WEB_HISTORY', 'ACTION_EDIT_DOCUMENT', 'ACTION_NAVIGATE_TO_LOCATION']
"['turn 1: Choose a Markdown document to edit. -> Opening your documents—select a Markdown (.md) file to edit.', ""turn 2: If there’s no Markdown (.md) file, create a new one named Notes.md. -> No existing Markdown found, so I’ve made 'Notes.md' for you. You can access it here: content://documents/Notes.md."", 'turn 3: Edit content://documents/Notes.md to add a section for today\'s meeting agenda. -> Added a ""Today\'s Meeting Agenda"" section to your Notes.md file. Check it out here: content://documents/Notes.md']"	Could you open content://reports/monthly to edit it? I want to add 'Update for March' before starting.	Could you open content://reports/monthly to edit it? I want to add 'Update for March' before starting.	{'plan': 'ACTION_EDIT_DOCUMENT', 'arguments': {'document_uri': 'content://reports/monthly', 'content': 'Update for March'}}	ACTION_OPEN_DOCUMENT-163-ACTION_CREATE_DOCUMENT-1-ACTION_EDIT_DOCUMENT-1-ACTION_EDIT_DOCUMENT-1_NR	['ACTION_EDIT_DOCUMENT', 'ACTION_EDIT_ALARM', 'ACTION_INSERT_CONTACT', 'ACTION_SHOW_TIMERS', 'play_music']
"['turn 1: Schedule \'Thanksgiving Dinner\' on November 22, 2024 from 11:00 AM to 1:00 PM at Mom\'s House for a family gathering. -> Your ""Thanksgiving Dinner"" is confirmed for November 22, 2024 at 11:00\xa0AM at Mom’s House. Tap here for details: content://calendar/event/8', ""turn 2: View content://calendar/event/8 details for me. -> Thanksgiving Dinner: November 22, 2024 from 11:00 AM to 1:00 PM at Mom's House."", ""turn 3: Navigate to Mom's House -> Navigation to Mom's House is now in progress. Enjoy the trip!""]"	Set an alarm for 11:30 AM with the note 'Meeting Reminder'.	Set an alarm for 11:30 AM with the note 'Meeting Reminder'.	{'plan': 'ACTION_SET_ALARM', 'arguments': {'EXTRA_HOUR': 11, 'EXTRA_MINUTES': 30, 'EXTRA_MESSAGE': 'Meeting Reminder'}}	ACTION_INSERT_EVENT-443-ACTION_VIEW_EVENT-1-ACTION_NAVIGATE_TO_LOCATION-1-ACTION_SET_ALARM-1_NR	['INTENT_ACTION_VIDEO_CAMERA', 'ACTION_OPEN_DOCUMENT', 'ACTION_SET_ALARM', 'ACTION_SHOW_ALARMS', 'play_music']
"['turn 1: Pick a Python script. -> Sure thing—please choose a Python (.py) script from your files.', ""turn 2: Actually, create a new one called example.py. -> All set! Your new Python script 'example.py' has been created at content://documents/example.py. Ready when you are to start coding."", 'turn 3: Open content://documents/example.py and insert a basic Python script template with a main function. -> A basic Python script template with a main function has been inserted into example.py. You can start coding at: content://documents/example.py']"	Could you set an alarm at 5:50 AM that goes off only on Sundays?	Could you set an alarm at 5:50 AM that goes off only on Sundays?	{'plan': 'ACTION_SET_ALARM', 'arguments': {'EXTRA_HOUR': 5, 'EXTRA_MINUTES': 50, 'EXTRA_DAYS': ['Sunday']}}	ACTION_OPEN_DOCUMENT-162-ACTION_CREATE_DOCUMENT-1-ACTION_EDIT_DOCUMENT-1-ACTION_SET_ALARM-1_NR	['ACTION_VIEW_PLAYLIST', 'ACTION_GET_RINGTONE', 'launch_application', 'ACTION_SET_ALARM', 'ACTION_INSERT_EVENT']
"['turn 1: I need a calendar entry on May 1, 2024 at 9:00 AM for an annual check-up with Dr. Smith at the Downtown Clinic. -> All set: ""Doctor Appointment"" is scheduled for May 1, 2024 at 9:00\xa0AM at Downtown Clinic. Check it here: content://calendar/event/2', 'turn 2: Send content://calendar/event/2 to jane.doe@example.com with subject Upcoming Doctor Appointment and body Please confirm your availability. -> Your appointment reminder has been sent to jane.doe@example.com.', ""turn 3: Let me see the email I sent to jane.doe@example.com -> Sent emails:\n• to jane.doe@example.com - 'Upcoming Doctor Appointment'""]"	Initiate an alarm at 20:40 with a ringtone from https://example.org/ringtone.mp3.	Initiate an alarm at 20:40 with a ringtone from https://example.org/ringtone.mp3.	{'plan': 'ACTION_SET_ALARM', 'arguments': {'EXTRA_HOUR': 20, 'EXTRA_MINUTES': 40, 'EXTRA_RINGTONE': 'https://example.org/ringtone.mp3'}}	ACTION_INSERT_EVENT-437-send_email-1-ACTION_VIEW_SENT_EMAILS-1-ACTION_SET_ALARM-1_NR	['ACTION_SET_ALARM', 'open_settings', 'ACTION_SHOW_TIMERS', 'ACTION_EDIT_VIDEO', 'ACTION_CREATE_DOCUMENT']
['turn 1: I want to save a draft web page as DraftPage.html. -> DraftPage.html is ready for you at content://documents/DraftPage.html.', 'turn 2: Could you activate the still photo camera on my phone? -> Still photo camera is now running—ready to click!', 'turn 3: Snap the shot. -> Shot taken! Access it at content://media/external/images/media/20240702_210015.jpg']	Switch my phone's ringtone over to content://media/fantasy_rhythm.	Switch my phone's ringtone over to content://media/fantasy_rhythm.	{'plan': 'ACTION_SET_RINGTONE', 'arguments': {'ringtone_uri': 'content://media/fantasy_rhythm'}}	ACTION_CREATE_DOCUMENT-12-INTENT_ACTION_STILL_IMAGE_CAMERA-1_NR-ACTION_IMAGE_CAPTURE-1-ACTION_SET_RINGTONE-1_NR	['ACTION_SET_RINGTONE', 'ACTION_GET_RINGTONE', 'ACTION_EDIT_CONTACT', 'send_message', 'ACTION_IMAGE_CAPTURE']
"['turn 1: I need to speak with tech support: 1800-123-000. -> Dialing tech support at 1800-123-000 now...', 'turn 2: I need to select an image from my device for an upcoming editing session. -> On it! Opening your photo gallery picker—select the image you want to edit.', ""turn 3: Create a new image file named EditedImage.jpg -> Here's your new image file 'EditedImage.jpg': content://documents/EditedImage.jpg.""]"	Please select content://media/glittering_tone as the ringtone for my device.	Please select content://media/glittering_tone as the ringtone for my device.	{'plan': 'ACTION_SET_RINGTONE', 'arguments': {'ringtone_uri': 'content://media/glittering_tone'}}	dial-934-ACTION_OPEN_DOCUMENT-1_NR-ACTION_CREATE_DOCUMENT-1-ACTION_SET_RINGTONE-1_NR	['ACTION_EDIT_ALARM', 'ACTION_SHOW_TIMERS', 'ACTION_VIEW_CALL_LOG', 'ACTION_SET_ALARM', 'ACTION_SET_RINGTONE']
"['turn 1: Could you tweak contact content://contacts/people/matthew by changing the phone number to (123) 456-7890? -> Sure thing—Matthew’s phone number is now (123)\xa0456‑7890. You’ll find his updated contact at content://contacts/people/matthew', ""turn 2: Schedule an event 'Workshop on AI' that dives deep into AI trends and technologies. It should be held at Innovation Hub, from 1703800000000 to 1703807200000. -> Your 'Workshop on AI' is set at Innovation Hub from 1703800000000 to 1703807200000. Event ID: content://calendar/event/9"", 'turn 3: Show me the details of content://calendar/event/9. -> Your “Workshop on AI” is confirmed at Innovation Hub, covering AI trends and technologies. Start: 1703800000000, End: 1703807200000.']"	Assign my ringtone as content://media/ethereal_sound.	Assign my ringtone as content://media/ethereal_sound.	{'plan': 'ACTION_SET_RINGTONE', 'arguments': {'ringtone_uri': 'content://media/ethereal_sound'}}	ACTION_EDIT_CONTACT-108-ACTION_INSERT_EVENT-1_NR-ACTION_VIEW_EVENT-1-ACTION_SET_RINGTONE-1_NR	['ACTION_SET_RINGTONE', 'ACTION_PICK', 'ACTION_VIEW_WEB_HISTORY', 'send_message', 'ACTION_IMAGE_CAPTURE']
['turn 1: Need to take a pic—launch the camera. -> Camera ready—go ahead and capture your pic!', 'turn 2: Capture a photo and save it to content://example/uri. -> Photo captured! Stored at content://example/uri.', 'turn 3: I need the information linked with contact://chat/telegram/@user123. -> Telegram contact: @user123.']	Display a summary of my currently running timers.	Display a summary of my currently running timers.	{'plan': 'ACTION_SHOW_TIMERS', 'arguments': {}}	INTENT_ACTION_STILL_IMAGE_CAMERA-861-ACTION_IMAGE_CAPTURE-1-get_contact_info_from_uri-1_NR-ACTION_SHOW_TIMERS-1_NR	['ACTION_CREATE_DOCUMENT', 'ACTION_SET_RINGTONE', 'get_contact_info', 'ACTION_SHOW_TIMERS', 'ACTION_VIEW_CALL_LOG']
"[""turn 1: Can you help me edit the contact content://contacts/people/mary_bell? I want to add her work email mary@bellcorp.com. -> Got it, launching Mary's contact. You can add her work email mary@bellcorp.com right away."", ""turn 2: Send content://contacts/people/mary_bell a reminder message asking if she saw my email. -> Reminder sent to Mary Bell (content://contacts/people/mary_bell): 'Did you see my email?'."", ""turn 3: List all messages I've sent. -> Sent messages: Mary Bell – 'Did you see my email?'""]"	Would it be possible to see which timers are still active?	Would it be possible to see which timers are still active?	{'plan': 'ACTION_SHOW_TIMERS', 'arguments': {}}	ACTION_EDIT_CONTACT-57-send_message-1-ACTION_VIEW_SENT_MESSAGES-1-ACTION_SHOW_TIMERS-1_NR	['ACTION_VIEW_EVENT', 'get_contact_info', 'ACTION_SHOW_TIMERS', 'ACTION_VIDEO_CAPTURE', 'ACTION_SET_TIMER']
"[""turn 1: Can you fetch all the timers I've set? -> You have 3 timers running: 2 minutes - Tea, 15 minutes - Laundry, 30 minutes - Coding."", 'turn 2: Open my camera app in still-image mode, please. -> Still image camera application opened successfully.', 'turn 3: Take a picture and save it to content://pictures/session.jpg. -> Here you go! Photo saved at content://pictures/session.jpg']"	Show active timers please.	Show active timers please.	{'plan': 'ACTION_SHOW_TIMERS', 'arguments': {}}	ACTION_SHOW_TIMERS-1880-INTENT_ACTION_STILL_IMAGE_CAMERA-1_NR-ACTION_IMAGE_CAPTURE-1-ACTION_SHOW_TIMERS-1_NR	['ACTION_SHOW_TIMERS', 'ACTION_VIEW_PLAYLIST', 'ACTION_VIEW_CONTACT', 'ACTION_EDIT_ALARM', 'ACTION_GET_RINGTONE']
"['turn 1: I want to check recent calls I’ve made and received. -> Recent call entries: Mia +1-213-555-0156 (Missed) - Today 5:35 PM; Noah +1-415-555-0001 (Outgoing) - Yesterday 2:10 PM; Olivia +44-20-7946-0999 (Incoming) - Today 8:00 AM', 'turn 2: Dial Olivia +44-20-7946-0999 -> Connecting to +44-20-7946-0999...', ""turn 3: View the calls I've made and received. -> Sure — here’s your call log: Mia +1-213-555-0156 (Missed) - Today 5:35 PM; Noah +1-415-555-0001 (Outgoing) - Yesterday 2:10 PM; Olivia +44-20-7946-0999 (Incoming) - Today 8:00 AM""]"	I need a list of all timers that are in progress right now.	I need a list of all timers that are in progress right now.	{'plan': 'ACTION_SHOW_TIMERS', 'arguments': {}}	ACTION_VIEW_CALL_LOG-1895-dial-1-ACTION_VIEW_CALL_LOG-1-ACTION_SHOW_TIMERS-1_NR	['play_video', 'ACTION_OPEN_DOCUMENT', 'dial', 'ACTION_SHOW_TIMERS', 'ACTION_GET_CONTENT']
"[""turn 1: Email alpha.testers@domain.org the onboarding guide (file:///onboarding.pdf) and the policy document (file:///policy.docx). Use subject 'Welcome Pack'. -> Welcome Pack sent to alpha.testers@domain.org with onboarding and policy attachments."", 'turn 2: I require the address details of the contact at /user/info/samuel. -> Samuel’s address is 1600 Amphitheatre Parkway, Mountain View, CA 94043.', 'turn 3: Show 1600 Amphitheatre Parkway, Mountain View, CA 94043 on the map -> Showing you 1600 Amphitheatre Parkway, Mountain View, CA 94043 on the map now.']"	What timers are currently counting down on my device?	What timers are currently counting down on my device?	{'plan': 'ACTION_SHOW_TIMERS', 'arguments': {}}	send_email-1222-get_contact_info-1_NR-search_location-1-ACTION_SHOW_TIMERS-1_NR	['get_contact_info', 'ACTION_VIEW_PLAYLIST', 'open_settings', 'get_contact_info_from_uri', 'ACTION_SHOW_TIMERS']
"['turn 1: Tell me what alarms are in place. -> Sure thing! Here’s a glance at what you have set:\n[alarm_id: 1 - 6:30 AM, Wake Up, alarm_id: 2 - 12:00 PM, Lunch Reminder, alarm_id: 3 - 6:00 PM, Gym Session]', ""turn 2: Move 'alarm_id: 2 - 12:00 PM, Lunch Reminder' to 12:30 PM and rename it to Midday Break -> Alarm 2 has been updated to 12:30 PM and renamed to 'Midday Break'."", ""turn 3: Could you bring up 'alarm_id: 1 - 6:30 AM, Wake Up, alarm_id: 2 - 12:30 PM, Midday Break, alarm_id: 3 - 6:00 PM, Gym Session'? -> Got it—here’s what’s set: [alarm_id: 1 - 6:30 AM, Wake Up; alarm_id: 2 - 12:30 PM, Midday Break; alarm_id: 3 - 6:00 PM, Gym Session]""]"	Can you display the active countdown timers for me?	Can you display the active countdown timers for me?	{'plan': 'ACTION_SHOW_TIMERS', 'arguments': {}}	ACTION_SHOW_ALARMS-684-ACTION_EDIT_ALARM-1-ACTION_SHOW_ALARMS-1-ACTION_SHOW_TIMERS-1_NR	['INTENT_ACTION_VIDEO_CAMERA', 'ACTION_VIEW_SENT_EMAILS', 'ACTION_EDIT_ALARM', 'ACTION_SHOW_TIMERS', 'ACTION_INSERT_EVENT']
"['turn 1: Please adjust alarm 40 to 10:10, schedule it daily. -> Alarm 40 has been adjusted to 10:10 and is now scheduled to go off every day.', ""turn 2: Please show me all the alarms. -> Here's all the alarms you've configured: [alarm_id: 24 – Sat 10:10\xa0PM (no vibration), alarm_id: 26 – Wed 4:35\xa0PM (pop_tune), alarm_id: 27 – Mon–Wed 8:05\xa0AM (Gentle Bell), alarm_id: 28 – 10:10\xa0AM “Meeting” (Office Bell), alarm_id: 29 – 3:15\xa0PM “Pick up kids” (Kids Tune), alarm_id: 30 – Sat 6:50\xa0AM, alarm_id: 31 – Mon–Fri 1:13\xa0PM “Lunchtime” (Lunch Jingle; no vib), alarm_id: 37 – 9:09\xa0AM (classic; vibrate), alarm_id: 38 – Mon/Wed/Fri 9:21\xa0PM “Study” (study_track), alarm_id: 40 – daily 10:10\xa0AM]"", 'turn 3: I require the address details of the contact at /user/info/samuel. -> Samuel’s address is 321 Cedar Lane, Portland, OR\xa097205.']"	Organize an event called 'Board Meeting' in my calendar. It is a strategy and policy review meeting held in the Board Room, starting at 1701000000000 and ending at 1701007200000.	Organize an event called 'Board Meeting' in my calendar. It is a strategy and policy review meeting held in the Board Room, starting at 1701000000000 and ending at 1701007200000.	{'plan': 'ACTION_INSERT_EVENT', 'arguments': {'TITLE': 'Board Meeting', 'DESCRIPTION': 'Strategy and policy review meeting', 'EVENT_LOCATION': 'Board Room', 'BEGIN_TIME': 1701000000000, 'END_TIME': 1701007200000}}	ACTION_EDIT_ALARM-1674-ACTION_SHOW_ALARMS-1-get_contact_info-1_NR-ACTION_INSERT_EVENT-1_NR	['send_email', 'ACTION_INSERT_EVENT', 'ACTION_CREATE_DOCUMENT', 'ACTION_VIEW_EVENT', 'ACTION_VIDEO_CAPTURE']
['turn 1: I’d like to watch tutorial.mp4 from internal storage using VLC. -> Launching VLC and playing tutorial.mp4 from internal storage.', 'turn 2: Trim tutorial.mp4 from 30000 ms to 300000 ms -> Your tutorial.mp4 has been trimmed from 30s to 300s. Find the new clip at content://media/edited_tutorial_009.mp4.', 'turn 3: Play content://media/edited_tutorial_009.mp4 in VLC -> Launching VLC and playing content://media/edited_tutorial_009.mp4.']	Please arrange a 'Coding Workshop' focused on Python at Tech Hub. The event is scheduled to run from 1700900000000 to 1700907200000.	Please arrange a 'Coding Workshop' focused on Python at Tech Hub. The event is scheduled to run from 1700900000000 to 1700907200000.	{'plan': 'ACTION_INSERT_EVENT', 'arguments': {'TITLE': 'Coding Workshop', 'DESCRIPTION': 'Learning session focused on Python', 'EVENT_LOCATION': 'Tech Hub', 'BEGIN_TIME': 1700900000000, 'END_TIME': 1700907200000}}	play_video-1430-ACTION_EDIT_VIDEO-1-play_video-1-ACTION_INSERT_EVENT-1_NR	['ACTION_EDIT_CONTACT', 'ACTION_INSERT_EVENT', 'ACTION_VIEW_SENT_MESSAGES', 'ACTION_EDIT_VIDEO', 'search_location']
"[""turn 1: Please look up Grand Central Terminal, New York, NY on a map. -> Here's what I found: Grand Central Terminal, 89 E 42nd St, New York, NY 10017, USA."", ""turn 2: Book a tour at Grand Central Terminal, 89 E 42nd St, New York, NY 10017, USA on August 5 from 1 PM to 3 PM titled NYC Tour with description Explore the terminal and nearby sites -> Done! 'NYC Tour' is set for August\xa05,\xa02023, 1:00\xa0PM–3:00\xa0PM at Grand Central Terminal, 89\xa0E\xa042nd\xa0St, New York, NY\xa010017, USA. content://calendar/event/202"", ""turn 3: Text me Grand Central Terminal, 89 E 42nd St, New York, NY 10017, USA's info. -> Your message with the terminal info has been sent to you.""]"	Add an event named 'Dance Class' for a hip-hop session at City Dance Studio. It should start at 1700800000000 and end at 1700805400000.	Add an event named 'Dance Class' for a hip-hop session at City Dance Studio. It should start at 1700800000000 and end at 1700805400000.	{'plan': 'ACTION_INSERT_EVENT', 'arguments': {'TITLE': 'Dance Class', 'DESCRIPTION': 'Hip-hop session', 'EVENT_LOCATION': 'City Dance Studio', 'BEGIN_TIME': 1700800000000, 'END_TIME': 1700805400000}}	search_location-1135-ACTION_INSERT_EVENT-1-send_message-1-ACTION_INSERT_EVENT-1_NR	['ACTION_SHOW_TIMERS', 'web_search', 'ACTION_INSERT_EVENT', 'open_settings', 'send_email']
"['turn 1: Show the recipient names of my recent sent messages. -> Sent messages: John Doe – ""Meeting at 3\xa0PM""; Boss – ""The file’s been sent.""; Sarah – ""Thanks for your help earlier!""', 'turn 2: Could you bring up the file selector for a plain text file, please? -> Got it. Opening the picker for plain text files—please choose the document you need.', 'turn 3: Create a new plain text file named DraftNotes.txt -> DraftNotes.txt has been created successfully. Access it here: content://documents/DraftNotes.txt.']"	Could you please create an event for a 'Client Meeting'? The discussion will be about contract details at Downtown Office from 1700600000000 to 1700603600000.	Could you please create an event for a 'Client Meeting'? The discussion will be about contract details at Downtown Office from 1700600000000 to 1700603600000.	{'plan': 'ACTION_INSERT_EVENT', 'arguments': {'TITLE': 'Client Meeting', 'DESCRIPTION': 'Discussion about contract details', 'EVENT_LOCATION': 'Downtown Office', 'BEGIN_TIME': 1700600000000, 'END_TIME': 1700603600000}}	ACTION_VIEW_SENT_MESSAGES-2049-ACTION_OPEN_DOCUMENT-1_NR-ACTION_CREATE_DOCUMENT-1-ACTION_INSERT_EVENT-1_NR	['ACTION_VIEW_SENT_EMAILS', 'ACTION_IMAGE_CAPTURE', 'ACTION_OPEN_DOCUMENT', 'search_location', 'ACTION_INSERT_EVENT']
"[""turn 1: Could you list all the sites I've browsed recently? -> Sure, you browsed these sites recently: DuckDuckGo (search 'privacy tips'); Khan Academy (math videos); Dropbox (recent files); Outlook (email)"", ""turn 2: Look DuckDuckGo (search 'privacy tips') up again. -> Results for 'privacy tips DuckDuckGo': DuckDuckGo search results offering guides on online privacy, data protection strategies, and secure browsing recommendations."", 'turn 3: Allow me to browse and select a PDF file from my files. -> Opening the document browser for PDFs now. Pick the file you need.']"	Please add a 'Team Building' event to my calendar. It involves fun activities and brainstorming at the Office Playground, scheduled from 1700500000000 to 1700505400000.	Please add a 'Team Building' event to my calendar. It involves fun activities and brainstorming at the Office Playground, scheduled from 1700500000000 to 1700505400000.	{'plan': 'ACTION_INSERT_EVENT', 'arguments': {'TITLE': 'Team Building', 'DESCRIPTION': 'Fun activities and brainstorming', 'EVENT_LOCATION': 'Office Playground', 'BEGIN_TIME': 1700500000000, 'END_TIME': 1700505400000}}	ACTION_VIEW_WEB_HISTORY-2067-web_search-1-ACTION_OPEN_DOCUMENT-1_NR-ACTION_INSERT_EVENT-1_NR	['ACTION_INSERT_EVENT', 'INTENT_ACTION_STILL_IMAGE_CAMERA', 'ACTION_PICK', 'ACTION_VIEW_EVENT', 'open_settings']
['turn 1: Select multiple source code files in Python and Java. -> Opening the picker for Python and Java source files. You can select multiple .py and .java files.', 'turn 2: Create a new Python source code file named main.py. -> New Python file created: content://documents/main.py', 'turn 3: Edit content://documents/main.py to insert a main function template. -> Inserted a main function template into main.py. Ready for further coding here: content://documents/main.py']	I want to book an event called 'Dinner Party' described as a celebration dinner for the team. It will take place at Alex's Restaurant from 1700400000000 to 1700407200000.	I want to book an event called 'Dinner Party' described as a celebration dinner for the team. It will take place at Alex's Restaurant from 1700400000000 to 1700407200000.	"{'plan': 'ACTION_INSERT_EVENT', 'arguments': {'TITLE': 'Dinner Party', 'DESCRIPTION': 'Celebration dinner for the team', 'EVENT_LOCATION': ""Alex's Restaurant"", 'BEGIN_TIME': 1700400000000, 'END_TIME': 1700407200000}}"	ACTION_OPEN_DOCUMENT-161-ACTION_CREATE_DOCUMENT-1-ACTION_EDIT_DOCUMENT-1-ACTION_INSERT_EVENT-1_NR	['launch_application', 'ACTION_INSERT_EVENT', 'send_message', 'ACTION_EDIT_VIDEO', 'ACTION_INSERT_CONTACT']
['turn 1: Where is the Sydney Opera House situated? -> The Sydney Opera House is at Bennelong Point, Sydney NSW\xa02000, Australia—displaying it now.', 'turn 2: Plan an evening performance visit to Bennelong Point, Sydney NSW\xa02000, Australia on August 5 from 7 to 9 PM titled Opera Night with description Evening performance. -> Opera Night has been added on August\xa05 from 7:00 to 9:00\xa0PM at Bennelong Point, Sydney NSW\xa02000. Access it here: content://calendar/event/7', 'turn 3: Let me view content://calendar/event/7 appointment. -> Here’s your “Opera Night”: August\xa05, 7:00\xa0PM–9:00\xa0PM at Bennelong Point, Sydney NSW\xa02000, Australia.']	Kindly set up an event 'Monthly Review' in my calendar. The event is to review monthly targets and has no specified location. Please schedule it from 1700300000000 to 1700303600000.	Kindly set up an event 'Monthly Review' in my calendar. The event is to review monthly targets and has no specified location. Please schedule it from 1700300000000 to 1700303600000.	{'plan': 'ACTION_INSERT_EVENT', 'arguments': {'TITLE': 'Monthly Review', 'DESCRIPTION': 'Review monthly targets', 'BEGIN_TIME': 1700300000000, 'END_TIME': 1700303600000}}	search_location-1169-ACTION_INSERT_EVENT-1-ACTION_VIEW_EVENT-1-ACTION_INSERT_EVENT-1_NR	['ACTION_SHOW_ALARMS', 'INTENT_ACTION_STILL_IMAGE_CAMERA', 'web_search', 'ACTION_SET_RINGTONE', 'ACTION_INSERT_EVENT']
['turn 1: Let me pick a melody from the ringtone list. -> Sure—opening the melody list so you can pick a ringtone.', 'turn 2: I need to retrieve a PDF document from my cloud storage. Let me pick one file, please. -> On it—opening the PDF selector. Please pick the file from your cloud storage.', 'turn 3: What is the phone number associated with /contacts/rita? -> Rita can be reached at 555‑3322.']	Add a calendar event called 'Lunch with Sarah'. It's a casual lunch meeting with Sarah, scheduled from 1700100000000 to 1700103600000. No location is specified.	Add a calendar event called 'Lunch with Sarah'. It's a casual lunch meeting with Sarah, scheduled from 1700100000000 to 1700103600000. No location is specified.	{'plan': 'ACTION_INSERT_EVENT', 'arguments': {'TITLE': 'Lunch with Sarah', 'DESCRIPTION': 'Casual lunch meeting with Sarah', 'BEGIN_TIME': 1700100000000, 'END_TIME': 1700103600000}}	ACTION_GET_RINGTONE-324-ACTION_OPEN_DOCUMENT-1_NR-get_contact_info-1_NR-ACTION_INSERT_EVENT-1_NR	['ACTION_INSERT_EVENT', 'ACTION_OPEN_CONTENT', 'ACTION_EDIT_ALARM', 'web_search', 'ACTION_SET_TIMER']
"[""turn 1: I need to change John’s phone number to 555-1234 for his contact (content://contacts/people/john). Can you do that? -> Sure thing! Opening John's contact now so you can update his phone number to 555‑1234."", ""turn 2: Send John a message saying 'Hi John, I've updated your number to 555-1234.' -> Your message to John was delivered: 'Hi John, I've updated your number to 555-1234.'"", ""turn 3: Show my sent messages. -> Sent messages: John – 'Hi John, I've updated your number to 555-1234.'""]"	Please arrange a 'Project Kickoff Meeting' to discuss our new project approach in the Main Conference Room. It should start at 1700000000000 and end at 1700007200000.	Please arrange a 'Project Kickoff Meeting' to discuss our new project approach in the Main Conference Room. It should start at 1700000000000 and end at 1700007200000.	{'plan': 'ACTION_INSERT_EVENT', 'arguments': {'TITLE': 'Project Kickoff Meeting', 'DESCRIPTION': 'Discuss our new project approach', 'EVENT_LOCATION': 'Main Conference Room', 'BEGIN_TIME': 1700000000000, 'END_TIME': 1700007200000}}	ACTION_EDIT_CONTACT-56-send_message-1-ACTION_VIEW_SENT_MESSAGES-1-ACTION_INSERT_EVENT-1_NR	['ACTION_EDIT_ALARM', 'ACTION_SET_TIMER', 'ACTION_CREATE_DOCUMENT', 'ACTION_VIEW_CONTACT', 'ACTION_INSERT_EVENT']
