conversation_history	query	rewrited_query	answer	unique_idx	candidates
['turn 1: I want to see the information for content://contacts/people/1003. -> All set! Contact details for content://contacts/people/1003:\nName: David Smith\nTel: 555-0103\nMail: david.smith@example.com', 'turn 2: Get the social media account from contact://social/twitter/@tech_guru. -> Here’s the Twitter handle: @tech_guru.', 'turn 3: Get directions to 321 Oak Street. -> Sure thing—launching navigation to 321 Oak Street now.']	Start the video camera app immediately so I can record something.	Start the video camera app immediately so I can record something.	{'plan': 'INTENT_ACTION_VIDEO_CAMERA', 'arguments': {}}	ACTION_VIEW_CONTACT-761-get_contact_info_from_uri-1_NR-ACTION_NAVIGATE_TO_LOCATION-1-INTENT_ACTION_VIDEO_CAMERA-1_NR	['ACTION_SET_TIMER', 'ACTION_SET_ALARM', 'INTENT_ACTION_VIDEO_CAMERA', 'ACTION_VIEW_SENT_MESSAGES', 'ACTION_EDIT_ALARM']
['turn 1: Hey, remind me in 5 minutes to stretch. -> Got it! Stretch reminder: 5-minute timer started.', 'turn 2: Please display my current timers. -> Active timers: [5 minutes – Stretch reminder].', 'turn 3: Set another 10-minute timer for a coffee break -> Coffee break timer for 10 minutes has been initiated.']	Please open the video recording app on my device.	Please open the video recording app on my device.	{'plan': 'INTENT_ACTION_VIDEO_CAMERA', 'arguments': {}}	ACTION_SET_TIMER-602-ACTION_SHOW_TIMERS-1-ACTION_SET_TIMER-1-INTENT_ACTION_VIDEO_CAMERA-1_NR	['ACTION_NAVIGATE_TO_LOCATION', 'INTENT_ACTION_VIDEO_CAMERA', 'send_message', 'ACTION_INSERT_EVENT', 'open_settings']
"[""turn 1: Start a countdown for 2 hours 15 minutes 30 seconds and don't show any confirmation. -> Done! Timer set for 2 hours 15 minutes and 30 seconds."", 'turn 2: Could you list the timers? -> Timers in action: [2 hours 15 minutes 30 seconds].', 'turn 3: Add a 20-minute timer for a workout session -> All set! 20-minute workout session timer started.']"	Could you launch my phone's camera in video mode?	Could you launch my phone's camera in video mode?	{'plan': 'INTENT_ACTION_VIDEO_CAMERA', 'arguments': {}}	ACTION_SET_TIMER-601-ACTION_SHOW_TIMERS-1-ACTION_SET_TIMER-1-INTENT_ACTION_VIDEO_CAMERA-1_NR	['launch_application', 'INTENT_ACTION_VIDEO_CAMERA', 'search_location', 'web_search', 'ACTION_GET_CONTENT']
"['turn 1: Get the street address for content://org.addressbook/entries/456. -> Street address for content://org.addressbook/entries/456: 456 Birch Lane, Gotham City, NJ 07097.', ""turn 2: Look up articles on future renewable energy innovations. -> Search results for 'future renewable energy innovations': Breakthroughs in solar PV materials, cutting‑edge wind turbine designs, emerging bioenergy solutions."", ""turn 3: Show me the pages I visited for 'future renewable energy innovations' search. -> Here are your last visited pages: Google Search “future renewable energy innovations” (google.com/search?q=future+renewable+energy+innovations); DOE – Solar PV Material Breakthroughs (energy.gov/articles/solar-pv-advances); Wind Europe – Cutting‑Edge Turbine Designs (windeurope.org/turbine-innovations); Bioenergy Int’l – Emerging Bioenergy Solutions (bioenergyinternational.com).""]"	Initiate the video camera function so that I can start recording.	Initiate the video camera function so that I can start recording.	{'plan': 'INTENT_ACTION_VIDEO_CAMERA', 'arguments': {}}	get_contact_info-1016-web_search-1_NR-ACTION_VIEW_WEB_HISTORY-1-INTENT_ACTION_VIDEO_CAMERA-1_NR	['ACTION_EDIT_CONTACT', 'INTENT_ACTION_VIDEO_CAMERA', 'ACTION_EDIT_DOCUMENT', 'ACTION_NAVIGATE_TO_LOCATION', 'open_settings']
['turn 1: Invoke device camera for recording. -> Video mode activated. Ready to capture your moments.', 'turn 2: Grab a contact entry from my phone contacts list. -> Done! You’ve selected content://contacts/people/8 from your contacts.', 'turn 3: Let me see the details of content://contacts/people/8. -> Pulling up contact information for content://contacts/people/8.']	Activate the video recording mode on my phone, please.	Activate the video recording mode on my phone, please.	{'plan': 'INTENT_ACTION_VIDEO_CAMERA', 'arguments': {}}	INTENT_ACTION_VIDEO_CAMERA-907-ACTION_PICK-1_NR-ACTION_VIEW_CONTACT-1-INTENT_ACTION_VIDEO_CAMERA-1_NR	['dial', 'INTENT_ACTION_VIDEO_CAMERA', 'ACTION_SHOW_TIMERS', 'send_message', 'ACTION_GET_CONTENT']
['turn 1: Need a video capture, file URI: content://captures/vid_capture.mp4. -> Starting video capture now. Your file will be saved to content://captures/vid_capture.mp4.', 'turn 2: Trim content://captures/vid_capture.mp4 down to the first 5 minutes -> First 5 minutes extracted. Your trimmed video is available at content://captures/vid_capture_first5min.mp4.', 'turn 3: Play content://captures/vid_capture_first5min.mp4 -> Playback started for content://captures/vid_capture_first5min.mp4.']	Please bring up the standard camera mode to snap a photo.	Please bring up the standard camera mode to snap a photo.	{'plan': 'INTENT_ACTION_STILL_IMAGE_CAMERA', 'arguments': {}}	ACTION_VIDEO_CAPTURE-753-ACTION_EDIT_VIDEO-1-play_video-1-INTENT_ACTION_STILL_IMAGE_CAMERA-1_NR	['ACTION_EDIT_ALARM', 'ACTION_VIEW_CONTACT', 'open_settings', 'INTENT_ACTION_STILL_IMAGE_CAMERA', 'web_search']
"[""turn 1: I'd like to create a new PowerPoint slide deck titled DraftDeck.pptx. -> DraftDeck.pptx is ready! You can find it here: content://documents/DraftDeck.pptx."", 'turn 2: Add a title slide and a summary slide to content://documents/DraftDeck.pptx. -> Done! DraftDeck.pptx now includes a title slide and a summary slide. You can edit it at content://documents/DraftDeck.pptx.', 'turn 3: I want to choose more than one image at once. Please open a multi-select dialog for images. -> Here’s the multi-select image picker—feel free to pick all the photos you want.']"	I want to take a photo. Launch my still camera.	I want to take a photo. Launch my still camera.	{'plan': 'INTENT_ACTION_STILL_IMAGE_CAMERA', 'arguments': {}}	ACTION_CREATE_DOCUMENT-16-ACTION_EDIT_DOCUMENT-1-ACTION_OPEN_DOCUMENT-1_NR-INTENT_ACTION_STILL_IMAGE_CAMERA-1_NR	['get_contact_info_from_uri', 'ACTION_SHOW_ALARMS', 'INTENT_ACTION_STILL_IMAGE_CAMERA', 'ACTION_INSERT_EVENT', 'ACTION_EDIT_DOCUMENT']
"['turn 1: Timer for 20 seconds, message quick exercise. -> Timer set for 20 seconds: quick exercise.', ""turn 2: List the timers I'm running. -> Currently active timers: [20 seconds – quick exercise]"", 'turn 3: Add a 45-second timer for cooldown -> Cooldown timer set for 45 seconds.']"	Start photo capture mode on my phone.	Start photo capture mode on my phone.	{'plan': 'INTENT_ACTION_STILL_IMAGE_CAMERA', 'arguments': {}}	ACTION_SET_TIMER-608-ACTION_SHOW_TIMERS-1-ACTION_SET_TIMER-1-INTENT_ACTION_STILL_IMAGE_CAMERA-1_NR	['ACTION_GET_RINGTONE', 'INTENT_ACTION_STILL_IMAGE_CAMERA', 'ACTION_VIEW_SENT_MESSAGES', 'INTENT_ACTION_VIDEO_CAMERA', 'ACTION_EDIT_VIDEO']
['turn 1: Can you start video capture and save it here: content://myapp/videos/output.mp4? -> Opening camera to record. Your footage will be stored at content://myapp/videos/output.mp4.', 'turn 2: Trim content://myapp/videos/output.mp4 by removing the first 5 seconds. -> First 5 seconds removed. Updated video: content://myapp/videos/output_trim5000.mp4', 'turn 3: Play content://myapp/videos/output_trim5000.mp4. -> Opening trimmed clip: content://myapp/videos/output_trim5000.mp4 for you now.']	Launch the still image camera app.	Launch the still image camera app.	{'plan': 'INTENT_ACTION_STILL_IMAGE_CAMERA', 'arguments': {}}	ACTION_VIDEO_CAPTURE-741-ACTION_EDIT_VIDEO-1-play_video-1-INTENT_ACTION_STILL_IMAGE_CAMERA-1_NR	['ACTION_EDIT_CONTACT', 'get_contact_info', 'INTENT_ACTION_STILL_IMAGE_CAMERA', 'send_email', 'ACTION_EDIT_VIDEO']
['turn 1: I want to check recent calls I’ve made and received. -> Recent call entries: Mia +1-213-555-0156 (Missed) - Today 5:35 PM; Noah +1-415-555-0001 (Outgoing) - Yesterday 2:10 PM; Olivia +44-20-7946-0999 (Incoming) - Today 8:00 AM', 'turn 2: Dial Olivia +44-20-7946-0999 -> Connecting to +44-20-7946-0999...', 'turn 3: Please retrieve the address from the contact record at /user/info/hello_world. -> The address for hello_world is 987 Cedar Road, Gotham City, NJ 07097.']	Trigger the device's still image camera app for a photo capture.	Trigger the device's still image camera app for a photo capture.	{'plan': 'INTENT_ACTION_STILL_IMAGE_CAMERA', 'arguments': {}}	ACTION_VIEW_CALL_LOG-1895-dial-1-get_contact_info-1_NR-INTENT_ACTION_STILL_IMAGE_CAMERA-1_NR	['INTENT_ACTION_STILL_IMAGE_CAMERA', 'send_message', 'get_contact_info_from_uri', 'ACTION_SET_ALARM', 'play_video']
"[""turn 1: Show me a rundown of my recent app usage. -> Here's what you've accessed lately: News; Podcasts; Settings; Calculator"", 'turn 2: I need to capture a moving scene. Launch the video camera app for me. -> Launching video camera. Ready for action!', 'turn 3: Start shooting and save it to content://movies/mov1.mp4. -> All set—your movie has been recorded and stored at content://movies/mov1.mp4.']"	I need to open the camera in photo mode. Please launch the still image camera.	I need to open the camera in photo mode. Please launch the still image camera.	{'plan': 'INTENT_ACTION_STILL_IMAGE_CAMERA', 'arguments': {}}	ACTION_VIEW_RECENT_APPS-2203-INTENT_ACTION_VIDEO_CAMERA-1_NR-ACTION_VIDEO_CAPTURE-1-INTENT_ACTION_STILL_IMAGE_CAMERA-1_NR	['INTENT_ACTION_STILL_IMAGE_CAMERA', 'send_message', 'ACTION_IMAGE_CAPTURE', 'INTENT_ACTION_VIDEO_CAMERA', 'get_contact_info_from_uri']
"[""turn 1: Can you retrieve the email address of the contact for this URI: content://contacts/people/23? -> Sure thing—I've pulled up the email for that contact. It’s jane.doe23@example.com."", 'turn 2: Send jane.doe23@example.com an email reminding her of our appointment tomorrow. -> Reminder email dispatched to jane.doe23@example.com.', ""turn 3: Open my sent mail folder -> Sent emails: to jane.doe23@example.com - 'Appointment Reminder'; to mark.smith@example.com - 'Monthly Report'; to sarah.lee@domain.com - 'Re: Project Timeline'""]"	Activate the system's still camera so I can quickly snap a photo.	Activate the system's still camera so I can quickly snap a photo.	{'plan': 'INTENT_ACTION_STILL_IMAGE_CAMERA', 'arguments': {}}	get_contact_info-968-send_email-1-ACTION_VIEW_SENT_EMAILS-1-INTENT_ACTION_STILL_IMAGE_CAMERA-1_NR	['search_location', 'ACTION_CREATE_DOCUMENT', 'INTENT_ACTION_STILL_IMAGE_CAMERA', 'send_message', 'ACTION_NAVIGATE_TO_LOCATION']
"[""turn 1: List all of my recent web history entries. -> I found these in your web history: Google search 'best noise-cancelling headphones'; Wikipedia article 'Active Noise Control'; YouTube 'Sony WH-1000XM4 Review'; Amazon 'Bose QuietComfort 35 II' page; OpenAI Blog 'GPT-4 Release Highlights'; Reddit (r/headphones)."", ""turn 2: Search OpenAI Blog 'GPT-4 Release Highlights' again. -> Search results for 'GPT-4 Release Highlights OpenAI Blog': OpenAI Blog article outlining the key improvements, features, and use cases introduced in the GPT-4 release."", 'turn 3: I require the still photo function active; please start it. -> Ready to capture! The camera is open in still image mode.']"	Kindly start the still image capture app on my smartphone to take a picture.	Kindly start the still image capture app on my smartphone to take a picture.	{'plan': 'INTENT_ACTION_STILL_IMAGE_CAMERA', 'arguments': {}}	ACTION_VIEW_WEB_HISTORY-2085-web_search-1-INTENT_ACTION_STILL_IMAGE_CAMERA-1_NR-INTENT_ACTION_STILL_IMAGE_CAMERA-1_NR	['ACTION_VIEW_WEB_HISTORY', 'INTENT_ACTION_STILL_IMAGE_CAMERA', 'ACTION_OPEN_CONTENT', 'ACTION_VIEW_CALL_LOG', 'ACTION_GET_CONTENT']
"['turn 1: Could you launch the MX Player to play this segment: rtsp://example.com/segment.sdp -> MX Player is streaming rtsp://example.com/segment.sdp now. Playback has started.', 'turn 2: From my device, I want to open a single image file for persistent use. -> Alright, opening your images—please select one file for ongoing use.', ""turn 3: Since there's no suitable image, create a new one named Photo.png. -> No image matched your needs, so 'Photo.png' has been created: content://images/Photo.png. You can now add your own picture.""]"	I want to shoot a photo; please launch the still mode camera on my phone.	I want to shoot a photo; please launch the still mode camera on my phone.	{'plan': 'INTENT_ACTION_STILL_IMAGE_CAMERA', 'arguments': {}}	play_video-1437-ACTION_OPEN_DOCUMENT-1_NR-ACTION_CREATE_DOCUMENT-1-INTENT_ACTION_STILL_IMAGE_CAMERA-1_NR	['ACTION_OPEN_DOCUMENT', 'INTENT_ACTION_STILL_IMAGE_CAMERA', 'ACTION_EDIT_DOCUMENT', 'ACTION_SHOW_TIMERS', 'ACTION_SHOW_ALARMS']
"['turn 1: Create an XML config file named settings.xml. -> Your XML file settings.xml is now available at content://documents/settings.xml.', 'turn 2: Boot up the digital camera app for taking a static image. -> Still image camera is up. Ready to shoot.', ""turn 3: Let's take a shot -> Photo taken! It's available at content://camera/captures/2024-06-01_001.jpg""]"	Turn on the camera app to capture a still image.	Turn on the camera app to capture a still image.	{'plan': 'INTENT_ACTION_STILL_IMAGE_CAMERA', 'arguments': {}}	ACTION_CREATE_DOCUMENT-14-INTENT_ACTION_STILL_IMAGE_CAMERA-1_NR-ACTION_IMAGE_CAPTURE-1-INTENT_ACTION_STILL_IMAGE_CAMERA-1_NR	['ACTION_VIEW_CALL_LOG', 'dial', 'ACTION_VIDEO_CAPTURE', 'ACTION_SET_ALARM', 'INTENT_ACTION_STILL_IMAGE_CAMERA']
"['turn 1: Could you tweak contact content://contacts/people/matthew by changing the phone number to (123) 456-7890? -> Sure thing—Matthew’s phone number is now (123)\xa0456‑7890. You’ll find his updated contact at content://contacts/people/matthew', ""turn 2: Schedule an event 'Workshop on AI' that dives deep into AI trends and technologies. It should be held at Innovation Hub, from 1703800000000 to 1703807200000. -> Your 'Workshop on AI' is set at Innovation Hub from 1703800000000 to 1703807200000. Event ID: content://calendar/event/9"", 'turn 3: Where is Innovation Hub located exactly? -> Here’s Innovation Hub: 321 Tech Way, Silicon Valley, CA 94043.']"	Please open the photo camera function on my device so I can take a snapshot.	Please open the photo camera function on my device so I can take a snapshot.	{'plan': 'INTENT_ACTION_STILL_IMAGE_CAMERA', 'arguments': {}}	ACTION_EDIT_CONTACT-108-ACTION_INSERT_EVENT-1_NR-search_location-1-INTENT_ACTION_STILL_IMAGE_CAMERA-1_NR	['ACTION_SHOW_ALARMS', 'INTENT_ACTION_STILL_IMAGE_CAMERA', 'ACTION_VIEW_WEB_HISTORY', 'INTENT_ACTION_VIDEO_CAMERA', 'ACTION_SET_RINGTONE']
['turn 1: Set an alarm at noon without opening the clock app UI. -> Success! Alarm (alarm_no5) set for 12:00 PM.', 'turn 2: Please switch on the video camera application to capture video. -> Video camera application activated. Ready to capture footage.', 'turn 3: Browse and pick a video file to share. -> Sure—opening your videos now. Tap to choose one for sharing.']	Get my phone ready for taking a photo by launching its still image camera.	Get my phone ready for taking a photo by launching its still image camera.	{'plan': 'INTENT_ACTION_STILL_IMAGE_CAMERA', 'arguments': {}}	ACTION_SET_ALARM-558-INTENT_ACTION_VIDEO_CAMERA-1_NR-ACTION_GET_CONTENT-1-INTENT_ACTION_STILL_IMAGE_CAMERA-1_NR	['ACTION_VIEW_SENT_EMAILS', 'INTENT_ACTION_VIDEO_CAMERA', 'ACTION_SET_ALARM', 'INTENT_ACTION_STILL_IMAGE_CAMERA', 'ACTION_VIEW_PLAYLIST']
"['turn 1: Expose entry 110. -> Lunch with Sarah is on your calendar for tomorrow at 12:00\xa0PM at Deli Delight.', ""turn 2: Could you please open my phone's video recording application? -> Video camera is now open and recording-ready."", ""turn 3: Let's record a quick clip. -> Quick clip recorded! You can find it here: content://videos/quick_clip_006.mp4.""]"	I'd like to capture a moment; please start the still-image camera.	I'd like to capture a moment; please start the still-image camera.	{'plan': 'INTENT_ACTION_STILL_IMAGE_CAMERA', 'arguments': {}}	ACTION_VIEW_EVENT-1828-INTENT_ACTION_VIDEO_CAMERA-1_NR-ACTION_VIDEO_CAPTURE-1-INTENT_ACTION_STILL_IMAGE_CAMERA-1_NR	['ACTION_SET_TIMER', 'ACTION_VIEW_WEB_HISTORY', 'INTENT_ACTION_STILL_IMAGE_CAMERA', 'ACTION_VIEW_PLAYLIST', 'ACTION_NAVIGATE_TO_LOCATION']
"[""turn 1: Switch alarm 12 to 03:30 with ringtone 'uri://morning_call'. -> Got it! Alarm 12 is now set for 3:30\xa0AM using your 'uri://morning_call' ringtone."", ""turn 2: Show me my current alarms. -> Here's what's set: [alarm_id: 12 – 3:30\xa0AM (‘uri://morning_call’), alarm_id: 1 – 6:15\xa0AM, alarm_id: 33 – 4:44\xa0AM, alarm_id: 35 – 5:05\xa0AM ‘Sunrise’]."", 'turn 3: Change alarm_id: 35 – 5:05\xa0AM ‘Sunrise’ alarm to 6:00\xa0AM, repeat alarm_id: 35 – 5:05\xa0AM ‘Sunrise’ on Saturday and Sunday, and use the default ringtone. -> Alarm 35 is updated to 6:00\xa0AM on Saturdays and Sundays using the default ringtone.']"	Open my camera app in still-image mode, please.	Open my camera app in still-image mode, please.	{'plan': 'INTENT_ACTION_STILL_IMAGE_CAMERA', 'arguments': {}}	ACTION_EDIT_ALARM-1651-ACTION_SHOW_ALARMS-2-ACTION_EDIT_ALARM-1-INTENT_ACTION_STILL_IMAGE_CAMERA-1_NR	['INTENT_ACTION_STILL_IMAGE_CAMERA', 'get_contact_info_from_uri', 'play_music', 'dial', 'ACTION_CREATE_DOCUMENT']
"[""turn 1: I want to dispatch an email to contact@vendor.org with subject 'RFQ Submission' and attach file:///rfq.docx and file:///pricing.xlsx. -> RFQ Submission email sent to contact@vendor.org with both RFQ and pricing files attached."", ""turn 2: Can you open an image file for me? I'm looking for persistent access to it. -> Image loaded for long‑term access: content://pictures/favorites/photo123.png"", ""turn 3: Send content://pictures/favorites/photo123.png to Sam with the note 'Check out this photo.' -> Photo sent to Sam. He’ll check it out.""]"	Could you activate the still photo camera on my phone?	Could you activate the still photo camera on my phone?	{'plan': 'INTENT_ACTION_STILL_IMAGE_CAMERA', 'arguments': {}}	send_email-1225-ACTION_OPEN_DOCUMENT-1_NR-send_message-1-INTENT_ACTION_STILL_IMAGE_CAMERA-1_NR	['ACTION_OPEN_CONTENT', 'ACTION_NAVIGATE_TO_LOCATION', 'send_email', 'INTENT_ACTION_VIDEO_CAMERA', 'INTENT_ACTION_STILL_IMAGE_CAMERA']
"['turn 1: Display the TAR archive: content://archives/backup.tar (application/x-tar). -> Showing TAR archive backup.tar (application/x-tar) from content://archives/backup.tar.', ""turn 2: Schedule a 'Kids Playdate' event described as an afternoon of fun at the park. The location is Local Playground and it should take place from 1702300000000 to 1702303600000. -> I've added 'Kids Playdate' for December 11, 2023 at Local Playground. Check it here: content://calender/event/4"", 'turn 3: Show me the details for content://calender/event/4. -> Kids Playdate is scheduled for December 11, 2023 at Local Playground. Have fun!']"	Help me extract a phone number from my contact list.	Help me extract a phone number from my contact list.	{'plan': 'ACTION_PICK', 'arguments': {'data_type': 'phone'}}	ACTION_OPEN_CONTENT-259-ACTION_INSERT_EVENT-1_NR-ACTION_VIEW_EVENT-1-ACTION_PICK-1_NR	['ACTION_IMAGE_CAPTURE', 'ACTION_SET_TIMER', 'open_settings', 'get_contact_info_from_uri', 'ACTION_PICK']
"[""turn 1: Show me what's listed in content://contacts/people/1024. -> Displaying record:\nName: Liam Martin\nPhone: (555) 789-0123\nEmail: liam.martin@example.io\nURI: content://contacts/people/1024"", 'turn 2: Need to acquire the email address for the contact at /contacts/lily-email. -> Lily’s email address at /contacts/lily-email is lily.adams@example.net.', 'turn 3: Open content://contacts/people/1024 -> Here’s the contact at content://contacts/people/1024:\nName: Liam Martin\nPhone: (555)\xa0789-0123\nEmail: liam.martin@example.io']"	Select a contact's postal information, please.	Select a contact's postal information, please.	{'plan': 'ACTION_PICK', 'arguments': {'data_type': 'address'}}	ACTION_VIEW_CONTACT-776-get_contact_info-1_NR-ACTION_VIEW_CONTACT-1-ACTION_PICK-1_NR	['ACTION_PICK', 'ACTION_IMAGE_CAPTURE', 'get_contact_info_from_uri', 'ACTION_VIEW_CALL_LOG', 'ACTION_NAVIGATE_TO_LOCATION']
"[""turn 1: View songs in 'Piano Moods'. -> Playlist 'Piano Moods' loaded. Tracks: Clair de Lune; Nocturne Op.9 No.2; Moonlight Sonata."", ""turn 2: Play Nocturne Op.9 No.2. -> Okay, 'Nocturne Op.9 No.2' is on now."", ""turn 3: Show me the rest of Playlist 'Piano Moods'. -> Here’s 'Piano Moods' with its tracks: Clair de Lune; Nocturne Op.9 No.2; Moonlight Sonata.""]"	Could you extract the address detail of a contact for me?	Could you extract the address detail of a contact for me?	{'plan': 'ACTION_PICK', 'arguments': {'data_type': 'address'}}	ACTION_VIEW_PLAYLIST-2136-play_music-1-ACTION_VIEW_PLAYLIST-1-ACTION_PICK-1_NR	['ACTION_VIDEO_CAPTURE', 'ACTION_SHOW_ALARMS', 'ACTION_VIEW_SENT_EMAILS', 'ACTION_PICK', 'ACTION_VIEW_EVENT']
"['turn 1: Please pull up my sent MMS and SMS history. -> Sent MMS/SMS: VacationGroup – ""+1-310-555-0199"" – [Photo of beach]; Brian – ""+61 416 555 019"" – ""Thanks for dinner!""; Mom – ""+82-3512-0000"" – ""Love you lots!""', 'turn 2: Please start the Alarm app so I can set my wake-up time. -> Alarm app opened successfully. You can set your wake-up time now.', 'turn 3: Which apps did I use before launching the Alarm app? -> Recent apps: Messages; Alarm; Gallery; Settings.']"	I’d like you to choose a phone number from my contacts.	I’d like you to choose a phone number from my contacts.	{'plan': 'ACTION_PICK', 'arguments': {'data_type': 'phone'}}	ACTION_VIEW_SENT_MESSAGES-2001-launch_application-1_NR-ACTION_VIEW_RECENT_APPS-1-ACTION_PICK-1_NR	['ACTION_VIEW_SENT_EMAILS', 'ACTION_EDIT_VIDEO', 'ACTION_NAVIGATE_TO_LOCATION', 'ACTION_PICK', 'ACTION_SET_TIMER']
['turn 1: Reveal the last applications I ran. -> Recent apps: Facebook; Twitter; Calendar; Camera', 'turn 2: Could you switch to picking a phone number from my contact list? -> Phone number selected: content://contacts/phone/67', 'turn 3: Call content://contacts/phone/67 -> Connecting you to content://contacts/phone/67...']	Open my contact list and return an email address.	Open my contact list and return an email address.	{'plan': 'ACTION_PICK', 'arguments': {'data_type': 'email'}}	ACTION_VIEW_RECENT_APPS-2202-ACTION_PICK-1_NR-dial-1-ACTION_PICK-1_NR	['ACTION_VIEW_EVENT', 'ACTION_PICK', 'ACTION_INSERT_EVENT', 'search_location', 'ACTION_SET_RINGTONE']
"[""turn 1: I need to add Karen Page's contact, only her email karen.page@journal.com. -> Opening a new contact for Karen Page with her email (karen.page@journal.com) prefilled."", ""turn 2: Text karen.page@journal.com saying 'Hi Karen, nice to connect!' -> Message successfully sent to karen.page@journal.com."", ""turn 3: Let me review my sent messages. -> Sent messages: karen.page@journal.com – 'Hi Karen, nice to connect!'""]"	Can you please select a person from my contact database?	Can you please select a person from my contact database?	{'plan': 'ACTION_PICK', 'arguments': {}}	ACTION_INSERT_CONTACT-391-send_message-1-ACTION_VIEW_SENT_MESSAGES-1-ACTION_PICK-1_NR	['play_music', 'ACTION_GET_RINGTONE', 'ACTION_PICK', 'ACTION_OPEN_CONTENT', 'send_email']
['turn 1: Could you start a countdown that lasts for one hour without popping up any interface? -> Your 1-hour timer is running without popping up any interface.', 'turn 2: What timers do I have active? -> Active timers: [1 hour – Countdown]', 'turn 3: Add a 30-minute timer for downtime without showing any interface -> Downtime timer for 30 minutes is now running without any interface pop‑up.']	I need a quick selection of a contact's detail.	I need a quick selection of a contact's detail.	{'plan': 'ACTION_PICK', 'arguments': {}}	ACTION_SET_TIMER-607-ACTION_SHOW_TIMERS-1-ACTION_SET_TIMER-1-ACTION_PICK-1_NR	['open_settings', 'ACTION_SET_ALARM', 'ACTION_PICK', 'ACTION_INSERT_CONTACT', 'ACTION_VIDEO_CAPTURE']
"['turn 1: Could you schedule a one-hour brainstorming session for next Tuesday at 2 pm in Zoom Room A titled \'Project Alpha Brainstorm\' with description \'Initial idea generation for Project Alpha\'? -> Great! ""Project Alpha Brainstorm"" is on your calendar for April 16, 2024 at 2:00\xa0PM in Zoom Room A. Here\'s the event link: content://calendar/event/1', 'turn 2: Email content://calendar/event/1 to project.alpha@company.com with subject Project Alpha Brainstorm info and body Let me know if you have questions. -> All set—sent the event details to project.alpha@company.com.', ""turn 3: I'm planning to capture some video. Please start the video camera application. -> Your video camera is ready. Let’s shoot!""]"	Pick out an email on my contact list.	Pick out an email on my contact list.	{'plan': 'ACTION_PICK', 'arguments': {'data_type': 'email'}}	ACTION_INSERT_EVENT-436-send_email-1-INTENT_ACTION_VIDEO_CAMERA-1_NR-ACTION_PICK-1_NR	['ACTION_VIEW_SENT_MESSAGES', 'ACTION_PICK', 'ACTION_CREATE_DOCUMENT', 'ACTION_EDIT_VIDEO', 'ACTION_NAVIGATE_TO_LOCATION']
"['turn 1: Launch the still camera so I can take a shot. -> Still-image camera opened.', ""turn 2: I'm looking for image files to attach to my report. Could you let me choose multiple images? -> All good! Two images ready for you:\n• content://images/img001.jpg\n• content://images/img002.png"", ""turn 3: Send content://images/img001.jpg and content://images/img002.png to Alice with a caption 'These images are for the report.' -> Images sent to Alice as requested.""]"	Retrieve someone's mobile number from my contacts.	Retrieve someone's mobile number from my contacts.	{'plan': 'ACTION_PICK', 'arguments': {'data_type': 'phone'}}	INTENT_ACTION_STILL_IMAGE_CAMERA-854-ACTION_OPEN_DOCUMENT-1_NR-send_message-1-ACTION_PICK-1_NR	['ACTION_SET_TIMER', 'ACTION_VIEW_CALL_LOG', 'ACTION_PICK', 'ACTION_OPEN_CONTENT', 'INTENT_ACTION_STILL_IMAGE_CAMERA']
