conversation_history	query	rewrited_query	answer	unique_idx	candidates
['turn 1: Where can I find the Space Needle? -> Here’s the Space Needle: 400 Broad St, Seattle, WA 98109, USA.']	Schedule the 'Seattle Skyline' event there tomorrow at 6 PM for two hours	Schedule the 'Seattle Skyline' event at 400 Broad St, Seattle, WA 98109, USA tomorrow at 6 PM for two hours	{'plan': 'ACTION_INSERT_EVENT', 'arguments': {'TITLE': 'Seattle Skyline', 'DESCRIPTION': '', 'EVENT_LOCATION': '400 Broad St, Seattle, WA 98109, USA', 'BEGIN_TIME': 1712167200000, 'END_TIME': 1712234400000}}	search_location-1174-ACTION_INSERT_EVENT-1	['INTENT_ACTION_STILL_IMAGE_CAMERA', 'ACTION_GET_RINGTONE', 'ACTION_INSERT_EVENT', 'ACTION_EDIT_CONTACT', 'ACTION_OPEN_DOCUMENT']
['turn 1: Search for the University of Cape Town campus. -> Found it: University of Cape Town, Rondebosch, Cape Town, 7701, South Africa.']	Add a campus visit titled 'UCT Open Day' there on April 5th from 9 AM to 12 PM	Add a campus visit titled 'UCT Open Day' to University of Cape Town, Rondebosch, Cape Town, 7701, South Africa on April 5th from 9 AM to 12 PM	{'plan': 'ACTION_INSERT_EVENT', 'arguments': {'TITLE': 'UCT Open Day', 'DESCRIPTION': '', 'EVENT_LOCATION': 'University of Cape Town, Rondebosch, Cape Town, 7701, South Africa', 'BEGIN_TIME': 1712307600000, 'END_TIME': 1712318400000}}	search_location-1173-ACTION_INSERT_EVENT-1	['ACTION_INSERT_CONTACT', 'ACTION_VIEW_CALL_LOG', 'ACTION_INSERT_EVENT', 'ACTION_EDIT_DOCUMENT', 'ACTION_VIEW_EVENT']
['turn 1: Find the location of the Great Barrier Reef. -> Displaying the Great Barrier Reef: Queensland, Australia.']	Book a snorkeling trip titled 'Reef Adventure' there on July 15th starting at 8 AM for three hours	Book a snorkeling trip titled 'Reef Adventure' in Queensland, Australia on July 15th starting at 8 AM for three hours	{'plan': 'ACTION_INSERT_EVENT', 'arguments': {'TITLE': 'Reef Adventure', 'DESCRIPTION': '', 'EVENT_LOCATION': 'Queensland, Australia', 'BEGIN_TIME': 1721030400000, 'END_TIME': 1721041200000}}	search_location-1175-ACTION_INSERT_EVENT-1	['ACTION_SHOW_TIMERS', 'send_message', 'ACTION_OPEN_DOCUMENT', 'ACTION_OPEN_CONTENT', 'ACTION_INSERT_EVENT']
['turn 1: Where is the nearest pharmacy around here? -> Your nearest pharmacy is Green Cross Pharmacy at 123 Main St, just 0.3 miles north of your current location.']	Schedule 'Prescription Pickup' there tomorrow at 10 AM for 30 minutes with description 'Pick up my prescription'.	Schedule 'Prescription Pickup' at 123 Main St tomorrow at 10 AM for 30 minutes with description 'Pick up my prescription'.	{'plan': 'ACTION_INSERT_EVENT', 'arguments': {'TITLE': 'Prescription Pickup', 'DESCRIPTION': 'Pick up my prescription', 'EVENT_LOCATION': '123 Main St', 'BEGIN_TIME': 1712138400000, 'END_TIME': 1712140200000}}	search_location-1156-ACTION_INSERT_EVENT-1	['INTENT_ACTION_VIDEO_CAMERA', 'ACTION_SET_RINGTONE', 'web_search', 'ACTION_INSERT_EVENT', 'ACTION_SHOW_TIMERS']
['turn 1: Please locate the headquarters of the United Nations in New York. -> United Nations Headquarters: 405 E 42nd St, New York, NY 10017, USA.']	Plan a 'UN Tour' there next Monday from 2 PM to 3 PM with description 'Visit UN headquarters'.	Plan a 'UN Tour' at 405 E 42nd St, New York, NY 10017, USA next Monday from 2 PM to 3 PM with description 'Visit UN headquarters'.	{'plan': 'ACTION_INSERT_EVENT', 'arguments': {'TITLE': 'UN Tour', 'DESCRIPTION': 'Visit UN headquarters', 'EVENT_LOCATION': '405 E 42nd St, New York, NY 10017, USA', 'BEGIN_TIME': 1712584800000, 'END_TIME': 1712588400000}}	search_location-1157-ACTION_INSERT_EVENT-1	['ACTION_VIEW_PLAYLIST', 'ACTION_EDIT_ALARM', 'ACTION_INSERT_EVENT', 'ACTION_GET_CONTENT', 'ACTION_SET_ALARM']
['turn 1: Search for the Golden Pavilion in Kyoto. -> Found it: Kinkaku-ji (Golden Pavilion), 1 Kinkakujicho, Kita Ward, Kyoto 603-8361, Japan.']	Set up 'Photo Session' there this Saturday at 9 AM for 2 hours with description 'Photograph the pavilion'.	Set up 'Photo Session' at 1 Kinkakujicho, Kita Ward, Kyoto 603-8361, Japan this Saturday at 9 AM for 2 hours with description 'Photograph the pavilion'.	{'plan': 'ACTION_INSERT_EVENT', 'arguments': {'TITLE': 'Photo Session', 'DESCRIPTION': 'Photograph the pavilion', 'EVENT_LOCATION': '1 Kinkakujicho, Kita Ward, Kyoto 603-8361, Japan', 'BEGIN_TIME': 1712394000000, 'END_TIME': 1712401200000}}	search_location-1158-ACTION_INSERT_EVENT-1	['get_contact_info_from_uri', 'ACTION_INSERT_EVENT', 'ACTION_VIEW_EVENT', 'INTENT_ACTION_STILL_IMAGE_CAMERA', 'ACTION_VIEW_PLAYLIST']
['turn 1: Could you find the precise address of the White House? -> Here you go: The White House at 1600 Pennsylvania Avenue NW, Washington, DC 20500, USA.']	Create 'Tour of White House' there on April 15 from 11 AM to 12 PM with description 'Guided tour'.	Create 'Tour of White House' at 1600 Pennsylvania Avenue NW, Washington, DC 20500, USA on April 15 from 11 AM to 12 PM with description 'Guided tour'.	{'plan': 'ACTION_INSERT_EVENT', 'arguments': {'TITLE': 'Tour of White House', 'DESCRIPTION': 'Guided tour', 'EVENT_LOCATION': '1600 Pennsylvania Avenue NW, Washington, DC 20500, USA', 'BEGIN_TIME': 1713178800000, 'END_TIME': 1713182400000}}	search_location-1159-ACTION_INSERT_EVENT-1	['ACTION_INSERT_EVENT', 'launch_application', 'ACTION_VIEW_EVENT', 'ACTION_INSERT_CONTACT', 'web_search']
['turn 1: Where exactly is the Taj Mahal located? -> Taj Mahal: Dharmapuri, Forest Colony, Tajganj, Agra, Uttar Pradesh 282001, India.']	Add an event called 'Sunrise Visit' there next Friday at 6 AM for 1 hour with description 'Experience Taj Mahal at sunrise'.	Add an event called 'Sunrise Visit' at Dharmapuri, Forest Colony, Tajganj, Agra, Uttar Pradesh 282001, India next Friday at 6 AM for 1 hour with description 'Experience Taj Mahal at sunrise'.	{'plan': 'ACTION_INSERT_EVENT', 'arguments': {'TITLE': 'Sunrise Visit', 'DESCRIPTION': 'Experience Taj Mahal at sunrise', 'EVENT_LOCATION': 'Dharmapuri, Forest Colony, Tajganj, Agra, Uttar Pradesh 282001, India', 'BEGIN_TIME': 1712296800000, 'END_TIME': 1712300400000}}	search_location-1160-ACTION_INSERT_EVENT-1	['ACTION_INSERT_CONTACT', 'ACTION_GET_CONTENT', 'search_location', 'ACTION_INSERT_EVENT', 'ACTION_EDIT_VIDEO']
['turn 1: Locate the Brooklyn Bridge for me. -> Here’s the Brooklyn Bridge: Brooklyn Bridge, New York, NY 10038, USA.']	Schedule a discussion about suspension bridge history there next Monday at 2pm for one hour.	Schedule a discussion about suspension bridge history at Brooklyn Bridge, New York, NY 10038, USA next Monday at 2pm for one hour.	{'plan': 'ACTION_INSERT_EVENT', 'arguments': {'TITLE': 'Suspension Bridge History Discussion', 'DESCRIPTION': 'Discussion about suspension bridge history', 'EVENT_LOCATION': 'Brooklyn Bridge, New York, NY 10038, USA', 'BEGIN_TIME': 1683554400000, 'END_TIME': 1683558000000}}	search_location-1176-ACTION_INSERT_EVENT-1	['ACTION_IMAGE_CAPTURE', 'play_video', 'ACTION_EDIT_VIDEO', 'ACTION_OPEN_DOCUMENT', 'ACTION_INSERT_EVENT']
['turn 1: Send a quick email to mark@example.com reminding him about the quarterly report. -> Your reminder email has been sent to mark@example.com.']	Show my sent emails including that reminder to mark.	Show my sent emails including the reminder to mark@example.com.	{'plan': 'ACTION_VIEW_SENT_EMAILS', 'arguments': {}}	send_email-1186-ACTION_VIEW_SENT_EMAILS-1	['open_settings', 'ACTION_CREATE_DOCUMENT', 'ACTION_VIEW_SENT_EMAILS', 'ACTION_NAVIGATE_TO_LOCATION', 'ACTION_EDIT_ALARM']
"[""turn 1: I need to email Sarah at sarah.connor@skynet.com with subject 'Mission Update' and tell her the mission is a go. -> We've sent your 'Mission Update' email to sarah.connor@skynet.com.""]"	Can I review that mission update email in my sent folder?	Can I review the 'Mission Update' email to sarah.connor@skynet.com in my sent folder?	{'plan': 'ACTION_VIEW_SENT_EMAILS', 'arguments': {}}	send_email-1187-ACTION_VIEW_SENT_EMAILS-1	['ACTION_IMAGE_CAPTURE', 'ACTION_INSERT_CONTACT', 'ACTION_VIEW_SENT_EMAILS', 'open_settings', 'ACTION_PICK']
"[""turn 1: Could you please send a message to team@project.com with the subject 'Standup Meeting' and attach the agenda document located at file:///agenda.docx and the minutes from last week file:///minutes.pdf, then write 'Let's all be prepared!' in the body? -> Standup Meeting email with attachments sent to team@project.com.""]"	Let me see my sent emails to confirm that standup meeting message with the attachments.	Let me see my sent emails to confirm that Standup Meeting email with attachments sent to team@project.com.	{'plan': 'ACTION_VIEW_SENT_EMAILS', 'arguments': {}}	send_email-1189-ACTION_VIEW_SENT_EMAILS-1	['open_settings', 'ACTION_CREATE_DOCUMENT', 'ACTION_VIEW_SENT_EMAILS', 'ACTION_INSERT_CONTACT', 'ACTION_SET_TIMER']
"[""turn 1: I would like to shoot an email to CEO <ceo@bigcorp.com> with a brief note: 'Congratulations on the company's growth this quarter! We appreciate your leadership.' Include subject as 'Kudos'. -> Your 'Kudos' email has been delivered to ceo@bigcorp.com.""]"	Show the sent emails so I can verify that kudos message to the CEO.	Show the sent emails so I can verify that 'Kudos' message to the CEO.	{'plan': 'ACTION_VIEW_SENT_EMAILS', 'arguments': {}}	send_email-1190-ACTION_VIEW_SENT_EMAILS-1	['get_contact_info', 'ACTION_VIEW_SENT_MESSAGES', 'ACTION_VIEW_SENT_EMAILS', 'ACTION_SHOW_TIMERS', 'ACTION_VIEW_EVENT']
['turn 1: Hey, can you pop an email to support@helpdesk.org regarding the login issue? -> Message about the login issue sent to support@helpdesk.org.']	Let me review what I sent.	Let me review message about the login issue sent to support@helpdesk.org.	{'plan': 'ACTION_VIEW_SENT_EMAILS', 'arguments': {}}	send_email-1192-ACTION_VIEW_SENT_EMAILS-1	['ACTION_SET_ALARM', 'play_music', 'ACTION_VIEW_SENT_EMAILS', 'ACTION_VIEW_SENT_MESSAGES', 'ACTION_INSERT_CONTACT']
['turn 1: Reach out to john.doe@gmail.com. -> Email sent to john.doe@gmail.com.']	Could you pull up that email?	Could you pull up john.doe@gmail.com email?	{'plan': 'ACTION_VIEW_SENT_EMAILS', 'arguments': {}}	send_email-1193-ACTION_VIEW_SENT_EMAILS-1	['ACTION_NAVIGATE_TO_LOCATION', 'ACTION_SET_ALARM', 'ACTION_CREATE_DOCUMENT', 'ACTION_VIEW_SENT_EMAILS', 'ACTION_SET_RINGTONE']
"[""turn 1: Please mail my manager at manager@office.net a calendar invite file:///invite.ics with 'Here is the meeting invite' as body and subject 'Team Sync'. -> Meeting invite email has been sent to manager@office.net.""]"	I'd like to see that invite in my sent folder.	I'd like to see the meeting invite in my sent folder.	{'plan': 'ACTION_VIEW_SENT_EMAILS', 'arguments': {}}	send_email-1194-ACTION_VIEW_SENT_EMAILS-1	['play_music', 'dial', 'ACTION_EDIT_CONTACT', 'ACTION_PICK', 'ACTION_VIEW_SENT_EMAILS']
"[""turn 1: Could you forward the brochure (file:///brochure.pdf) to marketing@business.net and title it 'New Product Brochure'? -> Brochure successfully forwarded to marketing@business.net.""]"	Can I check that forwarded brochure in my sent emails?	Can I check file:///brochure.pdf in my sent emails?	{'plan': 'ACTION_VIEW_SENT_EMAILS', 'arguments': {}}	send_email-1206-ACTION_VIEW_SENT_EMAILS-1	['dial', 'launch_application', 'ACTION_VIEW_SENT_EMAILS', 'ACTION_IMAGE_CAPTURE', 'ACTION_SET_RINGTONE']
"[""turn 1: Forward the log file at file:///error.log to devops@infra.com with the body 'Please review the attached error log for troubleshooting.' -> Error log sent to devops@infra.com successfully.""]"	Can you pull up that error log email from my sent folder?	Can you pull up the error log email from my sent folder?	{'plan': 'ACTION_VIEW_SENT_EMAILS', 'arguments': {}}	send_email-1207-ACTION_VIEW_SENT_EMAILS-1	['ACTION_SET_RINGTONE', 'ACTION_IMAGE_CAPTURE', 'ACTION_VIEW_SENT_EMAILS', 'get_contact_info', 'ACTION_PICK']
"[""turn 1: Fire off an email to editor@publishers.com attaching file:///chapter1.docx and file:///chapter2.docx, use subject 'Draft Chapters' and add 'Let me know your thoughts.' in the body. -> Draft Chapters and attachments have been sent to editor@publishers.com.""]"	Could you find that draft chapters email in my sent items?	Could you find the Draft Chapters email in my sent items?	{'plan': 'ACTION_VIEW_SENT_EMAILS', 'arguments': {}}	send_email-1208-ACTION_VIEW_SENT_EMAILS-1	['ACTION_VIEW_SENT_EMAILS', 'ACTION_CREATE_DOCUMENT', 'open_settings', 'ACTION_SET_RINGTONE', 'ACTION_EDIT_DOCUMENT']
"[""turn 1: Compose an email to operations@warehouse.com, attach file:///inventory.xlsx, and leave the subject blank but include 'Inventory attached for review.' in the body. -> Inventory spreadsheet attached and email sent to operations@warehouse.com for review.""]"	Display those messages I just sent.	Display the email to operations@warehouse.com with the attachment file:///inventory.xlsx and the body 'Inventory attached for review.' I just sent.	{'plan': 'ACTION_VIEW_SENT_EMAILS', 'arguments': {}}	send_email-1218-ACTION_VIEW_SENT_EMAILS-1	['ACTION_SHOW_ALARMS', 'ACTION_OPEN_CONTENT', 'ACTION_IMAGE_CAPTURE', 'dial', 'ACTION_VIEW_SENT_EMAILS']
"[""turn 1: Send an SMS to +55 21 99999-8888: the new promotional video link 'https://youtu.be/abc123'. -> Message successfully sent to +5521999998888.""]"	Let me check what I've sent recently.	Let me check what I've sent to +5521999998888 recently.	{'plan': 'ACTION_VIEW_SENT_MESSAGES', 'arguments': {}}	send_message-1251-ACTION_VIEW_SENT_MESSAGES-1	['ACTION_OPEN_DOCUMENT', 'ACTION_INSERT_EVENT', 'ACTION_VIEW_SENT_EMAILS', 'launch_application', 'ACTION_VIEW_SENT_MESSAGES']
"[""turn 1: Could you please forward 'Project deadline extended to next Friday.' to Mike's number +1-303-555-0123? -> Message successfully sent to +1-303-555-0123.""]"	Show me the messages I sent to him	Show me the messages I sent to +1-303-555-0123	{'plan': 'ACTION_VIEW_SENT_MESSAGES', 'arguments': {}}	send_message-1256-ACTION_VIEW_SENT_MESSAGES-1	['ACTION_SET_TIMER', 'get_contact_info', 'ACTION_OPEN_DOCUMENT', 'open_settings', 'ACTION_VIEW_SENT_MESSAGES']
"[""turn 1: Ping +81 90-1234-5678 with a reminder: 'Submit your timesheet today before 6pm.' -> Reminder delivered to +819012345678.""]"	Could you display the reminders I sent to that number	Could you display the reminders I sent to +819012345678	{'plan': 'ACTION_VIEW_SENT_MESSAGES', 'arguments': {}}	send_message-1257-ACTION_VIEW_SENT_MESSAGES-1	['ACTION_VIEW_EVENT', 'send_message', 'ACTION_SET_TIMER', 'ACTION_PICK', 'ACTION_VIEW_SENT_MESSAGES']
['turn 1: Send the budget spreadsheet to accounting +61 3 9876 5432. The file is at https://example.com/budget.xlsx. -> Budget spreadsheet sent to +61398765432.']	Show the sent messages including the spreadsheet I sent	Show the sent messages including https://example.com/budget.xlsx I sent	{'plan': 'ACTION_VIEW_SENT_MESSAGES', 'arguments': {}}	send_message-1259-ACTION_VIEW_SENT_MESSAGES-1	['launch_application', 'ACTION_VIEW_SENT_EMAILS', 'ACTION_VIEW_SENT_MESSAGES', 'play_video', 'ACTION_INSERT_CONTACT']
['turn 1: Text Emily at 9876543210 asking if she can grab coffee at 11. -> Text message delivered to 9876543210.']	Show the messages I've sent her	Show the messages I've sent 9876543210	{'plan': 'ACTION_VIEW_SENT_MESSAGES', 'arguments': {}}	send_message-1258-ACTION_VIEW_SENT_MESSAGES-1	['ACTION_VIEW_SENT_EMAILS', 'open_settings', 'ACTION_VIEW_SENT_MESSAGES', 'play_video', 'ACTION_VIDEO_CAPTURE']
['turn 1: Send to John at +91-22-2345-6789: the meeting minutes and the related chart. Links: https://docs.com/minutes.pdf, https://docs.com/chart.png -> Files sent to +912223456789.']	What have I sent to him	What have I sent to +91-22-2345-6789	{'plan': 'ACTION_VIEW_SENT_MESSAGES', 'arguments': {}}	send_message-1260-ACTION_VIEW_SENT_MESSAGES-1	['ACTION_VIEW_SENT_MESSAGES', 'ACTION_VIEW_SENT_EMAILS', 'get_contact_info_from_uri', 'ACTION_EDIT_VIDEO', 'ACTION_VIDEO_CAPTURE']
"[""turn 1: Forward a memo to +1-702-555-0147: 'Office will be closed next Monday.' -> Your memo has been sent to +17025550147.""]"	Show me that memo and all my other sent messages.	Show me the memo 'Office will be closed next Monday.' and all my other sent messages.	{'plan': 'ACTION_VIEW_SENT_MESSAGES', 'arguments': {}}	send_message-1281-ACTION_VIEW_SENT_MESSAGES-1	['ACTION_EDIT_ALARM', 'web_search', 'ACTION_VIEW_CONTACT', 'ACTION_VIEW_SENT_MESSAGES', 'ACTION_PICK']
"[""turn 1: Fire up Spotify and play 'Uptown Funk - Mark Ronson ft. Bruno Mars'. -> Launching Spotify and playing 'Uptown Funk - Mark Ronson ft. Bruno Mars'.""]"	What tracks are in this playlist?	What tracks are in 'Uptown Funk - Mark Ronson ft. Bruno Mars' playlist?	{'plan': 'ACTION_VIEW_PLAYLIST', 'arguments': {'playlist_name': 'Uptown Funk - Mark Ronson ft. Bruno Mars'}}	play_music-1380-ACTION_VIEW_PLAYLIST-1	['ACTION_SET_RINGTONE', 'ACTION_VIEW_PLAYLIST', 'ACTION_INSERT_CONTACT', 'get_contact_info_from_uri', 'launch_application']
"[""turn 1: Cue up Billie Holiday's 'Strange Fruit'. -> All set! Now playing 'Strange Fruit' by Billie Holiday.""]"	What songs are in it?	What songs are in Billie Holiday's 'Strange Fruit'?	{'plan': 'ACTION_VIEW_PLAYLIST', 'arguments': {'playlist_name': 'Strange Fruit'}}	play_music-1361-ACTION_VIEW_PLAYLIST-1	['get_contact_info_from_uri', 'ACTION_IMAGE_CAPTURE', 'ACTION_OPEN_DOCUMENT', 'ACTION_VIEW_SENT_MESSAGES', 'ACTION_VIEW_PLAYLIST']
"[""turn 1: I would like to hear 'Ave Maria' by Schubert. -> Absolutely—now playing 'Ave Maria' by Schubert.""]"	Show the songs in it.	Show the songs in 'Ave Maria' by Schubert.	{'plan': 'ACTION_VIEW_PLAYLIST', 'arguments': {'playlist_name': 'Ave Maria'}}	play_music-1399-ACTION_VIEW_PLAYLIST-1	['ACTION_VIEW_PLAYLIST', 'ACTION_VIEW_WEB_HISTORY', 'ACTION_VIEW_SENT_EMAILS', 'get_contact_info_from_uri', 'play_video']
['turn 1: Launch Deezer and play track deezer:track:987654321. -> Opening Deezer and playing track deezer:track:987654321.']	List the tracks in that playlist.	List the tracks in deezer:track:987654321 playlist.	{'plan': 'ACTION_VIEW_PLAYLIST', 'arguments': {'playlist_name': 'deezer:track:987654321'}}	play_music-1400-ACTION_VIEW_PLAYLIST-1	['ACTION_GET_CONTENT', 'dial', 'ACTION_VIEW_RECENT_APPS', 'ACTION_VIEW_PLAYLIST', 'ACTION_EDIT_CONTACT']
"[""turn 1: Initiate playback of 'Hotel California - Eagles'. -> Sure thing—playing 'Hotel California' by Eagles now.""]"	Can you list the songs on it?	Can you list the songs on 'Hotel California - Eagles'?	{'plan': 'ACTION_VIEW_PLAYLIST', 'arguments': {'playlist_name': 'Hotel California - Eagles'}}	play_music-1383-ACTION_VIEW_PLAYLIST-1	['ACTION_SHOW_ALARMS', 'dial', 'ACTION_VIEW_PLAYLIST', 'ACTION_NAVIGATE_TO_LOCATION', 'ACTION_SET_ALARM']
['turn 1: Launch Microsoft Word, please. -> Microsoft Word is now open and ready for you.']	What other apps have I used after it?	What other apps have I used after Microsoft Word?	{'plan': 'ACTION_VIEW_RECENT_APPS', 'arguments': {}}	launch_application-1507-ACTION_VIEW_RECENT_APPS-1	['play_music', 'send_email', 'ACTION_IMAGE_CAPTURE', 'ACTION_VIEW_RECENT_APPS', 'ACTION_CREATE_DOCUMENT']
['turn 1: Open Microsoft Excel for some spreadsheet work. -> Microsoft Excel launched successfully. You can start editing your sheets.']	Can you show me apps I’ve opened since then?	Can you show me apps I’ve opened since Microsoft Excel launched successfully?	{'plan': 'ACTION_VIEW_RECENT_APPS', 'arguments': {}}	launch_application-1508-ACTION_VIEW_RECENT_APPS-1	['get_contact_info_from_uri', 'ACTION_IMAGE_CAPTURE', 'ACTION_EDIT_VIDEO', 'ACTION_EDIT_DOCUMENT', 'ACTION_VIEW_RECENT_APPS']
['turn 1: Could you start PowerPoint? I have a presentation to review. -> Microsoft PowerPoint is up and running—ready for your presentation review!']	What have I opened recently besides it?	What have I opened recently besides Microsoft PowerPoint?	{'plan': 'ACTION_VIEW_RECENT_APPS', 'arguments': {}}	launch_application-1509-ACTION_VIEW_RECENT_APPS-1	['get_contact_info_from_uri', 'dial', 'ACTION_VIEW_RECENT_APPS', 'ACTION_EDIT_CONTACT', 'ACTION_IMAGE_CAPTURE']
['turn 1: Please change my incoming call ringtone to the audio file at content://media/external/audio/media/45. -> All set! Your incoming call ringtone has been changed to the audio file at content://media/external/audio/media/45.']	Can you show me some other ringtones besides that?	Can you show me some other ringtones besides content://media/external/audio/media/45?	{'plan': 'ACTION_GET_RINGTONE', 'arguments': {}}	ACTION_SET_RINGTONE-1566-ACTION_GET_RINGTONE-1	['INTENT_ACTION_STILL_IMAGE_CAMERA', 'ACTION_PICK', 'ACTION_SHOW_ALARMS', 'ACTION_GET_RINGTONE', 'get_contact_info']
['turn 1: Could you update my phone’s ringtone using this URI? content://media/internal/audio/media/5 -> Done! Incoming call ringtone updated to content://media/internal/audio/media/5.']	Let me browse other ringtones instead of that.	Let me browse other ringtones instead of content://media/internal/audio/media/5.	{'plan': 'ACTION_GET_RINGTONE', 'arguments': {}}	ACTION_SET_RINGTONE-1568-ACTION_GET_RINGTONE-1	['ACTION_EDIT_VIDEO', 'ACTION_VIEW_WEB_HISTORY', 'ACTION_GET_RINGTONE', 'ACTION_VIEW_PLAYLIST', 'ACTION_INSERT_EVENT']
"[""turn 1: Switch the default ringtone to the 'Harmony' track located in my Music folder: content://storage/emulated/0/Music/Harmony.mp3 -> Great choice! Your default ringtone is now 'Harmony' (content://storage/emulated/0/Music/Harmony.mp3).""]"	I’d like to choose a different one than that.	I’d like to choose a different one than content://storage/emulated/0/Music/Harmony.mp3.	{'plan': 'ACTION_GET_RINGTONE', 'arguments': {}}	ACTION_SET_RINGTONE-1567-ACTION_GET_RINGTONE-1	['ACTION_GET_RINGTONE', 'play_music', 'ACTION_VIDEO_CAPTURE', 'ACTION_SHOW_TIMERS', 'ACTION_SHOW_ALARMS']
['turn 1: Make my device ring with the clip at content://com.android.providers.media.documents/document/audio%3A24 when I get calls. -> Your ringtone has been switched to the clip at content://com.android.providers.media.documents/document/audio%3A24.']	Pick a new ringtone for me instead of that clip.	Pick a new ringtone for me instead of the clip at content://com.android.providers.media.documents/document/audio%3A24.	{'plan': 'ACTION_GET_RINGTONE', 'arguments': {}}	ACTION_SET_RINGTONE-1569-ACTION_GET_RINGTONE-1	['ACTION_SET_TIMER', 'ACTION_GET_RINGTONE', 'ACTION_EDIT_VIDEO', 'ACTION_EDIT_CONTACT', 'play_video']
['turn 1: Set the ringtone to the raw audio file stored here: content://media/external/raw/media/10. -> Success! The raw audio file at content://media/external/raw/media/10 is now your ringtone.']	I want to select a different ringtone rather than that file.	I want to select a different ringtone rather than content://media/external/raw/media/10.	{'plan': 'ACTION_GET_RINGTONE', 'arguments': {}}	ACTION_SET_RINGTONE-1570-ACTION_GET_RINGTONE-1	['ACTION_VIEW_PLAYLIST', 'ACTION_PICK', 'ACTION_GET_RINGTONE', 'ACTION_VIEW_CONTACT', 'web_search']
['turn 1: Assign content://media/internal/audio/media/21 as the default ringtone -> Ringtone changed successfully.']	Actually, can I choose a different one than that?	Actually, can I choose a different one than content://media/internal/audio/media/21?	{'plan': 'ACTION_GET_RINGTONE', 'arguments': {}}	ACTION_SET_RINGTONE-1586-ACTION_GET_RINGTONE-1	['ACTION_VIEW_CALL_LOG', 'get_contact_info_from_uri', 'ACTION_GET_RINGTONE', 'ACTION_SET_RINGTONE', 'ACTION_VIEW_PLAYLIST']
['turn 1: Change ringtone to the audio document content://com.android.providers.media.documents/document/audio%3A25 -> Default ringtone updated!']	Can I pick another one instead of that?	Can I pick another one instead of content://com.android.providers.media.documents/document/audio%3A25?	{'plan': 'ACTION_GET_RINGTONE', 'arguments': {}}	ACTION_SET_RINGTONE-1587-ACTION_GET_RINGTONE-1	['ACTION_GET_RINGTONE', 'ACTION_EDIT_VIDEO', 'play_video', 'ACTION_CREATE_DOCUMENT', 'search_location']
"[""turn 1: I'd like to hear the track at content://com.android.providers.media.documents/document/audio%3A26 for calls -> All done! Your phone will ring with that track.""]"	Can you show me options other than that?	Can you show me options other than content://com.android.providers.media.documents/document/audio%3A26?	{'plan': 'ACTION_GET_RINGTONE', 'arguments': {}}	ACTION_SET_RINGTONE-1588-ACTION_GET_RINGTONE-1	['ACTION_GET_RINGTONE', 'ACTION_OPEN_DOCUMENT', 'send_email', 'ACTION_VIDEO_CAPTURE', 'ACTION_NAVIGATE_TO_LOCATION']
['turn 1: Make content://storage/emulated/0/Ringtones/vintage_tone.m4a my ringtone -> Vintage tone is now set as your default ringtone.']	Let me pick a different one instead of it.	Let me pick a different one instead of content://storage/emulated/0/Ringtones/vintage_tone.m4a.	{'plan': 'ACTION_GET_RINGTONE', 'arguments': {}}	ACTION_SET_RINGTONE-1589-ACTION_GET_RINGTONE-1	['ACTION_GET_RINGTONE', 'ACTION_VIEW_CALL_LOG', 'ACTION_NAVIGATE_TO_LOCATION', 'ACTION_SET_ALARM', 'ACTION_GET_CONTENT']
['turn 1: Switch the default ringtone to my ambient loop: content://storage/emulated/0/Music/ambient_loop.ogg -> Ambient loop is now your ringtone.']	I'd like to choose something different from that.	I'd like to choose something different from content://storage/emulated/0/Music/ambient_loop.ogg.	{'plan': 'ACTION_GET_RINGTONE', 'arguments': {}}	ACTION_SET_RINGTONE-1590-ACTION_GET_RINGTONE-1	['ACTION_GET_RINGTONE', 'ACTION_GET_CONTENT', 'ACTION_EDIT_DOCUMENT', 'dial', 'play_video']
['turn 1: Please set content://media/internal/audio/media/30 as the incoming ringtone -> Incoming ringtone set successfully.']	I want to change it again.	I want to change content://media/internal/audio/media/30 again.	{'plan': 'ACTION_GET_RINGTONE', 'arguments': {}}	ACTION_SET_RINGTONE-1592-ACTION_GET_RINGTONE-1	['send_message', 'ACTION_EDIT_ALARM', 'ACTION_GET_RINGTONE', 'dial', 'play_video']
