conversation_history	query	rewrited_query	answer	unique_idx	candidates
"[""turn 1: Create an MP3 audio named podcast_episode.mp3. -> Podcast 'podcast_episode.mp3' is now available here: content://documents/podcast_episode.mp3""]"	Play that podcast.	Play content://documents/podcast_episode.mp3 podcast.	{'plan': 'ACTION_OPEN_CONTENT', 'arguments': {'uri': 'content://documents/podcast_episode.mp3', 'mime_type': 'audio/mpeg'}}	ACTION_CREATE_DOCUMENT-36-ACTION_OPEN_CONTENT-1	['ACTION_VIEW_CALL_LOG', 'ACTION_INSERT_CONTACT', 'ACTION_VIEW_SENT_EMAILS', 'ACTION_OPEN_CONTENT', 'ACTION_SET_ALARM']
"[""turn 1: Create a ZIP archive with the filename archive.zip. -> Archive 'archive.zip' created successfully. Download it here: content://archives/archive.zip""]"	Open the archive.	Open content://archives/archive.zip.	{'plan': 'ACTION_OPEN_CONTENT', 'arguments': {'uri': 'content://archives/archive.zip', 'mime_type': 'application/zip'}}	ACTION_CREATE_DOCUMENT-40-ACTION_OPEN_CONTENT-1	['ACTION_SET_RINGTONE', 'ACTION_VIEW_RECENT_APPS', 'ACTION_IMAGE_CAPTURE', 'ACTION_OPEN_CONTENT', 'ACTION_VIEW_WEB_HISTORY']
"[""turn 1: Could you create an EPUB ebook named ebook.epub? -> Ebook 'ebook.epub' has been generated. You can get it at content://ebooks/ebook.epub""]"	Open that ebook.	Open content://ebooks/ebook.epub ebook.	{'plan': 'ACTION_OPEN_CONTENT', 'arguments': {'uri': 'content://ebooks/ebook.epub', 'mime_type': 'application/epub+zip'}}	ACTION_CREATE_DOCUMENT-39-ACTION_OPEN_CONTENT-1	['ACTION_GET_CONTENT', 'ACTION_SET_ALARM', 'dial', 'get_contact_info', 'ACTION_OPEN_CONTENT']
"[""turn 1: Please set up an MP4 video file called intro_video.mp4. -> Intro video 'intro_video.mp4' created successfully. Find it at content://videos/intro_video.mp4""]"	Show me that video.	Show me content://videos/intro_video.mp4.	{'plan': 'ACTION_OPEN_CONTENT', 'arguments': {'uri': 'content://videos/intro_video.mp4', 'mime_type': 'video/mp4'}}	ACTION_CREATE_DOCUMENT-37-ACTION_OPEN_CONTENT-1	['ACTION_OPEN_CONTENT', 'ACTION_VIEW_SENT_EMAILS', 'ACTION_VIEW_RECENT_APPS', 'ACTION_GET_RINGTONE', 'ACTION_GET_CONTENT']
"[""turn 1: Kindly create an Excel spreadsheet titled Budget.xlsx. -> Your new spreadsheet 'Budget.xlsx' has been created. You can access it here: content://documents/Budget.xlsx""]"	Show it to me	Show content://documents/Budget.xlsx to me	{'plan': 'ACTION_OPEN_CONTENT', 'arguments': {'uri': 'content://documents/Budget.xlsx', 'mime_type': 'application/vnd.openxmlformats-officedocument.spreadsheetml.sheet'}}	ACTION_CREATE_DOCUMENT-31-ACTION_OPEN_CONTENT-1	['ACTION_OPEN_CONTENT', 'ACTION_VIEW_SENT_EMAILS', 'ACTION_EDIT_VIDEO', 'play_music', 'ACTION_CREATE_DOCUMENT']
"[""turn 1: Generate a GIF animation file named animation.gif. -> All set! Your GIF 'animation.gif' is ready at content://documents/animation.gif""]"	Play it now	Play content://documents/animation.gif now	{'plan': 'ACTION_OPEN_CONTENT', 'arguments': {'uri': 'content://documents/animation.gif', 'mime_type': 'image/gif'}}	ACTION_CREATE_DOCUMENT-32-ACTION_OPEN_CONTENT-1	['web_search', 'ACTION_OPEN_CONTENT', 'dial', 'send_email', 'ACTION_SHOW_ALARMS']
"[""turn 1: Can you create an SVG diagram file called diagram.svg? -> Done creating 'diagram.svg'. You can find it here: content://documents/diagram.svg""]"	Please view it	Please view content://documents/diagram.svg	{'plan': 'ACTION_OPEN_CONTENT', 'arguments': {'uri': 'content://documents/diagram.svg', 'mime_type': 'image/svg+xml'}}	ACTION_CREATE_DOCUMENT-33-ACTION_OPEN_CONTENT-1	['ACTION_SET_RINGTONE', 'ACTION_INSERT_EVENT', 'ACTION_VIEW_SENT_MESSAGES', 'ACTION_EDIT_ALARM', 'ACTION_OPEN_CONTENT']
"[""turn 1: Please create a BMP image named canvas.bmp. -> Your BMP image 'canvas.bmp' has been saved. Access it via content://documents/canvas.bmp""]"	Show me that image	Show me content://documents/canvas.bmp	{'plan': 'ACTION_OPEN_CONTENT', 'arguments': {'uri': 'content://documents/canvas.bmp', 'mime_type': 'image/bmp'}}	ACTION_CREATE_DOCUMENT-34-ACTION_OPEN_CONTENT-1	['ACTION_GET_CONTENT', 'ACTION_VIEW_SENT_MESSAGES', 'ACTION_OPEN_CONTENT', 'ACTION_PICK', 'ACTION_VIEW_CONTACT']
"[""turn 1: I want a WAV audio file titled audio_sample.wav. -> I've created your WAV file 'audio_sample.wav'. You can open it at content://documents/audio_sample.wav""]"	Play it	Play content://documents/audio_sample.wav	{'plan': 'ACTION_OPEN_CONTENT', 'arguments': {'uri': 'content://documents/audio_sample.wav', 'mime_type': 'audio/wav'}}	ACTION_CREATE_DOCUMENT-35-ACTION_OPEN_CONTENT-1	['ACTION_VIEW_EVENT', 'ACTION_SET_TIMER', 'ACTION_VIEW_SENT_EMAILS', 'ACTION_OPEN_CONTENT', 'play_video']
['turn 1: Please pick multiple ZIP archives from local storage. -> Sure thing! Here are the ZIP archives you selected:\n- content://downloads/backups/backup_jan.zip\n- content://downloads/backups/backup_feb.zip']	Open the second one	Open content://downloads/backups/backup_feb.zip	{'plan': 'ACTION_OPEN_CONTENT', 'arguments': {'uri': 'content://downloads/backups/backup_feb.zip', 'mime_type': 'application/zip'}}	ACTION_OPEN_DOCUMENT-121-ACTION_OPEN_CONTENT-1	['ACTION_OPEN_CONTENT', 'play_music', 'ACTION_VIEW_SENT_EMAILS', 'get_contact_info', 'INTENT_ACTION_VIDEO_CAMERA']
['turn 1: Open a single HTML file for editing. -> One HTML file ready for editing:\n- content://documents/webpage/index.html']	Open it for editing	Open content://documents/webpage/index.html for editing	{'plan': 'ACTION_OPEN_CONTENT', 'arguments': {'uri': 'content://documents/webpage/index.html', 'mime_type': 'text/html'}}	ACTION_OPEN_DOCUMENT-122-ACTION_OPEN_CONTENT-1	['ACTION_VIEW_RECENT_APPS', 'ACTION_CREATE_DOCUMENT', 'open_settings', 'ACTION_GET_RINGTONE', 'ACTION_OPEN_CONTENT']
"[""turn 1: Choose a PDF brochure and a TIFF image. -> Here's what you picked:\n- content://docs/brochure/spring_event.pdf\n- content://images/events/banner.tiff""]"	Open the second one	Open content://images/events/banner.tiff	{'plan': 'ACTION_OPEN_CONTENT', 'arguments': {'uri': 'content://images/events/banner.tiff', 'mime_type': 'image/tiff'}}	ACTION_OPEN_DOCUMENT-124-ACTION_OPEN_CONTENT-1	['ACTION_SET_TIMER', 'ACTION_EDIT_ALARM', 'ACTION_OPEN_CONTENT', 'ACTION_VIEW_WEB_HISTORY', 'ACTION_INSERT_EVENT']
"[""turn 1: I need to pick one image file from my gallery. -> All set! Here's the image you chose: content://temp/DCIM/Camera/IMG_20230815_123456.jpg""]"	Show me that image	Show me content://temp/DCIM/Camera/IMG_20230815_123456.jpg	{'plan': 'ACTION_OPEN_CONTENT', 'arguments': {'uri': 'content://temp/DCIM/Camera/IMG_20230815_123456.jpg', 'mime_type': 'image/jpeg'}}	ACTION_GET_CONTENT-166-ACTION_OPEN_CONTENT-1	['get_contact_info', 'ACTION_OPEN_CONTENT', 'dial', 'ACTION_VIEW_PLAYLIST', 'ACTION_INSERT_EVENT']
['turn 1: Open the ringtone browser so I can pick one for notifications. -> Ringtone selected: content://media/ringtone/alarm_classic.mp3']	Play it for me.	Play content://media/ringtone/alarm_classic.mp3 for me.	{'plan': 'ACTION_OPEN_CONTENT', 'arguments': {'uri': 'content://media/ringtone/alarm_classic.mp3'}}	ACTION_GET_RINGTONE-296-ACTION_OPEN_CONTENT-1	['ACTION_NAVIGATE_TO_LOCATION', 'ACTION_OPEN_CONTENT', 'ACTION_EDIT_DOCUMENT', 'play_video', 'INTENT_ACTION_STILL_IMAGE_CAMERA']
['turn 1: Provide me with the option to select a notification tone. -> Notification tone chosen: content://media/ringtone/modern_beats.mp3']	Preview it.	Preview content://media/ringtone/modern_beats.mp3.	{'plan': 'ACTION_OPEN_CONTENT', 'arguments': {'uri': 'content://media/ringtone/modern_beats.mp3'}}	ACTION_GET_RINGTONE-297-ACTION_OPEN_CONTENT-1	['ACTION_INSERT_EVENT', 'ACTION_EDIT_DOCUMENT', 'open_settings', 'ACTION_SHOW_TIMERS', 'ACTION_OPEN_CONTENT']
['turn 1: I want to capture an image and store it at content://app.images/captured/selfie.jpg -> Got it—camera is launching. Your selfie will be saved to content://app.images/captured/selfie.jpg.']	Show me that selfie	Show me content://app.images/captured/selfie.jpg	{'plan': 'ACTION_OPEN_CONTENT', 'arguments': {'uri': 'content://app.images/captured/selfie.jpg'}}	ACTION_IMAGE_CAPTURE-327-ACTION_OPEN_CONTENT-1	['ACTION_OPEN_DOCUMENT', 'play_video', 'INTENT_ACTION_STILL_IMAGE_CAMERA', 'web_search', 'ACTION_OPEN_CONTENT']
['turn 1: Capture a document scan and save to content://media/external/images/doc_scan.png -> Understood. Launching camera to scan the document and save it at content://media/external/images/doc_scan.png.']	Open that scan	Open content://media/external/images/doc_scan.png	{'plan': 'ACTION_OPEN_CONTENT', 'arguments': {'uri': 'content://media/external/images/doc_scan.png'}}	ACTION_IMAGE_CAPTURE-329-ACTION_OPEN_CONTENT-1	['ACTION_GET_RINGTONE', 'ACTION_VIEW_SENT_EMAILS', 'ACTION_SET_TIMER', 'ACTION_OPEN_CONTENT', 'ACTION_INSERT_CONTACT']
['turn 1: Please photograph this scenery and save it at content://com.myapp/photos/trip_pic1.jpg -> Here we go—camera is open. I’ll store the shot at content://com.myapp/photos/trip_pic1.jpg.']	Let me view that scenery shot.	Let me view content://com.myapp/photos/trip_pic1.jpg scenery shot.	{'plan': 'ACTION_OPEN_CONTENT', 'arguments': {'uri': 'content://com.myapp/photos/trip_pic1.jpg'}}	ACTION_IMAGE_CAPTURE-331-ACTION_OPEN_CONTENT-1	['ACTION_VIEW_SENT_MESSAGES', 'ACTION_VIEW_PLAYLIST', 'INTENT_ACTION_VIDEO_CAMERA', 'ACTION_OPEN_CONTENT', 'ACTION_INSERT_EVENT']
['turn 1: Take a selfie and save into content://storage/emulated/0/Pictures/selfportrait.jpg -> Smile! Camera is opening. Your selfie will go to content://storage/emulated/0/Pictures/selfportrait.jpg.']	I'd like to see that selfie.	I'd like to see content://storage/emulated/0/Pictures/selfportrait.jpg.	{'plan': 'ACTION_OPEN_CONTENT', 'arguments': {'uri': 'content://storage/emulated/0/Pictures/selfportrait.jpg'}}	ACTION_IMAGE_CAPTURE-333-ACTION_OPEN_CONTENT-1	['search_location', 'open_settings', 'ACTION_VIEW_EVENT', 'ACTION_OPEN_CONTENT', 'get_contact_info']
['turn 1: Record a photo and store it at content://user.uploads/profiles/portrait.png -> Got it! Your portrait has been snapped and saved to content://user.uploads/profiles/portrait.png.']	Preview it	Preview content://user.uploads/profiles/portrait.png	{'plan': 'ACTION_OPEN_CONTENT', 'arguments': {'uri': 'content://user.uploads/profiles/portrait.png'}}	ACTION_IMAGE_CAPTURE-336-ACTION_OPEN_CONTENT-1	['ACTION_INSERT_EVENT', 'ACTION_VIEW_CONTACT', 'ACTION_GET_RINGTONE', 'get_contact_info', 'ACTION_OPEN_CONTENT']
['turn 1: Can you please take a snapshot and save to content://files/mydocs/invoice.jpg? -> Snapshot captured successfully and stored at content://files/mydocs/invoice.jpg.']	Open it for me	Open content://files/mydocs/invoice.jpg for me	{'plan': 'ACTION_OPEN_CONTENT', 'arguments': {'uri': 'content://files/mydocs/invoice.jpg'}}	ACTION_IMAGE_CAPTURE-338-ACTION_OPEN_CONTENT-1	['ACTION_SHOW_ALARMS', 'play_video', 'ACTION_OPEN_DOCUMENT', 'ACTION_OPEN_CONTENT', 'INTENT_ACTION_STILL_IMAGE_CAMERA']
"[""turn 1: Kindly create an Excel spreadsheet titled Budget.xlsx. -> Your new spreadsheet 'Budget.xlsx' has been created. You can access it here: content://documents/Budget.xlsx""]"	Email it to finance@company.com with a quick note summarizing the budget.	Email content://documents/Budget.xlsx to finance@company.com with a quick note summarizing the budget.	{'plan': 'send_email', 'arguments': {'to': 'finance@company.com', 'body': 'Here is a quick summary of the budget.', 'attachments': ['content://documents/Budget.xlsx']}}	ACTION_CREATE_DOCUMENT-31-send_email-1	['ACTION_VIEW_CONTACT', 'ACTION_VIEW_EVENT', 'ACTION_VIEW_WEB_HISTORY', 'send_email', 'dial']
"[""turn 1: Generate a GIF animation file named animation.gif. -> All set! Your GIF 'animation.gif' is ready at content://documents/animation.gif""]"	Send that to design@company.com with the subject 'New animation feedback'.	Send content://documents/animation.gif to design@company.com with the subject 'New animation feedback'.	{'plan': 'send_email', 'arguments': {'to': 'design@company.com', 'subject': 'New animation feedback', 'attachments': ['content://documents/animation.gif']}}	ACTION_CREATE_DOCUMENT-32-send_email-1	['ACTION_GET_CONTENT', 'ACTION_NAVIGATE_TO_LOCATION', 'send_email', 'ACTION_EDIT_ALARM', 'ACTION_VIEW_SENT_EMAILS']
"[""turn 1: Can you help me edit the contact content://contacts/people/mary_bell? I want to add her work email mary@bellcorp.com. -> Got it, launching Mary's contact. You can add her work email mary@bellcorp.com right away.""]"	Email her a welcome note about our upcoming call.	Email mary@bellcorp.com a welcome note about our upcoming call.	{'plan': 'send_email', 'arguments': {'to': 'mary@bellcorp.com', 'body': 'a welcome note about our upcoming call.'}}	ACTION_EDIT_CONTACT-57-send_email-1	['send_email', 'ACTION_GET_RINGTONE', 'ACTION_EDIT_ALARM', 'ACTION_VIEW_EVENT', 'send_message']
['turn 1: I need to pick a single PDF file from my device for review. -> Please select a PDF document for review.']	Email it to reviewer@example.com with subject 'Review PDF' and body 'Please take a look at this PDF and let me know your feedback.'	Email the PDF document for review to reviewer@example.com with subject 'Review PDF' and body 'Please take a look at this PDF and let me know your feedback.'	{'plan': 'send_email', 'arguments': {'to': 'reviewer@example.com', 'subject': 'Review PDF', 'body': 'Please take a look at this PDF and let me know your feedback.'}}	ACTION_OPEN_DOCUMENT-111-send_email-1	['open_settings', 'send_email', 'ACTION_SHOW_ALARMS', 'launch_application', 'ACTION_EDIT_CONTACT']
['turn 1: Open a single PNG or JPEG image for editing in the app. -> Choose a PNG or JPEG image to edit.']	Email it to creative@example.com with subject 'Logo' and body 'Here's the image for editing.'	Email a PNG or JPEG image to creative@example.com with subject 'Logo' and body 'Here's the image for editing.'	"{'plan': 'send_email', 'arguments': {'to': 'creative@example.com', 'subject': 'Logo', 'body': ""Here's the image for editing.""}}"	ACTION_OPEN_DOCUMENT-113-send_email-1	['get_contact_info_from_uri', 'ACTION_SHOW_TIMERS', 'send_email', 'play_music', 'ACTION_OPEN_CONTENT']
['turn 1: Let me pick an MP3 from my music library. -> Opening your music library—please select the MP3 file you’d like.']	Email it to jane@domain.com	Email the MP3 file from my music library to jane@domain.com	{'plan': 'send_email', 'arguments': {'to': 'jane@domain.com'}}	ACTION_GET_CONTENT-176-send_email-1	['ACTION_VIEW_WEB_HISTORY', 'ACTION_OPEN_CONTENT', 'ACTION_SHOW_TIMERS', 'send_email', 'ACTION_OPEN_DOCUMENT']
['turn 1: Could you let me choose multiple text files for batch processing? -> Sure thing! Select all the text files you want to include.']	Email them to editor@company.com	Email all the text files you want to include to editor@company.com	{'plan': 'send_email', 'arguments': {'to': 'editor@company.com'}}	ACTION_GET_CONTENT-177-send_email-1	['ACTION_VIEW_RECENT_APPS', 'send_email', 'ACTION_NAVIGATE_TO_LOCATION', 'ACTION_VIEW_CALL_LOG', 'web_search']
['turn 1: Please open the PDF located at content://documents/report2023.pdf -> Sure, opening your PDF now: content://documents/report2023.pdf.']	Email it to sarah@example.com with 'I reviewed the report' in the body	Email content://documents/report2023.pdf to sarah@example.com with 'I reviewed the report' in the body	{'plan': 'send_email', 'arguments': {'to': 'sarah@example.com', 'body': 'I reviewed the report', 'attachments': ['content://documents/report2023.pdf']}}	ACTION_OPEN_CONTENT-221-send_email-1	['play_music', 'ACTION_VIEW_RECENT_APPS', 'send_email', 'ACTION_VIEW_CALL_LOG', 'ACTION_SHOW_ALARMS']
['turn 1: Could you display the image stored at content://gallery/sunset.jpg? -> All set! Displaying the image from content://gallery/sunset.jpg.']	Email it to dad@example.com with subject 'Beautiful sunset'	Email content://gallery/sunset.jpg to dad@example.com with subject 'Beautiful sunset'	{'plan': 'send_email', 'arguments': {'to': 'dad@example.com', 'subject': 'Beautiful sunset', 'attachments': ['content://gallery/sunset.jpg']}}	ACTION_OPEN_CONTENT-222-send_email-1	['send_message', 'ACTION_SET_TIMER', 'send_email', 'ACTION_OPEN_DOCUMENT', 'ACTION_SHOW_TIMERS']
['turn 1: Take a photo using my camera. -> Sure—opening the camera now. Get ready to snap your photo!']	After you capture it, email it to john@example.com with subject 'My Photo' and say 'Here’s the shot'.	After you capture the photo, email the photo to john@example.com with subject 'My Photo' and say 'Here’s the shot'.	{'plan': 'send_email', 'arguments': {'to': 'john@example.com', 'subject': 'My Photo', 'body': 'Here’s the shot'}}	ACTION_IMAGE_CAPTURE-326-send_email-1	['INTENT_ACTION_STILL_IMAGE_CAMERA', 'send_email', 'ACTION_SET_ALARM', 'ACTION_SET_RINGTONE', 'get_contact_info']
['turn 1: Could you snap a quick pic of what you see? -> On it—opening the camera for a quick snapshot.']	After you take it, email it to me at me@example.com with subject 'Quick Pic'.	After you take the quick snapshot, email the quick snapshot to me@example.com with subject 'Quick Pic'.	{'plan': 'send_email', 'arguments': {'to': 'me@example.com', 'subject': 'Quick Pic'}}	ACTION_IMAGE_CAPTURE-328-send_email-1	['ACTION_VIEW_SENT_MESSAGES', 'get_contact_info_from_uri', 'send_email', 'open_settings', 'dial']
"[""turn 1: I need to add Karen Page's contact, only her email karen.page@journal.com. -> Opening a new contact for Karen Page with her email (karen.page@journal.com) prefilled.""]"	Email her	Email karen.page@journal.com	{'plan': 'send_email', 'arguments': {'to': 'karen.page@journal.com'}}	ACTION_INSERT_CONTACT-391-send_email-1	['ACTION_VIEW_RECENT_APPS', 'send_message', 'get_contact_info_from_uri', 'ACTION_VIEW_EVENT', 'send_email']
"['turn 1: Could you schedule a one-hour brainstorming session for next Tuesday at 2 pm in Zoom Room A titled \'Project Alpha Brainstorm\' with description \'Initial idea generation for Project Alpha\'? -> Great! ""Project Alpha Brainstorm"" is on your calendar for April 16, 2024 at 2:00\xa0PM in Zoom Room A. Here\'s the event link: content://calendar/event/1']"	Email it to project.alpha@company.com with subject Project Alpha Brainstorm info and body Let me know if you have questions.	Email content://calendar/event/1 to project.alpha@company.com with subject Project Alpha Brainstorm info and body Let me know if you have questions.	{'plan': 'send_email', 'arguments': {'to': 'project.alpha@company.com', 'subject': 'Project Alpha Brainstorm info', 'body': 'Let me know if you have questions.', 'attachments': ['content://calendar/event/1']}}	ACTION_INSERT_EVENT-436-send_email-1	['send_email', 'ACTION_VIEW_EVENT', 'ACTION_OPEN_CONTENT', 'open_settings', 'ACTION_SET_TIMER']
"['turn 1: I need a calendar entry on May 1, 2024 at 9:00 AM for an annual check-up with Dr. Smith at the Downtown Clinic. -> All set: ""Doctor Appointment"" is scheduled for May 1, 2024 at 9:00\xa0AM at Downtown Clinic. Check it here: content://calendar/event/2']"	Send it to jane.doe@example.com with subject Upcoming Doctor Appointment and body Please confirm your availability.	Send content://calendar/event/2 to jane.doe@example.com with subject Upcoming Doctor Appointment and body Please confirm your availability.	{'plan': 'send_email', 'arguments': {'to': 'jane.doe@example.com', 'subject': 'Upcoming Doctor Appointment', 'body': 'Please confirm your availability.', 'attachments': ['content://calendar/event/2']}}	ACTION_INSERT_EVENT-437-send_email-1	['ACTION_VIEW_WEB_HISTORY', 'ACTION_EDIT_DOCUMENT', 'get_contact_info_from_uri', 'send_email', 'ACTION_SHOW_TIMERS']
['turn 1: Record a short video clip of my surroundings. -> All set—your surroundings clip is saved to content://videos/surroundings_002.mp4.']	Send that surroundings clip to john@example.com with subject 'Surroundings Clip'	Send content://videos/surroundings_002.mp4 to john@example.com with subject 'Surroundings Clip'	{'plan': 'send_email', 'arguments': {'to': 'john@example.com', 'subject': 'Surroundings Clip', 'attachments': ['content://videos/surroundings_002.mp4']}}	ACTION_VIDEO_CAPTURE-707-send_email-1	['open_settings', 'ACTION_GET_CONTENT', 'send_email', 'web_search', 'ACTION_PICK']
"[""turn 1: Start recording video now. -> I've captured your video. Check it out here: content://videos/recording_003.mp4.""]"	Email it to editor@publish.com	Email content://videos/recording_003.mp4 to editor@publish.com	{'plan': 'send_email', 'arguments': {'to': 'editor@publish.com', 'attachments': ['content://videos/recording_003.mp4']}}	ACTION_VIDEO_CAPTURE-709-send_email-1	['ACTION_GET_CONTENT', 'send_email', 'ACTION_PICK', 'ACTION_EDIT_DOCUMENT', 'ACTION_EDIT_VIDEO']
"[""turn 1: Can you retrieve the email address of the contact for this URI: content://contacts/people/23? -> Sure thing—I've pulled up the email for that contact. It’s jane.doe23@example.com.""]"	Send her an email reminding her of our appointment tomorrow.	Send jane.doe23@example.com an email reminding her of our appointment tomorrow.	{'plan': 'send_email', 'arguments': {'to': 'jane.doe23@example.com', 'body': 'reminding you of our appointment tomorrow'}}	get_contact_info-968-send_email-1	['send_email', 'ACTION_VIEW_CONTACT', 'search_location', 'ACTION_VIEW_SENT_MESSAGES', 'ACTION_SET_ALARM']
['turn 1: Pull up the personal email tied to content://com.android.contacts/contacts/789/data/email_personal. -> Got it! The personal email for that contact is jane.smith@example.com.']	Shoot her a quick email now.	Shoot jane.smith@example.com a quick email now.	{'plan': 'send_email', 'arguments': {'to': 'jane.smith@example.com'}}	get_contact_info_from_uri-1043-send_email-1	['ACTION_SET_ALARM', 'send_email', 'ACTION_SHOW_ALARMS', 'get_contact_info_from_uri', 'ACTION_OPEN_DOCUMENT']
"[""turn 1: Kindly create an Excel spreadsheet titled Budget.xlsx. -> Your new spreadsheet 'Budget.xlsx' has been created. You can access it here: content://documents/Budget.xlsx""]"	Text it to Alice saying 'Please review the budget spreadsheet.'	Text content://documents/Budget.xlsx to Alice saying 'Please review the budget spreadsheet.'	{'plan': 'send_message', 'arguments': {'to': 'Alice', 'message': 'Please review the budget spreadsheet.', 'attachments': ['content://documents/Budget.xlsx']}}	ACTION_CREATE_DOCUMENT-31-send_message-1	['ACTION_EDIT_VIDEO', 'send_email', 'ACTION_INSERT_EVENT', 'ACTION_VIEW_CONTACT', 'send_message']
"[""turn 1: Generate a GIF animation file named animation.gif. -> All set! Your GIF 'animation.gif' is ready at content://documents/animation.gif""]"	Send it to Mark saying 'Here's the animation for the presentation!'	Send content://documents/animation.gif to Mark saying 'Here's the animation for the presentation!'	"{'plan': 'send_message', 'arguments': {'to': 'Mark', 'message': ""Here's the animation for the presentation!"", 'attachments': ['content://documents/animation.gif']}}"	ACTION_CREATE_DOCUMENT-32-send_message-1	['ACTION_INSERT_EVENT', 'ACTION_OPEN_CONTENT', 'ACTION_CREATE_DOCUMENT', 'send_message', 'ACTION_GET_RINGTONE']
"[""turn 1: I need to change John’s phone number to 555-1234 for his contact (content://contacts/people/john). Can you do that? -> Sure thing! Opening John's contact now so you can update his phone number to 555‑1234.""]"	Send him a message saying 'Hi John, I've updated your number to 555-1234.'	Send John a message saying 'Hi John, I've updated your number to 555-1234.'	"{'plan': 'send_message', 'arguments': {'to': 'John', 'message': ""Hi John, I've updated your number to 555-1234.""}}"	ACTION_EDIT_CONTACT-56-send_message-1	['ACTION_GET_CONTENT', 'ACTION_VIEW_SENT_MESSAGES', 'ACTION_SET_RINGTONE', 'send_message', 'ACTION_VIEW_CALL_LOG']
"[""turn 1: Can you help me edit the contact content://contacts/people/mary_bell? I want to add her work email mary@bellcorp.com. -> Got it, launching Mary's contact. You can add her work email mary@bellcorp.com right away.""]"	Send her a reminder message asking if she saw my email.	Send content://contacts/people/mary_bell a reminder message asking if she saw my email.	{'plan': 'send_message', 'arguments': {'to': 'content://contacts/people/mary_bell', 'message': 'Did you see my email?'}}	ACTION_EDIT_CONTACT-57-send_message-1	['ACTION_SET_TIMER', 'ACTION_VIEW_CALL_LOG', 'ACTION_VIEW_PLAYLIST', 'send_message', 'ACTION_VIEW_CONTACT']
['turn 1: Select a video file of any format to preview. -> Please select a video file to preview.']	Send it to Dave in a text message saying 'Check this video.'	Send a video file to Dave in a text message saying 'Check this video.'	{'plan': 'send_message', 'arguments': {'to': 'Dave', 'message': 'Check this video.'}}	ACTION_OPEN_DOCUMENT-117-send_message-1	['send_message', 'ACTION_GET_CONTENT', 'ACTION_VIEW_CONTACT', 'ACTION_GET_RINGTONE', 'ACTION_VIEW_SENT_EMAILS']
['turn 1: Let me pick an MP3 from my music library. -> Opening your music library—please select the MP3 file you’d like.']	Text it to me saying 'Here's the song I picked.'	Text the MP3 file I picked to me saying 'Here's the song I picked.'	"{'plan': 'send_message', 'arguments': {'to': 'me', 'message': ""Here's the song I picked."", 'attachments': ['the MP3 file I picked']}}"	ACTION_GET_CONTENT-176-send_message-1	['ACTION_VIEW_CONTACT', 'ACTION_VIEW_PLAYLIST', 'ACTION_OPEN_DOCUMENT', 'send_email', 'send_message']
['turn 1: Could you let me choose multiple text files for batch processing? -> Sure thing! Select all the text files you want to include.']	Send them to me saying 'Batch files attached.'	Send all the text files you want to include to me saying 'Batch files attached.'	{'plan': 'send_message', 'arguments': {'to': 'me', 'message': 'Batch files attached.', 'attachments': ['all the text files you want to include']}}	ACTION_GET_CONTENT-177-send_message-1	['INTENT_ACTION_VIDEO_CAMERA', 'send_message', 'ACTION_IMAGE_CAPTURE', 'INTENT_ACTION_STILL_IMAGE_CAMERA', 'ACTION_GET_CONTENT']
