conversation_history	query	rewrited_query	answer	unique_idx	candidates
['turn 1: Please let me choose a new ringtone for my alarm. -> Great! Opening your ringtone picker so you can select a new alarm tone.']	Set an alarm for 6:30 AM using it	Set an alarm for 6:30 AM using alarm tone	{'plan': 'ACTION_SET_ALARM', 'arguments': {'EXTRA_HOUR': 6, 'EXTRA_MINUTES': 30}}	ACTION_GET_RINGTONE-276-ACTION_SET_ALARM-1	['ACTION_EDIT_VIDEO', 'get_contact_info_from_uri', 'ACTION_NAVIGATE_TO_LOCATION', 'ACTION_VIDEO_CAPTURE', 'ACTION_SET_ALARM']
['turn 1: I want to select a ringtone from my device to set as my wake‑up tone. -> Sure thing—launching the ringtone selection interface for your wake‑up tone now.']	Wake me up at 7:45 tomorrow with it	Wake me up at 7:45 tomorrow with a ringtone from my device	{'plan': 'ACTION_SET_ALARM', 'arguments': {'EXTRA_HOUR': 7, 'EXTRA_MINUTES': 45}}	ACTION_GET_RINGTONE-277-ACTION_SET_ALARM-1	['ACTION_VIEW_SENT_MESSAGES', 'get_contact_info_from_uri', 'ACTION_SET_ALARM', 'send_email', 'ACTION_EDIT_VIDEO']
['turn 1: Could you open the ringtone picker so I can pick a sound? -> Absolutely, opening the ringtone picker so you can choose your preferred sound.']	Schedule a daily alarm at 8:00 using it	Schedule a daily alarm at 8:00 using the ringtone picker	{'plan': 'ACTION_SET_ALARM', 'arguments': {'EXTRA_HOUR': 8, 'EXTRA_MINUTES': 0, 'EXTRA_DAYS': ['Monday', 'Tuesday', 'Wednesday', 'Thursday', 'Friday', 'Saturday', 'Sunday']}}	ACTION_GET_RINGTONE-278-ACTION_SET_ALARM-1	['ACTION_VIEW_SENT_EMAILS', 'play_video', 'ACTION_OPEN_DOCUMENT', 'ACTION_SET_ALARM', 'ACTION_IMAGE_CAPTURE']
['turn 1: Pick an alarm tone for me. -> Alright, here’s the list of alarm tones—go ahead and pick the one you like.']	Set a repeating alarm for weekdays at 6:15 AM with it	Set a repeating alarm for weekdays at 6:15 AM with an alarm tone from the list of alarm tones.	{'plan': 'ACTION_SET_ALARM', 'arguments': {'EXTRA_HOUR': 6, 'EXTRA_MINUTES': 15, 'EXTRA_DAYS': ['Monday', 'Tuesday', 'Wednesday', 'Thursday', 'Friday']}}	ACTION_GET_RINGTONE-279-ACTION_SET_ALARM-1	['ACTION_EDIT_DOCUMENT', 'open_settings', 'ACTION_SET_ALARM', 'search_location', 'play_video']
['turn 1: Open the ringtone browser so I can pick one for notifications. -> Ringtone selected: content://media/ringtone/alarm_classic.mp3']	Go ahead and apply it as my default ringtone	Go ahead and apply content://media/ringtone/alarm_classic.mp3 as my default ringtone	{'plan': 'ACTION_SET_RINGTONE', 'arguments': {'ringtone_uri': 'content://media/ringtone/alarm_classic.mp3'}}	ACTION_GET_RINGTONE-296-ACTION_SET_RINGTONE-1	['ACTION_SET_RINGTONE', 'ACTION_VIEW_PLAYLIST', 'ACTION_GET_RINGTONE', 'ACTION_GET_CONTENT', 'ACTION_VIEW_SENT_MESSAGES']
['turn 1: Provide me with the option to select a notification tone. -> Notification tone chosen: content://media/ringtone/modern_beats.mp3']	Make that my notification ringtone	Make content://media/ringtone/modern_beats.mp3 my notification ringtone	{'plan': 'ACTION_SET_RINGTONE', 'arguments': {'ringtone_uri': 'content://media/ringtone/modern_beats.mp3'}}	ACTION_GET_RINGTONE-297-ACTION_SET_RINGTONE-1	['ACTION_GET_RINGTONE', 'ACTION_VIEW_CONTACT', 'ACTION_SHOW_ALARMS', 'ACTION_SET_RINGTONE', 'search_location']
['turn 1: I need a fresh wake‑up tone, show me all my ringtone options. -> Selected wake-up ringtone: content://media/internal/audio/media/45']	Use it for my wake‑up tone	Use content://media/internal/audio/media/45 for my wake‑up tone	{'plan': 'ACTION_SET_RINGTONE', 'arguments': {'ringtone_uri': 'content://media/internal/audio/media/45'}}	ACTION_GET_RINGTONE-298-ACTION_SET_RINGTONE-1	['ACTION_VIEW_SENT_MESSAGES', 'ACTION_EDIT_ALARM', 'ACTION_VIDEO_CAPTURE', 'ACTION_SET_RINGTONE', 'ACTION_VIEW_WEB_HISTORY']
['turn 1: Launch the ringtone selector now. -> Ringtone chosen: content://media/ringtone/morning_glory.mp3']	Apply that as my new ringtone	Apply content://media/ringtone/morning_glory.mp3 as my new ringtone	{'plan': 'ACTION_SET_RINGTONE', 'arguments': {'ringtone_uri': 'content://media/ringtone/morning_glory.mp3'}}	ACTION_GET_RINGTONE-299-ACTION_SET_RINGTONE-1	['ACTION_SET_RINGTONE', 'ACTION_CREATE_DOCUMENT', 'ACTION_EDIT_VIDEO', 'ACTION_OPEN_DOCUMENT', 'ACTION_OPEN_CONTENT']
['turn 1: Let me choose an alarm ringtone from my collection. -> Alarm ringtone picked: content://media/ringtone/gentle_alarm.mp3']	Set it as my alarm ringtone.	Set content://media/ringtone/gentle_alarm.mp3 as my alarm ringtone.	{'plan': 'ACTION_SET_RINGTONE', 'arguments': {'ringtone_uri': 'content://media/ringtone/gentle_alarm.mp3'}}	ACTION_GET_RINGTONE-301-ACTION_SET_RINGTONE-1	['ACTION_VIEW_PLAYLIST', 'ACTION_CREATE_DOCUMENT', 'ACTION_EDIT_ALARM', 'ACTION_SET_RINGTONE', 'ACTION_SET_TIMER']
['turn 1: Enable the ringtone selection UI for my morning alarm. -> Morning alarm tone set to: content://media/ringtone/sunrise_tune.mp3']	Set it as my morning alarm ringtone	Set content://media/ringtone/sunrise_tune.mp3 as my morning alarm ringtone	{'plan': 'ACTION_SET_RINGTONE', 'arguments': {'ringtone_uri': 'content://media/ringtone/sunrise_tune.mp3'}}	ACTION_GET_RINGTONE-300-ACTION_SET_RINGTONE-1	['INTENT_ACTION_VIDEO_CAMERA', 'ACTION_SET_RINGTONE', 'launch_application', 'ACTION_EDIT_DOCUMENT', 'send_message']
['turn 1: Access my ringtones so I can set one as the new alarm sound. -> New alarm sound selected: content://media/internal/audio/media/12']	Make it my new alarm sound.	Make content://media/internal/audio/media/12 my new alarm sound.	{'plan': 'ACTION_SET_RINGTONE', 'arguments': {'ringtone_uri': 'content://media/internal/audio/media/12'}}	ACTION_GET_RINGTONE-302-ACTION_SET_RINGTONE-1	['ACTION_EDIT_DOCUMENT', 'web_search', 'ACTION_GET_RINGTONE', 'ACTION_SET_RINGTONE', 'ACTION_SET_TIMER']
"[""turn 1: I want to save Maya Lopez's birthday as May 10, 1995. -> All set! Maya Lopez’s contact (birthday: May\xa010,\xa01995) has been created. You can view it here: content://contacts/people/maya_lopez""]"	Add an email to it: maya.lopez@example.com	Add an email to content://contacts/people/maya_lopez: maya.lopez@example.com	{'plan': 'ACTION_EDIT_CONTACT', 'arguments': {'contact_uri': 'content://contacts/people/maya_lopez', 'contact_info': {'email': 'maya.lopez@example.com'}}}	ACTION_INSERT_CONTACT-401-ACTION_EDIT_CONTACT-1	['ACTION_VIEW_CONTACT', 'ACTION_VIEW_PLAYLIST', 'ACTION_OPEN_CONTENT', 'ACTION_VIEW_RECENT_APPS', 'ACTION_EDIT_CONTACT']
['turn 1: Save Carlos Mendoza; tel: 333-222-1111; address is 789 Vinegar Hill Rd. -> Carlos Mendoza has been saved to your contacts: content://contacts/people/carlos_mendoza']	Add company info to it: Acme Corp.	Add company info to content://contacts/people/carlos_mendoza: Acme Corp.	{'plan': 'ACTION_EDIT_CONTACT', 'arguments': {'contact_uri': 'content://contacts/people/carlos_mendoza', 'contact_info': {'company': 'Acme Corp'}}}	ACTION_INSERT_CONTACT-404-ACTION_EDIT_CONTACT-1	['ACTION_INSERT_CONTACT', 'ACTION_EDIT_CONTACT', 'INTENT_ACTION_VIDEO_CAMERA', 'ACTION_VIEW_CONTACT', 'play_music']
['turn 1: Add Sam Wilson with number 777-888-9999, and birthday June 30, 1985. -> Sam\xa0Wilson’s contact (phone & birthday) saved successfully! content://contacts/people/sam_wilson']	Add email to that: 'sam.wilson@example.com'	Add email to content://contacts/people/sam_wilson: 'sam.wilson@example.com'	{'plan': 'ACTION_EDIT_CONTACT', 'arguments': {'contact_uri': 'content://contacts/people/sam_wilson', 'contact_info': {'email': 'sam.wilson@example.com'}}}	ACTION_INSERT_CONTACT-406-ACTION_EDIT_CONTACT-1	['send_email', 'ACTION_EDIT_CONTACT', 'ACTION_VIEW_RECENT_APPS', 'launch_application', 'ACTION_SET_ALARM']
"[""turn 1: I'd like to add Natasha Romanoff, with email natasha@shield.gov, company Shield, note 'Black Widow agent'. -> Contact for Natasha\xa0Romanoff created: content://contacts/people/natasha_romanoff""]"	Add phone number on that: 555-123-4567	Add phone number on content://contacts/people/natasha_romanoff: 555-123-4567	{'plan': 'ACTION_EDIT_CONTACT', 'arguments': {'contact_uri': 'content://contacts/people/natasha_romanoff', 'contact_info': {'phone': '555-123-4567'}}}	ACTION_INSERT_CONTACT-407-ACTION_EDIT_CONTACT-1	['ACTION_VIDEO_CAPTURE', 'ACTION_SET_TIMER', 'INTENT_ACTION_STILL_IMAGE_CAMERA', 'ACTION_SHOW_TIMERS', 'ACTION_EDIT_CONTACT']
['turn 1: Fetch the details for the person whose contact is content://contacts/people/1033. -> Here you go: details for content://contacts/people/1033 are now open.']	Add work email work@example.com to it	Add work email work@example.com to content://contacts/people/1033	{'plan': 'ACTION_EDIT_CONTACT', 'arguments': {'contact_uri': 'content://contacts/people/1033', 'contact_info': {'email': 'work@example.com'}}}	ACTION_VIEW_CONTACT-784-ACTION_EDIT_CONTACT-1	['ACTION_SET_TIMER', 'play_music', 'ACTION_EDIT_CONTACT', 'ACTION_VIEW_RECENT_APPS', 'ACTION_OPEN_CONTENT']
['turn 1: Would you bring up the entry stored at content://contacts/people/1034? -> Bringing up the entry at content://contacts/people/1034.']	Change its phone number to 555-1234	Change the phone number of the entry at content://contacts/people/1034 to 555-1234	{'plan': 'ACTION_EDIT_CONTACT', 'arguments': {'contact_uri': 'content://contacts/people/1034', 'contact_info': {'phone': '555-1234'}}}	ACTION_VIEW_CONTACT-785-ACTION_EDIT_CONTACT-1	['ACTION_INSERT_EVENT', 'ACTION_SET_RINGTONE', 'ACTION_EDIT_CONTACT', 'ACTION_VIEW_CALL_LOG', 'ACTION_NAVIGATE_TO_LOCATION']
"['turn 1: Could you schedule a one-hour brainstorming session for next Tuesday at 2 pm in Zoom Room A titled \'Project Alpha Brainstorm\' with description \'Initial idea generation for Project Alpha\'? -> Great! ""Project Alpha Brainstorm"" is on your calendar for April 16, 2024 at 2:00\xa0PM in Zoom Room A. Here\'s the event link: content://calendar/event/1']"	Can you show me that event on my calendar?	Can you show me content://calendar/event/1 on my calendar?	{'plan': 'ACTION_VIEW_EVENT', 'arguments': {'event_uri': 'content://calendar/event/1'}}	ACTION_INSERT_EVENT-436-ACTION_VIEW_EVENT-1	['ACTION_VIEW_CALL_LOG', 'ACTION_OPEN_DOCUMENT', 'ACTION_VIEW_EVENT', 'INTENT_ACTION_VIDEO_CAMERA', 'ACTION_EDIT_CONTACT']
"['turn 1: I need a calendar entry on May 1, 2024 at 9:00 AM for an annual check-up with Dr. Smith at the Downtown Clinic. -> All set: ""Doctor Appointment"" is scheduled for May 1, 2024 at 9:00\xa0AM at Downtown Clinic. Check it here: content://calendar/event/2']"	Can you show me the details for that appointment?	Can you show me the details for content://calendar/event/2?	{'plan': 'ACTION_VIEW_EVENT', 'arguments': {'event_uri': 'content://calendar/event/2'}}	ACTION_INSERT_EVENT-437-ACTION_VIEW_EVENT-1	['get_contact_info', 'ACTION_SET_TIMER', 'play_video', 'get_contact_info_from_uri', 'ACTION_VIEW_EVENT']
"['turn 1: Set up a yoga class on June 10th, 2024 from 6 PM to 7 PM at Sunrise Yoga Studio. It\'s a Vinyasa flow session. -> Done – ""Yoga Class"" is locked in for June 10, 2024 at 6:00\xa0PM at Sunrise Yoga Studio. View it here: content://calendar/event/3']"	Let me view that yoga class.	Let me view content://calendar/event/3 yoga class.	{'plan': 'ACTION_VIEW_EVENT', 'arguments': {'event_uri': 'content://calendar/event/3'}}	ACTION_INSERT_EVENT-438-ACTION_VIEW_EVENT-1	['ACTION_VIEW_WEB_HISTORY', 'ACTION_EDIT_CONTACT', 'ACTION_VIEW_EVENT', 'ACTION_SET_ALARM', 'ACTION_EDIT_ALARM']
"['turn 1: Add to my calendar: Lunch with Sarah at Cafe Roma on July 4, 2024, starting at noon for an hour and a half. We need to catch up over lunch. -> Your ""Lunch with Sarah"" is booked for July 4, 2024 at 12:00\xa0PM at Cafe Roma. Here\'s the event URI: content://calendar/event/4']"	Please open that lunch meeting.	Please open content://calendar/event/4 lunch meeting.	{'plan': 'ACTION_VIEW_EVENT', 'arguments': {'event_uri': 'content://calendar/event/4'}}	ACTION_INSERT_EVENT-439-ACTION_VIEW_EVENT-1	['ACTION_VIEW_EVENT', 'ACTION_SET_ALARM', 'ACTION_VIEW_WEB_HISTORY', 'ACTION_VIEW_SENT_MESSAGES', 'get_contact_info']
"['turn 1: Please create an event titled \'AI Trends Webinar\' on August 15, 2024 from 8:00 to 9:00 AM online, with description \'Join online webinar on latest AI developments\'. -> Success! ""AI Trends Webinar"" is on your calendar for August 15, 2024 at 8:00\xa0AM (online). Access it here: content://calendar/event/5']"	I'd like to see that webinar event.	I'd like to see content://calendar/event/5 webinar event.	{'plan': 'ACTION_VIEW_EVENT', 'arguments': {'event_uri': 'content://calendar/event/5'}}	ACTION_INSERT_EVENT-440-ACTION_VIEW_EVENT-1	['ACTION_EDIT_DOCUMENT', 'ACTION_EDIT_VIDEO', 'ACTION_CREATE_DOCUMENT', 'ACTION_OPEN_CONTENT', 'ACTION_VIEW_EVENT']
"['turn 1: Put a deadline for the project final report on September 1, 2024 at 5 PM lasting an hour, description \'Submit final report to management\'. -> Got it – ""Project Final Report Deadline"" is set for September 1, 2024 at 5:00\xa0PM. Here’s the link: content://calendar/event/6']"	Show me the details for it.	Show me the details for content://calendar/event/6.	{'plan': 'ACTION_VIEW_EVENT', 'arguments': {'event_uri': 'content://calendar/event/6'}}	ACTION_INSERT_EVENT-441-ACTION_VIEW_EVENT-1	['ACTION_VIEW_CONTACT', 'ACTION_PICK', 'ACTION_VIEW_WEB_HISTORY', 'ACTION_VIEW_SENT_EMAILS', 'ACTION_VIEW_EVENT']
"['turn 1: Schedule \'Thanksgiving Dinner\' on November 22, 2024 from 11:00 AM to 1:00 PM at Mom\'s House for a family gathering. -> Your ""Thanksgiving Dinner"" is confirmed for November 22, 2024 at 11:00\xa0AM at Mom’s House. Tap here for details: content://calendar/event/8']"	View its details for me.	View content://calendar/event/8 details for me.	{'plan': 'ACTION_VIEW_EVENT', 'arguments': {'event_uri': 'content://calendar/event/8'}}	ACTION_INSERT_EVENT-443-ACTION_VIEW_EVENT-1	['ACTION_VIEW_RECENT_APPS', 'ACTION_VIEW_EVENT', 'ACTION_GET_CONTENT', 'ACTION_SET_ALARM', 'ACTION_CREATE_DOCUMENT']
"['turn 1: I\'d like to plan a movie night at Grand Cinema on October 10, 2024 beginning at 8 PM until 11 PM to watch the new sci-fi film with friends. -> All right! ""Movie Night"" is scheduled for October 10, 2024 from 8:00\xa0PM to 11:00\xa0PM at Grand Cinema. See it here: content://calendar/event/7']"	Open that event so I can see the info.	Open content://calendar/event/7 so I can see the info.	{'plan': 'ACTION_VIEW_EVENT', 'arguments': {'event_uri': 'content://calendar/event/7'}}	ACTION_INSERT_EVENT-442-ACTION_VIEW_EVENT-1	['ACTION_OPEN_CONTENT', 'launch_application', 'ACTION_VIEW_EVENT', 'ACTION_VIEW_WEB_HISTORY', 'ACTION_INSERT_EVENT']
"['turn 1: Create an event for a New Year\'s Party at Main Hall on December 31, 2024 starting at 10:00 PM and ending at 1:00 AM. -> Cheers! ""New Year\'s Party"" is on for December 31, 2024 at 10:00\xa0PM in Main Hall. Access it here: content://calendar/event/9']"	Let me see that event.	Let me see content://calendar/event/9.	{'plan': 'ACTION_VIEW_EVENT', 'arguments': {'event_uri': 'content://calendar/event/9'}}	ACTION_INSERT_EVENT-444-ACTION_VIEW_EVENT-1	['get_contact_info', 'web_search', 'ACTION_VIEW_EVENT', 'get_contact_info_from_uri', 'ACTION_SET_RINGTONE']
"['turn 1: Please add a \'Morning Run\' on December 15, 2024 from 7:00 to 8:00 AM with description \'5km run around the park\'. -> All set: ""Morning Run"" scheduled for December 15, 2024 from 7:00\xa0AM to 8:00\xa0AM. Here\'s the event link: content://calendar/event/10']"	Could you display that event?	Could you display content://calendar/event/10?	{'plan': 'ACTION_VIEW_EVENT', 'arguments': {'event_uri': 'content://calendar/event/10'}}	ACTION_INSERT_EVENT-445-ACTION_VIEW_EVENT-1	['INTENT_ACTION_STILL_IMAGE_CAMERA', 'dial', 'ACTION_VIEW_EVENT', 'play_music', 'ACTION_VIEW_PLAYLIST']
"[""turn 1: Could you book 'Design Workshop' on September 10, 2024 at 1:00 PM to 4:00 PM in Room 202? Desc: Work on new UI mockups. -> Your “Design Workshop” has been scheduled for September 10, 2024, 1:00\xa0PM–4:00\xa0PM in Room\xa0202. You can view it here: content://calendar/event/1""]"	Can you show me the details of that event?	Can you show me the details of content://calendar/event/1?	{'plan': 'ACTION_VIEW_EVENT', 'arguments': {'event_uri': 'content://calendar/event/1'}}	ACTION_INSERT_EVENT-456-ACTION_VIEW_EVENT-2	['ACTION_VIEW_CALL_LOG', 'ACTION_GET_RINGTONE', 'open_settings', 'web_search', 'ACTION_VIEW_EVENT']
"[""turn 1: Please log a jog: 'Park Run' on May 20, 2024 from 6:00-7:00 AM with description '5K tempo run'. -> Got it—“Park Run” (5K tempo run) on May 20, 2024, from 6:00\xa0AM to 7:00\xa0AM is in your calendar now. See details: content://calendar/event/2""]"	Open it.	Open content://calendar/event/2.	{'plan': 'ACTION_VIEW_EVENT', 'arguments': {'event_uri': 'content://calendar/event/2'}}	ACTION_INSERT_EVENT-457-ACTION_VIEW_EVENT-1	['ACTION_VIEW_PLAYLIST', 'ACTION_VIEW_RECENT_APPS', 'ACTION_VIEW_EVENT', 'ACTION_INSERT_EVENT', 'ACTION_SET_RINGTONE']
"[""turn 1: Create a calendar entry for 'Board Meeting' on November 8, 2024, 9:30 AM to 12:00 PM at Headquarters, details: 'Quarterly board review'. -> Done! ‘Board Meeting’ (Quarterly board review) is set for November 8, 2024, 9:30\xa0AM–12:00\xa0PM at Headquarters. View it here: content://calendar/event/3""]"	What are the details of that meeting?	What are the details of content://calendar/event/3?	{'plan': 'ACTION_VIEW_EVENT', 'arguments': {'event_uri': 'content://calendar/event/3'}}	ACTION_INSERT_EVENT-458-ACTION_VIEW_EVENT-1	['ACTION_SET_RINGTONE', 'ACTION_CREATE_DOCUMENT', 'ACTION_VIEW_EVENT', 'ACTION_INSERT_EVENT', 'ACTION_VIEW_SENT_EMAILS']
"[""turn 1: I need an event 'Dentist Check-Up' on August 1, 2024 at 11:00 AM at Smile Dental Clinic. Description: Routine cleaning. -> Your “Dentist Check-Up” on August 1, 2024 at 11:00\xa0AM at Smile Dental Clinic has been added. Check it out: content://calendar/event/4""]"	Show me that appointment.	Show me content://calendar/event/4.	{'plan': 'ACTION_VIEW_EVENT', 'arguments': {'event_uri': 'content://calendar/event/4'}}	ACTION_INSERT_EVENT-459-ACTION_VIEW_EVENT-1	['ACTION_VIEW_EVENT', 'ACTION_SHOW_ALARMS', 'ACTION_SET_RINGTONE', 'ACTION_EDIT_CONTACT', 'ACTION_VIDEO_CAPTURE']
"[""turn 1: Schedule an all-hands meeting titled 'Company Update' on July 1, 2024 from 10 AM – 11 AM. -> All-hands meeting “Company Update” is booked for July 1, 2024, 10:00\xa0AM–11:00\xa0AM. Here’s the link: content://calendar/event/5""]"	Show me this event.	Show me content://calendar/event/5.	{'plan': 'ACTION_VIEW_EVENT', 'arguments': {'event_uri': 'content://calendar/event/5'}}	ACTION_INSERT_EVENT-460-ACTION_VIEW_EVENT-1	['ACTION_SET_RINGTONE', 'search_location', 'ACTION_OPEN_DOCUMENT', 'ACTION_VIEW_EVENT', 'ACTION_IMAGE_CAPTURE']
"[""turn 1: Please put down a lunch meetup 'Catch‑Up with Sarah' on June 30, 2024 at 12:00 PM to 1:00 PM at Central Café. -> Logged: “Catch‑Up with Sarah” (Lunch meetup) on June 30, 2024, 12:00\xa0PM–1:00\xa0PM at Central\xa0Café. Details: content://calendar/event/6""]"	What are the details of the event I just created?	What are the details of content://calendar/event/6?	{'plan': 'ACTION_VIEW_EVENT', 'arguments': {'event_uri': 'content://calendar/event/6'}}	ACTION_INSERT_EVENT-461-ACTION_VIEW_EVENT-1	['ACTION_VIEW_SENT_EMAILS', 'ACTION_INSERT_EVENT', 'ACTION_SHOW_TIMERS', 'ACTION_VIEW_EVENT', 'ACTION_OPEN_DOCUMENT']
"[""turn 1: Add 'Podcast Recording' event April 22, 2025 from 9:00 to 11:00 AM, description 'Episode 10 interview with guest'. -> Added “Podcast Recording” (Episode 10 interview with guest) on April 22, 2025, 9:00\xa0AM–11:00\xa0AM. View here: content://calendar/event/7""]"	Show me its summary.	Show me the summary of content://calendar/event/7.	{'plan': 'ACTION_VIEW_EVENT', 'arguments': {'event_uri': 'content://calendar/event/7'}}	ACTION_INSERT_EVENT-462-ACTION_VIEW_EVENT-1	['ACTION_VIEW_EVENT', 'ACTION_VIEW_CONTACT', 'ACTION_SHOW_TIMERS', 'ACTION_IMAGE_CAPTURE', 'ACTION_VIEW_SENT_EMAILS']
"[""turn 1: Could you please set a yoga retreat called 'Sunset Stretch' on September 21, 2024 5:30 PM to 7:00 PM at Beachside? Description: Evening flow by the sea. -> Your yoga retreat “Sunset Stretch” is scheduled for September 21, 2024, 5:30\xa0PM–7:00\xa0PM at Beachside. See it: content://calendar/event/8""]"	Open it.	Open content://calendar/event/8.	{'plan': 'ACTION_VIEW_EVENT', 'arguments': {'event_uri': 'content://calendar/event/8'}}	ACTION_INSERT_EVENT-463-ACTION_VIEW_EVENT-1	['ACTION_OPEN_CONTENT', 'play_video', 'open_settings', 'send_email', 'ACTION_VIEW_EVENT']
"[""turn 1: Book a seminar 'Leadership Essentials' for October 15, 2024, 2PM–5PM in Hall C. Note: Management training. -> Seminar “Leadership Essentials” (Management training) on October 15, 2024, 2:00\xa0PM–5:00\xa0PM at Hall\xa0C has been added. More info: content://calendar/event/9""]"	Display its details.	Display content://calendar/event/9 details.	{'plan': 'ACTION_VIEW_EVENT', 'arguments': {'event_uri': 'content://calendar/event/9'}}	ACTION_INSERT_EVENT-464-ACTION_VIEW_EVENT-1	['ACTION_OPEN_DOCUMENT', 'ACTION_VIEW_EVENT', 'ACTION_VIDEO_CAPTURE', 'INTENT_ACTION_STILL_IMAGE_CAMERA', 'ACTION_EDIT_CONTACT']
"[""turn 1: Insert an event: 'Coffee Chat' on March 3, 2025 at 9:15 AM to 9:45 AM, description 'Casual team catch‑up'. -> Your “Coffee Chat” (Casual team catch‑up) on March 3, 2025, 9:15\xa0AM–9:45\xa0AM has been created. Access it here: content://calendar/event/10""]"	Show me more info about it.	Show me more info about content://calendar/event/10.	{'plan': 'ACTION_VIEW_EVENT', 'arguments': {'event_uri': 'content://calendar/event/10'}}	ACTION_INSERT_EVENT-465-ACTION_VIEW_EVENT-1	['ACTION_IMAGE_CAPTURE', 'play_music', 'ACTION_OPEN_DOCUMENT', 'ACTION_VIEW_EVENT', 'dial']
['turn 1: I want to schedule a Marketing Workshop on October 20, 2024, 2-4 PM, Room 301, for team training on new marketing strategies. -> Great news! The Marketing Workshop is set for October 20, 2024, from 2:00\xa0PM to 4:00\xa0PM at Room\xa0301. You can view it here: content://calendar/event/101']	Show me its details.	Show me the details of content://calendar/event/101.	{'plan': 'ACTION_VIEW_EVENT', 'arguments': {'event_uri': 'content://calendar/event/101'}}	ACTION_INSERT_EVENT-446-ACTION_VIEW_EVENT-1	['send_message', 'ACTION_NAVIGATE_TO_LOCATION', 'INTENT_ACTION_STILL_IMAGE_CAMERA', 'ACTION_VIEW_EVENT', 'search_location']
"[""turn 1: Add a staff meeting on November 5, 2024 from 9:00 AM to 5:00 PM at the Head Office Conference Room with description 'Monthly staff-wide meeting'. -> Done! Your Staff Meeting is now on November\xa05,\xa02024, 9:00\xa0AM–5:00\xa0PM at the Head Office Conference Room (Monthly staff-wide meeting). Check it out: content://calendar/event/102""]"	Open that meeting.	Open content://calendar/event/102.	{'plan': 'ACTION_VIEW_EVENT', 'arguments': {'event_uri': 'content://calendar/event/102'}}	ACTION_INSERT_EVENT-447-ACTION_VIEW_EVENT-1	['ACTION_VIEW_EVENT', 'launch_application', 'ACTION_OPEN_CONTENT', 'ACTION_INSERT_EVENT', 'ACTION_NAVIGATE_TO_LOCATION']
['turn 1: Set a customer call on December 1, 2024 at 7:30 PM for 30 minutes to discuss contract renewal. -> Your Customer Call to discuss contract renewal is scheduled for December\xa01,\xa02024 from 7:30\xa0PM to 8:00\xa0PM. Access it here: content://calendar/event/103']	Could you display it?	Could you display content://calendar/event/103?	{'plan': 'ACTION_VIEW_EVENT', 'arguments': {'event_uri': 'content://calendar/event/103'}}	ACTION_INSERT_EVENT-448-ACTION_VIEW_EVENT-1	['ACTION_VIEW_WEB_HISTORY', 'ACTION_VIEW_EVENT', 'ACTION_VIEW_RECENT_APPS', 'launch_application', 'ACTION_EDIT_VIDEO']
"[""turn 1: Book the Sales Conference on September 15, 2024 from 9:00 AM to 5:00 PM at Grand Hall, titled 'Sales Conference' and described as 'Annual regional sales conference'. -> All set—your Sales Conference is added on September\xa015,\xa02024, 9:00\xa0AM–5:00\xa0PM at Grand Hall. View details: content://calendar/event/104""]"	I'd like to view it.	I'd like to view content://calendar/event/104.	{'plan': 'ACTION_VIEW_EVENT', 'arguments': {'event_uri': 'content://calendar/event/104'}}	ACTION_INSERT_EVENT-449-ACTION_VIEW_EVENT-1	['ACTION_VIEW_SENT_MESSAGES', 'ACTION_GET_RINGTONE', 'ACTION_GET_CONTENT', 'ACTION_VIEW_EVENT', 'ACTION_VIEW_CONTACT']
['turn 1: Add a dentist appointment at Pleasant Dental Clinic on November 20, 2024 from 3:30 PM to 4:00 PM for teeth cleaning and dental check-up. -> Dentist Appointment confirmed for November\xa020,\xa02024, 3:30\xa0PM–4:00\xa0PM at Pleasant Dental Clinic. See it here: content://calendar/event/105']	Please show me the appointment.	Please show me content://calendar/event/105.	{'plan': 'ACTION_VIEW_EVENT', 'arguments': {'event_uri': 'content://calendar/event/105'}}	ACTION_INSERT_EVENT-450-ACTION_VIEW_EVENT-1	['ACTION_VIEW_EVENT', 'ACTION_CREATE_DOCUMENT', 'send_email', 'ACTION_OPEN_CONTENT', 'ACTION_IMAGE_CAPTURE']
"[""turn 1: Insert 'Run Club' event every Wednesday? Actually, just this week: April 17, 2024, 6:15 AM to 7:15 AM at Lakeside Park, desc: Interval training. -> All set! 'Run Club' is on your calendar for April 17, 2024 from 6:15\xa0AM to 7:15\xa0AM at Lakeside Park (Interval training). View it here: content://calendar/event/1""]"	Can you show me the details of it?	Can you show me the details of content://calendar/event/1?	{'plan': 'ACTION_VIEW_EVENT', 'arguments': {'event_uri': 'content://calendar/event/1'}}	ACTION_INSERT_EVENT-486-ACTION_VIEW_EVENT-1	['ACTION_VIEW_WEB_HISTORY', 'ACTION_VIEW_EVENT', 'INTENT_ACTION_STILL_IMAGE_CAMERA', 'ACTION_VIEW_RECENT_APPS', 'get_contact_info']
