conversation_history	query	rewrited_query	answer	unique_idx	candidates
['turn 1: Add Gabe Logan: cell 212-111-2222; email gabe.logan@cia.gov; website www.gabelogan.com. -> Gabe Logan is now in your contacts with his cell, email, and website. Open it here: content://contacts/people/gabe_logan']	View his info	View the info of content://contacts/people/gabe_logan	{'plan': 'ACTION_VIEW_CONTACT', 'arguments': {'contact_uri': 'content://contacts/people/gabe_logan'}}	ACTION_INSERT_CONTACT-418-ACTION_VIEW_CONTACT-1	['INTENT_ACTION_STILL_IMAGE_CAMERA', 'ACTION_OPEN_DOCUMENT', 'ACTION_VIEW_WEB_HISTORY', 'search_location', 'ACTION_VIEW_CONTACT']
"[""turn 1: Insert Nikola Tesla in contacts. His birthday is July 10, 1856 and note 'Inventor'. -> Nikola Tesla’s contact has been created with his birthday and note “Inventor.” Check it out: content://contacts/people/nikola_tesla""]"	Show his contact info	Show content://contacts/people/nikola_tesla contact info	{'plan': 'ACTION_VIEW_CONTACT', 'arguments': {'contact_uri': 'content://contacts/people/nikola_tesla'}}	ACTION_INSERT_CONTACT-420-ACTION_VIEW_CONTACT-1	['ACTION_EDIT_CONTACT', 'ACTION_SET_ALARM', 'ACTION_VIDEO_CAPTURE', 'ACTION_SET_TIMER', 'ACTION_VIEW_CONTACT']
['turn 1: Add Lily Collins with phone 212-678-9101 and email lily.collins@fame.com. -> Lily Collins has been added to your contacts. (URI: content://contacts/people/lily_collins)']	Open her contact	Open content://contacts/people/lily_collins contact	{'plan': 'ACTION_VIEW_CONTACT', 'arguments': {'contact_uri': 'content://contacts/people/lily_collins'}}	ACTION_INSERT_CONTACT-432-ACTION_VIEW_CONTACT-1	['ACTION_VIEW_CONTACT', 'web_search', 'ACTION_VIEW_CALL_LOG', 'ACTION_SET_TIMER', 'ACTION_OPEN_CONTENT']
['turn 1: Create contact Chris Evans: phone 909-080-7070; email chrise@marvel.com; address 100 Avengers Way. -> Done! New contact saved for Chris Evans. Reference URI: content://contacts/people/chris_evans']	View his profile	View content://contacts/people/chris_evans profile	{'plan': 'ACTION_VIEW_CONTACT', 'arguments': {'contact_uri': 'content://contacts/people/chris_evans'}}	ACTION_INSERT_CONTACT-433-ACTION_VIEW_CONTACT-1	['ACTION_SET_ALARM', 'ACTION_VIEW_PLAYLIST', 'ACTION_PICK', 'ACTION_VIEW_CONTACT', 'INTENT_ACTION_VIDEO_CAMERA']
"[""turn 1: Add Anupam Kher, email anupam.kher@bollywood.in, address Mumbai, note 'Actor'. -> Anupam Kher has been added to your address book with note 'Actor'. URI: content://contacts/people/anupam_kher""]"	Display his info	Display content://contacts/people/anupam_kher's info	{'plan': 'ACTION_VIEW_CONTACT', 'arguments': {'contact_uri': 'content://contacts/people/anupam_kher'}}	ACTION_INSERT_CONTACT-435-ACTION_VIEW_CONTACT-1	['get_contact_info_from_uri', 'ACTION_GET_RINGTONE', 'ACTION_VIEW_CONTACT', 'dial', 'ACTION_PICK']
"['turn 1: Would you update Bob’s address to ""221B Baker Street, London""? His URI is content://contacts/people/bob. -> Okay, opening Bob\'s contact. Feel free to enter the new address—221B Baker Street, London.']"	Where is that on the map?	Where is 221B Baker Street, London on the map?	{'plan': 'search_location', 'arguments': {'query': '221B Baker Street, London'}}	ACTION_EDIT_CONTACT-58-search_location-1	['INTENT_ACTION_STILL_IMAGE_CAMERA', 'search_location', 'ACTION_OPEN_CONTENT', 'ACTION_INSERT_EVENT', 'open_settings']
['turn 1: Hey, please update the address and email for Frank (URI: content://contacts/people/frank). Address: 55 Maple Ave, Boston. Email: frank@maple.com -> Alright, opening Frank’s contact. You can fill in the address 55 Maple Ave, Boston and email frank@maple.com.']	Show me where it is.	Show me where 55 Maple Ave, Boston is.	{'plan': 'search_location', 'arguments': {'query': '55 Maple Ave, Boston'}}	ACTION_EDIT_CONTACT-62-search_location-1	['search_location', 'play_music', 'ACTION_SET_ALARM', 'INTENT_ACTION_STILL_IMAGE_CAMERA', 'ACTION_INSERT_EVENT']
['turn 1: Change Grace’s name in her contact content://contacts/people/grace to Grace Brown. -> Opening Grace’s contact—go ahead and update her name to Grace Brown.']	Could you locate her on a map?	Could you locate Grace Brown on a map?	{'plan': 'search_location', 'arguments': {'query': 'Grace Brown'}}	ACTION_EDIT_CONTACT-63-search_location-1	['launch_application', 'ACTION_VIEW_RECENT_APPS', 'search_location', 'ACTION_SET_ALARM', 'INTENT_ACTION_STILL_IMAGE_CAMERA']
['turn 1: Update the company of contact content://contacts/people/emily_jones to Innotech Solutions and change her phone to 123-456-7890. -> Launching Emily Jones’s contact. You can update her company to Innotech Solutions and change her phone to 123-456-7890.']	Can you show me that on a map?	Can you show me 123-456-7890 on a map?	{'plan': 'search_location', 'arguments': {'query': '123-456-7890'}}	ACTION_EDIT_CONTACT-61-search_location-1	['ACTION_SHOW_TIMERS', 'search_location', 'ACTION_INSERT_EVENT', 'get_contact_info_from_uri', 'send_email']
['turn 1: I need to update Isla’s company to Global Ventures in her contact URI content://contacts/people/isla_v. -> Sure, pulling up Isla’s contact. You can update her company to Global Ventures.']	Where is that company located?	Where is Global Ventures located?	{'plan': 'search_location', 'arguments': {'query': 'Global Ventures'}}	ACTION_EDIT_CONTACT-65-search_location-1	['search_location', 'INTENT_ACTION_VIDEO_CAMERA', 'ACTION_INSERT_EVENT', 'play_music', 'ACTION_VIEW_SENT_EMAILS']
['turn 1: Reset the contact form for Henry: content://contacts/people/henry. I don’t need to pre-fill anything. -> Resetting Henry’s contact form now. No prefilled details, ready for your input.']	Where can I find him on a map?	Where can I find Henry on a map?	{'plan': 'search_location', 'arguments': {'query': 'Henry'}}	ACTION_EDIT_CONTACT-64-search_location-1	['get_contact_info_from_uri', 'web_search', 'ACTION_VIEW_CALL_LOG', 'search_location', 'ACTION_VIEW_WEB_HISTORY']
['turn 1: Add Lucas Wright to my address book with phone: 321-654-0987 and home address: 456 Maple Street. -> Creating Lucas Wright’s contact: phone 321‑654‑0987 and address 456 Maple Street are filled in.']	Show it in the map application	Show 456 Maple Street in the map application	{'plan': 'search_location', 'arguments': {'query': '456 Maple Street'}}	ACTION_INSERT_CONTACT-392-search_location-1	['ACTION_OPEN_DOCUMENT', 'ACTION_EDIT_DOCUMENT', 'search_location', 'ACTION_EDIT_ALARM', 'ACTION_GET_CONTENT']
['turn 1: Insert new contact for Maria Gonzalez: name, email, and street address. Her email is maria.gonzalez@example.com and she lives at 789 Central Blvd. -> Sure—setting up Maria Gonzalez’s contact with email maria.gonzalez@example.com and address 789 Central Blvd.']	Locate that address	Locate 789 Central Blvd.	{'plan': 'search_location', 'arguments': {'query': '789 Central Blvd'}}	ACTION_INSERT_CONTACT-393-search_location-1	['ACTION_NAVIGATE_TO_LOCATION', 'ACTION_SHOW_TIMERS', 'ACTION_VIEW_WEB_HISTORY', 'search_location', 'ACTION_SET_TIMER']
['turn 1: Set up contact: Olivia King, phone 987-654-3210, email olivia.king@domain.com, address 321 Oak Ave, Apt 2. -> All set! Olivia King’s contact opens with phone 987‑654‑3210, email and address already in place.']	Open her location in Maps	Open 321 Oak Ave, Apt 2 location in Maps	{'plan': 'search_location', 'arguments': {'query': '321 Oak Ave, Apt 2'}}	ACTION_INSERT_CONTACT-395-search_location-1	['ACTION_OPEN_CONTENT', 'send_message', 'ACTION_VIEW_PLAYLIST', 'search_location', 'ACTION_EDIT_VIDEO']
"[""turn 1: Could you store Peter Parker's details? He lives at 108 W 40th St and we should note 'Friendly neighborhood Spider-Man'. -> Preparing Peter Parker’s contact: address 108 W\xa040th St and notes (“Friendly neighborhood Spider-Man”) are set.""]"	Show that address on a map	Show 108 W 40th St on a map	{'plan': 'search_location', 'arguments': {'query': '108 W 40th St'}}	ACTION_INSERT_CONTACT-398-search_location-1	['ACTION_VIEW_SENT_MESSAGES', 'ACTION_GET_CONTENT', 'search_location', 'open_settings', 'ACTION_NAVIGATE_TO_LOCATION']
['turn 1: Add contact Christine Wu with phone 212-555-9876, address 123 Elm Street, and website www.christinewu.com. -> Contact form launched for Christine Wu: phone, address, and website have been prefilled.']	Locate her address on a map	Locate 123 Elm Street on a map	{'plan': 'search_location', 'arguments': {'query': '123 Elm Street'}}	ACTION_INSERT_CONTACT-400-search_location-1	['launch_application', 'ACTION_VIEW_SENT_MESSAGES', 'ACTION_INSERT_CONTACT', 'search_location', 'ACTION_VIEW_WEB_HISTORY']
"['turn 1: I need a calendar entry on May 1, 2024 at 9:00 AM for an annual check-up with Dr. Smith at the Downtown Clinic. -> All set: ""Doctor Appointment"" is scheduled for May 1, 2024 at 9:00\xa0AM at Downtown Clinic. Check it here: content://calendar/event/2']"	Where is it exactly?	Where is Downtown Clinic exactly?	{'plan': 'search_location', 'arguments': {'query': 'Downtown Clinic'}}	ACTION_INSERT_EVENT-437-search_location-1	['play_video', 'send_email', 'ACTION_VIDEO_CAPTURE', 'search_location', 'get_contact_info']
"['turn 1: Set up a yoga class on June 10th, 2024 from 6 PM to 7 PM at Sunrise Yoga Studio. It\'s a Vinyasa flow session. -> Done – ""Yoga Class"" is locked in for June 10, 2024 at 6:00\xa0PM at Sunrise Yoga Studio. View it here: content://calendar/event/3']"	Can you find where that is?	Can you find where Sunrise Yoga Studio is?	{'plan': 'search_location', 'arguments': {'query': 'Sunrise Yoga Studio'}}	ACTION_INSERT_EVENT-438-search_location-1	['INTENT_ACTION_VIDEO_CAMERA', 'search_location', 'play_video', 'ACTION_GET_CONTENT', 'ACTION_NAVIGATE_TO_LOCATION']
"['turn 1: Add to my calendar: Lunch with Sarah at Cafe Roma on July 4, 2024, starting at noon for an hour and a half. We need to catch up over lunch. -> Your ""Lunch with Sarah"" is booked for July 4, 2024 at 12:00\xa0PM at Cafe Roma. Here\'s the event URI: content://calendar/event/4']"	Where is it situated?	Where is Cafe Roma situated?	{'plan': 'search_location', 'arguments': {'query': 'Cafe Roma'}}	ACTION_INSERT_EVENT-439-search_location-1	['ACTION_EDIT_ALARM', 'ACTION_SET_ALARM', 'send_email', 'ACTION_VIEW_RECENT_APPS', 'search_location']
"['turn 1: Please create an event titled \'AI Trends Webinar\' on August 15, 2024 from 8:00 to 9:00 AM online, with description \'Join online webinar on latest AI developments\'. -> Success! ""AI Trends Webinar"" is on your calendar for August 15, 2024 at 8:00\xa0AM (online). Access it here: content://calendar/event/5']"	Where is it hosted online?	Where is content://calendar/event/5 hosted online?	{'plan': 'search_location', 'arguments': {'query': 'content://calendar/event/5'}}	ACTION_INSERT_EVENT-440-search_location-1	['ACTION_EDIT_VIDEO', 'ACTION_VIEW_CALL_LOG', 'ACTION_INSERT_EVENT', 'play_music', 'search_location']
"['turn 1: I\'d like to plan a movie night at Grand Cinema on October 10, 2024 beginning at 8 PM until 11 PM to watch the new sci-fi film with friends. -> All right! ""Movie Night"" is scheduled for October 10, 2024 from 8:00\xa0PM to 11:00\xa0PM at Grand Cinema. See it here: content://calendar/event/7']"	Where is it located?	Where is Grand Cinema located?	{'plan': 'search_location', 'arguments': {'query': 'Grand Cinema'}}	ACTION_INSERT_EVENT-442-search_location-1	['ACTION_SET_TIMER', 'INTENT_ACTION_STILL_IMAGE_CAMERA', 'play_video', 'ACTION_SET_RINGTONE', 'search_location']
"['turn 1: Schedule \'Thanksgiving Dinner\' on November 22, 2024 from 11:00 AM to 1:00 PM at Mom\'s House for a family gathering. -> Your ""Thanksgiving Dinner"" is confirmed for November 22, 2024 at 11:00\xa0AM at Mom’s House. Tap here for details: content://calendar/event/8']"	Where is it exactly?	Where is Mom’s House exactly?	{'plan': 'search_location', 'arguments': {'query': 'Mom’s House'}}	ACTION_INSERT_EVENT-443-search_location-1	['ACTION_VIDEO_CAPTURE', 'ACTION_SET_RINGTONE', 'ACTION_PICK', 'search_location', 'INTENT_ACTION_STILL_IMAGE_CAMERA']
['turn 1: Would you bring up the entry stored at content://contacts/people/1034? -> Bringing up the entry at content://contacts/people/1034.']	Navigate to the contact's address	Navigate to the address of the contact stored at content://contacts/people/1034	{'plan': 'search_location', 'arguments': {'query': 'address of contact content://contacts/people/1034'}}	ACTION_VIEW_CONTACT-785-search_location-1	['send_email', 'ACTION_OPEN_CONTENT', 'open_settings', 'search_location', 'ACTION_EDIT_VIDEO']
['turn 1: Open contact ID 1036: content://contacts/people/1036. -> Loading contact ID 1036 (content://contacts/people/1036).']	Plot the contact's address	Plot the contact's address for contact ID 1036: content://contacts/people/1036	{'plan': 'search_location', 'arguments': {'query': 'address of contact content://contacts/people/1036'}}	ACTION_VIEW_CONTACT-787-search_location-1	['ACTION_SHOW_ALARMS', 'web_search', 'ACTION_CREATE_DOCUMENT', 'search_location', 'ACTION_VIEW_PLAYLIST']
['turn 1: Please launch the details view for content://contacts/people/1027. -> Displaying contact details for content://contacts/people/1027 now.']	Navigate to this contact's address.	Navigate to content://contacts/people/1027's address.	{'plan': 'search_location', 'arguments': {'query': 'address of contact content://contacts/people/1027'}}	ACTION_VIEW_CONTACT-779-search_location-1	['ACTION_VIEW_PLAYLIST', 'ACTION_EDIT_CONTACT', 'search_location', 'ACTION_VIEW_WEB_HISTORY', 'ACTION_PICK']
"[""turn 1: Can you retrieve the email address of the contact for this URI: content://contacts/people/23? -> Sure thing—I've pulled up the email for that contact. It’s jane.doe23@example.com.""]"	Search for it	Search for jane.doe23@example.com	{'plan': 'search_location', 'arguments': {'query': 'jane.doe23@example.com'}}	get_contact_info-968-search_location-1	['launch_application', 'search_location', 'ACTION_VIEW_EVENT', 'ACTION_OPEN_DOCUMENT', 'ACTION_VIDEO_CAPTURE']
"[""turn 1: I need to change John’s phone number to 555-1234 for his contact (content://contacts/people/john). Can you do that? -> Sure thing! Opening John's contact now so you can update his phone number to 555‑1234.""]"	Call it	Call 555-1234	{'plan': 'dial', 'arguments': {'phone_number': '555-1234'}}	ACTION_EDIT_CONTACT-56-dial-1	['get_contact_info', 'ACTION_GET_RINGTONE', 'dial', 'ACTION_SHOW_TIMERS', 'ACTION_GET_CONTENT']
['turn 1: Add Lucas Wright to my address book with phone: 321-654-0987 and home address: 456 Maple Street. -> Creating Lucas Wright’s contact: phone 321‑654‑0987 and address 456 Maple Street are filled in.']	Dial him now	Dial 321-654-0987 now	{'plan': 'dial', 'arguments': {'phone_number': '321-654-0987'}}	ACTION_INSERT_CONTACT-392-dial-1	['ACTION_VIEW_SENT_MESSAGES', 'ACTION_EDIT_ALARM', 'ACTION_SET_ALARM', 'dial', 'ACTION_SET_TIMER']
['turn 1: Could you help me create a contact for Nolan Reed, email nolan.reed@workmail.org and work phone (415) 555-2737? -> Launching contact form for Nolan Reed: email and work phone ((415)\xa0555‑2737) have been filled.']	Call him now	Call (415) 555-2737 now	{'plan': 'dial', 'arguments': {'phone_number': '(415) 555-2737'}}	ACTION_INSERT_CONTACT-394-dial-1	['ACTION_VIEW_SENT_MESSAGES', 'INTENT_ACTION_STILL_IMAGE_CAMERA', 'launch_application', 'ACTION_SET_ALARM', 'dial']
"[""turn 1: What's the phone number for the contact with URI content://contacts/people/1011? -> The phone number for contact 1011 is (555) 321-4321.""]"	Call that number	Call (555) 321-4321	{'plan': 'dial', 'arguments': {'phone_number': '(555) 321-4321'}}	get_contact_info-971-dial-1	['ACTION_EDIT_DOCUMENT', 'ACTION_SET_TIMER', 'ACTION_IMAGE_CAPTURE', 'ACTION_VIEW_SENT_EMAILS', 'dial']
['turn 1: Give me a summary of the contact at content://contacts/people/42. -> Here’s what I found:\n• Name: Michael Lee\n• Phone: 555-987-6543\n• Email: michael.lee42@example.com\n• Address: 321 Oak St, Centerville, OH 45459']	Call him	Call 555-987-6543	{'plan': 'dial', 'arguments': {'phone_number': '555-987-6543'}}	get_contact_info-970-dial-1	['dial', 'ACTION_INSERT_EVENT', 'search_location', 'ACTION_SET_RINGTONE', 'ACTION_GET_RINGTONE']
"[""turn 1: Find the contact's evening number at content://contacts/901/phone_evening. -> Evening number you wanted: +1-202-555-0110.""]"	Give that evening number a ring.	Give +1-202-555-0110 a ring.	{'plan': 'dial', 'arguments': {'phone_number': '+1-202-555-0110'}}	get_contact_info_from_uri-1045-dial-1	['dial', 'open_settings', 'ACTION_EDIT_DOCUMENT', 'send_message', 'ACTION_OPEN_CONTENT']
['turn 1: Please obtain the main phone using content://contacts/890/phone_main. -> Main phone number retrieved: +1-202-555-0198.']	Dial that number.	Dial +1-202-555-0198.	{'plan': 'dial', 'arguments': {'phone_number': '+1-202-555-0198'}}	get_contact_info_from_uri-1044-dial-1	['ACTION_IMAGE_CAPTURE', 'ACTION_INSERT_CONTACT', 'play_video', 'dial', 'ACTION_VIDEO_CAPTURE']
"[""turn 1: Send a quick reminder to John at +15551234567 saying 'Don't forget the meeting at 3pm today.' -> Your reminder has been sent to +15551234567.""]"	Give him a quick call	Give +15551234567 a quick call	{'plan': 'dial', 'arguments': {'phone_number': '+15551234567'}}	send_message-1241-dial-1	['ACTION_VIEW_CALL_LOG', 'ACTION_VIEW_SENT_MESSAGES', 'ACTION_EDIT_VIDEO', 'send_message', 'dial']
['turn 1: Could you send a motivational quote to my friend Lisa at 555-987-6543? -> Motivational quote sent to 555-987-6543.']	Ring her up	Ring 555-987-6543 up	{'plan': 'dial', 'arguments': {'phone_number': '555-987-6543'}}	send_message-1242-dial-1	['ACTION_VIEW_EVENT', 'play_music', 'ACTION_SHOW_TIMERS', 'ACTION_OPEN_CONTENT', 'dial']
['turn 1: Please send the PDF invoice to +44 20 7946 0958 with the file attached. -> Invoice PDF sent to +442079460958.']	Give them a call	Give +44 20 7946 0958 a call	{'plan': 'dial', 'arguments': {'phone_number': '+44 20 7946 0958'}}	send_message-1243-dial-1	['dial', 'ACTION_VIEW_PLAYLIST', 'ACTION_GET_CONTENT', 'ACTION_INSERT_CONTACT', 'INTENT_ACTION_VIDEO_CAMERA']
"[""turn 1: Forward the holiday greeting 'Merry Christmas and a Happy New Year!' to +81-90-1234-5678. -> Merry Christmas greeting sent to +81-90-1234-5678.""]"	Make a call to that number	Make a call to +81-90-1234-5678	{'plan': 'dial', 'arguments': {'phone_number': '+81-90-1234-5678'}}	send_message-1244-dial-1	['ACTION_VIEW_WEB_HISTORY', 'ACTION_NAVIGATE_TO_LOCATION', 'dial', 'play_music', 'ACTION_PICK']
"[""turn 1: Text my colleague with ID 7890 the message 'Project deadline extended to next Monday. Check your email for details.' Use their contact +1 (800) 555-0000. -> Project update delivered to +18005550000.""]"	Call them now	Call +18005550000 now	{'plan': 'dial', 'arguments': {'phone_number': '+18005550000'}}	send_message-1245-dial-1	['ACTION_IMAGE_CAPTURE', 'ACTION_INSERT_CONTACT', 'ACTION_GET_RINGTONE', 'dial', 'get_contact_info_from_uri']
"['turn 1: Would you update Bob’s address to ""221B Baker Street, London""? His URI is content://contacts/people/bob. -> Okay, opening Bob\'s contact. Feel free to enter the new address—221B Baker Street, London.']"	Navigate there	Navigate to 221B Baker Street, London	{'plan': 'ACTION_NAVIGATE_TO_LOCATION', 'arguments': {'location': '221B Baker Street, London'}}	ACTION_EDIT_CONTACT-58-ACTION_NAVIGATE_TO_LOCATION-1	['ACTION_OPEN_DOCUMENT', 'ACTION_EDIT_ALARM', 'ACTION_SET_TIMER', 'ACTION_EDIT_DOCUMENT', 'ACTION_NAVIGATE_TO_LOCATION']
['turn 1: Update the company of contact content://contacts/people/emily_jones to Innotech Solutions and change her phone to 123-456-7890. -> Launching Emily Jones’s contact. You can update her company to Innotech Solutions and change her phone to 123-456-7890.']	Take me to their office	Take me to Innotech Solutions' office	"{'plan': 'ACTION_NAVIGATE_TO_LOCATION', 'arguments': {'location': ""Innotech Solutions' office""}}"	ACTION_EDIT_CONTACT-61-ACTION_NAVIGATE_TO_LOCATION-1	['launch_application', 'ACTION_EDIT_CONTACT', 'ACTION_INSERT_EVENT', 'ACTION_NAVIGATE_TO_LOCATION', 'send_message']
['turn 1: I need to update Isla’s company to Global Ventures in her contact URI content://contacts/people/isla_v. -> Sure, pulling up Isla’s contact. You can update her company to Global Ventures.']	Take me to her company's office	Take me to Global Ventures's office	"{'plan': 'ACTION_NAVIGATE_TO_LOCATION', 'arguments': {'location': ""Global Ventures's office""}}"	ACTION_EDIT_CONTACT-65-ACTION_NAVIGATE_TO_LOCATION-1	['ACTION_VIEW_WEB_HISTORY', 'open_settings', 'ACTION_NAVIGATE_TO_LOCATION', 'ACTION_GET_CONTENT', 'dial']
"['turn 1: Could you schedule a one-hour brainstorming session for next Tuesday at 2 pm in Zoom Room A titled \'Project Alpha Brainstorm\' with description \'Initial idea generation for Project Alpha\'? -> Great! ""Project Alpha Brainstorm"" is on your calendar for April 16, 2024 at 2:00\xa0PM in Zoom Room A. Here\'s the event link: content://calendar/event/1']"	Get directions there	Get directions to Zoom Room A	{'plan': 'ACTION_NAVIGATE_TO_LOCATION', 'arguments': {'location': 'Zoom Room A'}}	ACTION_INSERT_EVENT-436-ACTION_NAVIGATE_TO_LOCATION-1	['ACTION_VIEW_RECENT_APPS', 'ACTION_NAVIGATE_TO_LOCATION', 'ACTION_VIEW_CONTACT', 'ACTION_EDIT_ALARM', 'search_location']
"['turn 1: I need a calendar entry on May 1, 2024 at 9:00 AM for an annual check-up with Dr. Smith at the Downtown Clinic. -> All set: ""Doctor Appointment"" is scheduled for May 1, 2024 at 9:00\xa0AM at Downtown Clinic. Check it here: content://calendar/event/2']"	Navigate me there	Navigate me to Downtown Clinic	{'plan': 'ACTION_NAVIGATE_TO_LOCATION', 'arguments': {'location': 'Downtown Clinic'}}	ACTION_INSERT_EVENT-437-ACTION_NAVIGATE_TO_LOCATION-1	['ACTION_EDIT_CONTACT', 'ACTION_EDIT_VIDEO', 'ACTION_NAVIGATE_TO_LOCATION', 'search_location', 'ACTION_VIEW_SENT_MESSAGES']
"['turn 1: Add to my calendar: Lunch with Sarah at Cafe Roma on July 4, 2024, starting at noon for an hour and a half. We need to catch up over lunch. -> Your ""Lunch with Sarah"" is booked for July 4, 2024 at 12:00\xa0PM at Cafe Roma. Here\'s the event URI: content://calendar/event/4']"	Show me the way there	Show me the way to Cafe Roma	{'plan': 'ACTION_NAVIGATE_TO_LOCATION', 'arguments': {'location': 'Cafe Roma'}}	ACTION_INSERT_EVENT-439-ACTION_NAVIGATE_TO_LOCATION-1	['INTENT_ACTION_STILL_IMAGE_CAMERA', 'ACTION_NAVIGATE_TO_LOCATION', 'ACTION_VIEW_CALL_LOG', 'ACTION_VIDEO_CAPTURE', 'ACTION_EDIT_ALARM']
"['turn 1: Schedule \'Thanksgiving Dinner\' on November 22, 2024 from 11:00 AM to 1:00 PM at Mom\'s House for a family gathering. -> Your ""Thanksgiving Dinner"" is confirmed for November 22, 2024 at 11:00\xa0AM at Mom’s House. Tap here for details: content://calendar/event/8']"	Guide me there	Guide me to Mom’s House	{'plan': 'ACTION_NAVIGATE_TO_LOCATION', 'arguments': {'location': 'Mom’s House'}}	ACTION_INSERT_EVENT-443-ACTION_NAVIGATE_TO_LOCATION-1	['get_contact_info_from_uri', 'ACTION_EDIT_CONTACT', 'ACTION_VIEW_EVENT', 'ACTION_NAVIGATE_TO_LOCATION', 'ACTION_SET_RINGTONE']
"['turn 1: Create an event for a New Year\'s Party at Main Hall on December 31, 2024 starting at 10:00 PM and ending at 1:00 AM. -> Cheers! ""New Year\'s Party"" is on for December 31, 2024 at 10:00\xa0PM in Main Hall. Access it here: content://calendar/event/9']"	Get directions there	Get directions to Main Hall	{'plan': 'ACTION_NAVIGATE_TO_LOCATION', 'arguments': {'location': 'Main Hall'}}	ACTION_INSERT_EVENT-444-ACTION_NAVIGATE_TO_LOCATION-1	['launch_application', 'ACTION_PICK', 'ACTION_EDIT_DOCUMENT', 'ACTION_NAVIGATE_TO_LOCATION', 'ACTION_SHOW_ALARMS']
"[""turn 1: Create a calendar entry for 'Board Meeting' on November 8, 2024, 9:30 AM to 12:00 PM at Headquarters, details: 'Quarterly board review'. -> Done! ‘Board Meeting’ (Quarterly board review) is set for November 8, 2024, 9:30\xa0AM–12:00\xa0PM at Headquarters. View it here: content://calendar/event/3""]"	Get directions there	Get directions to Headquarters	{'plan': 'ACTION_NAVIGATE_TO_LOCATION', 'arguments': {'location': 'Headquarters'}}	ACTION_INSERT_EVENT-458-ACTION_NAVIGATE_TO_LOCATION-1	['dial', 'ACTION_SET_RINGTONE', 'web_search', 'ACTION_EDIT_ALARM', 'ACTION_NAVIGATE_TO_LOCATION']
"[""turn 1: I need an event 'Dentist Check-Up' on August 1, 2024 at 11:00 AM at Smile Dental Clinic. Description: Routine cleaning. -> Your “Dentist Check-Up” on August 1, 2024 at 11:00\xa0AM at Smile Dental Clinic has been added. Check it out: content://calendar/event/4""]"	Give me directions to it	Give me directions to Smile Dental Clinic	{'plan': 'ACTION_NAVIGATE_TO_LOCATION', 'arguments': {'location': 'Smile Dental Clinic'}}	ACTION_INSERT_EVENT-459-ACTION_NAVIGATE_TO_LOCATION-1	['ACTION_SET_RINGTONE', 'ACTION_VIEW_SENT_EMAILS', 'ACTION_INSERT_EVENT', 'INTENT_ACTION_VIDEO_CAMERA', 'ACTION_NAVIGATE_TO_LOCATION']
['turn 1: Give me a summary of the contact at content://contacts/people/42. -> Here’s what I found:\n• Name: Michael Lee\n• Phone: 555-987-6543\n• Email: michael.lee42@example.com\n• Address: 321 Oak St, Centerville, OH 45459']	Take me there.	Take me to 321 Oak St, Centerville, OH 45459.	{'plan': 'ACTION_NAVIGATE_TO_LOCATION', 'arguments': {'location': '321 Oak St, Centerville, OH 45459'}}	get_contact_info-970-ACTION_NAVIGATE_TO_LOCATION-1	['ACTION_INSERT_CONTACT', 'ACTION_VIEW_SENT_MESSAGES', 'ACTION_VIEW_WEB_HISTORY', 'ACTION_NAVIGATE_TO_LOCATION', 'ACTION_SET_ALARM']
['turn 1: I need the postal address for the client whose URI is content://com.company.contacts/contact/789. -> Got it. The mailing address on file is 456 Corporate Blvd, Suite 100, Business City, CA 90001.']	Navigate there.	Navigate to 456 Corporate Blvd, Suite 100, Business City, CA 90001.	{'plan': 'ACTION_NAVIGATE_TO_LOCATION', 'arguments': {'location': '456 Corporate Blvd, Suite 100, Business City, CA 90001'}}	get_contact_info-969-ACTION_NAVIGATE_TO_LOCATION-1	['ACTION_VIDEO_CAPTURE', 'ACTION_CREATE_DOCUMENT', 'ACTION_VIEW_WEB_HISTORY', 'ACTION_EDIT_CONTACT', 'ACTION_NAVIGATE_TO_LOCATION']
