conversation_history	query	rewrited_query	answer	unique_idx	candidates
"[""turn 1: Message my neighbor at +44 7312 345678: 'Could you feed my cat while I'm away?' -> Request sent to your neighbor at +447312345678."", ""turn 2: What messages have I sent? -> Sent messages: +447312345678 – 'Could you feed my cat while I'm away?'.""]"	I would like to set up an event titled 'Art Exhibition'. It's a public display of local art at Downtown Gallery from 1701100000000 to 1701103600000.	I would like to set up an event titled 'Art Exhibition'. It's a public display of local art at Downtown Gallery from 1701100000000 to 1701103600000.	{'plan': 'ACTION_INSERT_EVENT', 'arguments': {'TITLE': 'Art Exhibition', 'DESCRIPTION': 'Public display of local art', 'EVENT_LOCATION': 'Downtown Gallery', 'BEGIN_TIME': 1701100000000, 'END_TIME': 1701103600000}}	send_message-1287-ACTION_VIEW_SENT_MESSAGES-1-ACTION_INSERT_EVENT-1_NR	['ACTION_VIEW_PLAYLIST', 'open_settings', 'get_contact_info', 'get_contact_info_from_uri', 'ACTION_INSERT_EVENT']
"['turn 1: Please make a WebVTT file called subs.vtt. -> Alright, preparing the WebVTT file ""subs.vtt."" Where should I store it?', ""turn 2: 请显示我最近浏览网页的历史记录。 -> Here is your recent web browsing history: Baidu (search '天气'), Zhihu (question 'AI发展'), YouTube (video '中文学习'), Weibo (hot searches), Douban (movie reviews).""]"	I want to see a summary of my sent SMS and MMS messages, complete with recipient details and a short preview of each.	I want to see a summary of my sent SMS and MMS messages, complete with recipient details and a short preview of each.	{'plan': 'ACTION_VIEW_SENT_MESSAGES', 'arguments': {}}	ACTION_CREATE_DOCUMENT-53-ACTION_VIEW_WEB_HISTORY-1_NR-ACTION_VIEW_SENT_MESSAGES-1_NR	['INTENT_ACTION_VIDEO_CAMERA', 'ACTION_SHOW_ALARMS', 'get_contact_info', 'launch_application', 'ACTION_VIEW_SENT_MESSAGES']
"['turn 1: Please open the cam for video. -> The camera app is now in video mode.', ""turn 2: Start capturing video footage. -> Camera's rolling now. The footage will be saved automatically after you stop.""]"	List out my recent outgoing messages, showing both who I sent them to and a fragment of the text.	List out my recent outgoing messages, showing both who I sent them to and a fragment of the text.	{'plan': 'ACTION_VIEW_SENT_MESSAGES', 'arguments': {}}	INTENT_ACTION_VIDEO_CAMERA-909-ACTION_VIDEO_CAPTURE-1-ACTION_VIEW_SENT_MESSAGES-1_NR	['ACTION_VIEW_CALL_LOG', 'ACTION_VIEW_SENT_MESSAGES', 'ACTION_VIEW_SENT_EMAILS', 'open_settings', 'ACTION_GET_RINGTONE']
['turn 1: Trim content://ads/sale.mp4 so it starts from 500ms and goes to 25000ms. -> Sale ad loaded: trimming from 0.5\xa0s to 25\xa0s as requested.', 'turn 2: Play content://ads/sale.mp4 -> Here’s your 0.5s–25s sale ad, playing now.']	Could you provide an overview of the texts I have sent, including the recipients' details and a snippet of each?	Could you provide an overview of the texts I have sent, including the recipients' details and a snippet of each?	{'plan': 'ACTION_VIEW_SENT_MESSAGES', 'arguments': {}}	ACTION_EDIT_VIDEO-1721-play_video-1-ACTION_VIEW_SENT_MESSAGES-1_NR	['ACTION_VIEW_PLAYLIST', 'ACTION_VIEW_SENT_MESSAGES', 'ACTION_EDIT_ALARM', 'send_email', 'dial']
['turn 1: Play the video file located at D:\\\\Movies\\\\blockbuster.mp4 -> Starting playback of D:\\Movies\\blockbuster.mp4 in the default player.', 'turn 2: Mute D:\\Movies\\blockbuster.mp4. -> Done! blockbuster.mp4 has been muted as requested. You can download it here: content://media/edited_blockbuster_008.mp4.']	Let me see the trace of my recent online activity.	Let me see the trace of my recent online activity.	{'plan': 'ACTION_VIEW_WEB_HISTORY', 'arguments': {}}	play_video-1429-ACTION_EDIT_VIDEO-1-ACTION_VIEW_WEB_HISTORY-1_NR	['ACTION_VIEW_PLAYLIST', 'ACTION_EDIT_CONTACT', 'ACTION_SET_TIMER', 'ACTION_PICK', 'ACTION_VIEW_WEB_HISTORY']
"[""turn 1: Please play Eminem's 'Lose Yourself'. -> Now spinning Lose Yourself by Eminem."", ""turn 2: Display my 'Workout Hits' playlist -> Here’s 'Workout Hits': Stronger; On Top of the World; Pump It; Remember the Name.""]"	I want to check my recent read web pages.	I want to check my recent read web pages.	{'plan': 'ACTION_VIEW_WEB_HISTORY', 'arguments': {}}	play_music-1358-ACTION_VIEW_PLAYLIST-1-ACTION_VIEW_WEB_HISTORY-1_NR	['INTENT_ACTION_STILL_IMAGE_CAMERA', 'ACTION_VIEW_WEB_HISTORY', 'open_settings', 'INTENT_ACTION_VIDEO_CAMERA', 'ACTION_SHOW_TIMERS']
['turn 1: Please show the apps that were open most recently. -> Apps opened recently: Maps, Messages, YouTube, Chrome.', 'turn 2: Help me open a PDF file I can edit long-term. -> No problem. Bringing up the PDF files—select one to open long-term.']	Could you bring up my online navigation records?	Could you bring up my online navigation records?	{'plan': 'ACTION_VIEW_WEB_HISTORY', 'arguments': {}}	ACTION_VIEW_RECENT_APPS-2213-ACTION_OPEN_DOCUMENT-1_NR-ACTION_VIEW_WEB_HISTORY-1_NR	['INTENT_ACTION_VIDEO_CAMERA', 'ACTION_CREATE_DOCUMENT', 'ACTION_VIEW_RECENT_APPS', 'ACTION_VIEW_WEB_HISTORY', 'ACTION_VIEW_CALL_LOG']
"['turn 1: List all SMS/MMS messages that have been sent from this device. -> Here’s your sent SMS/MMS: Mom (+82-3512-0000) – ""I’ll be there soon""; Alice – ""Happy Birthday!""; Bob (+1-202-555-0147) – ""Meeting at 2pm?""', 'turn 2: Call Bob (+1-202-555-0147) now -> Starting call to +1-202-555-0147...']"	Tell me which sites I accessed in the last few hours by showing my web history.	Tell me which sites I accessed in the last few hours by showing my web history.	{'plan': 'ACTION_VIEW_WEB_HISTORY', 'arguments': {}}	ACTION_VIEW_SENT_MESSAGES-2009-dial-1-ACTION_VIEW_WEB_HISTORY-1_NR	['ACTION_SET_TIMER', 'ACTION_VIEW_WEB_HISTORY', 'ACTION_SHOW_TIMERS', 'ACTION_EDIT_CONTACT', 'send_message']
"[""turn 1: Hey, let's fix Natalie Reed's phone and address in content://contacts/people/natalie_r. New phone: 555-0001, address: 123 Oak Lane. -> Got it! Opening the contact editor for Natalie Reed (URI: content://contacts/people/natalie_r) with phone 555-0001 and address 123 Oak Lane."", ""turn 2: I'd like to capture a moment; please start the still-image camera. -> Your still camera is up; let's capture a great shot.""]"	Please load my internet history summary.	Please load my internet history summary.	{'plan': 'ACTION_VIEW_WEB_HISTORY', 'arguments': {}}	ACTION_EDIT_CONTACT-89-INTENT_ACTION_STILL_IMAGE_CAMERA-1_NR-ACTION_VIEW_WEB_HISTORY-1_NR	['ACTION_SET_RINGTONE', 'ACTION_VIEW_WEB_HISTORY', 'ACTION_INSERT_EVENT', 'send_email', 'play_music']
['turn 1: Show me the ringtone selection menu. -> Here you go! The ringtone picker is up—pick your favorite tune.', 'turn 2: Set content://media/ringtone_chime.mp3 as my default ringtone -> Okay, your default ringtone is content://media/ringtone_chime.mp3.']	I want to see a list of my recent online explorations; please display my browsing history.	I want to see a list of my recent online explorations; please display my browsing history.	{'plan': 'ACTION_VIEW_WEB_HISTORY', 'arguments': {}}	ACTION_GET_RINGTONE-318-ACTION_SET_RINGTONE-1-ACTION_VIEW_WEB_HISTORY-1_NR	['open_settings', 'send_message', 'ACTION_VIEW_WEB_HISTORY', 'play_video', 'ACTION_EDIT_CONTACT']
"['turn 1: Pop up all timers now active. -> Timers active now: 3 minutes - Desk tidy, 20 minutes - Gaming session, 45 minutes - Podcast.', ""turn 2: Edit the file at content://files/essay and load it with 'Thesis revision in progress'. -> Your essay is open for editing; I’ve loaded it with ‘Thesis revision in progress.’ You can find it here: content://files/essay.""]"	Retrieve the list of websites I visited today.	Retrieve the list of websites I visited today.	{'plan': 'ACTION_VIEW_WEB_HISTORY', 'arguments': {}}	ACTION_SHOW_TIMERS-1888-ACTION_EDIT_DOCUMENT-1_NR-ACTION_VIEW_WEB_HISTORY-1_NR	['ACTION_SET_TIMER', 'ACTION_VIEW_WEB_HISTORY', 'ACTION_VIEW_CONTACT', 'get_contact_info_from_uri', 'ACTION_VIEW_SENT_EMAILS']
"[""turn 1: Could you buzz the client at +1 212 555 0148: 'Invoice #12345 is due tomorrow.' -> Sent! 'Invoice #12345 is due tomorrow.' has been delivered to +12125550148."", 'turn 2: Select from my saved contacts. -> Opening your contacts now—please choose a contact.']"	Could you show me my surfing log?	Could you show me my surfing log?	{'plan': 'ACTION_VIEW_WEB_HISTORY', 'arguments': {}}	send_message-1291-ACTION_PICK-1_NR-ACTION_VIEW_WEB_HISTORY-1_NR	['ACTION_VIEW_WEB_HISTORY', 'search_location', 'ACTION_GET_CONTENT', 'ACTION_VIEW_SENT_MESSAGES', 'ACTION_OPEN_CONTENT']
['turn 1: Get me on the line with HR, extension 250. -> Connecting you to HR at extension 250...', 'turn 2: Can you show me my recent calls? -> Absolutely, here are your recent calls: HR Ext 250 +1-555-2500 (Outgoing) - Today 1:20 PM; Kevin +1-212-555-0146 (Incoming) - Today 10:00 AM; Lisa +1-212-555-0188 (Missed) - Yesterday 2:35 PM']	Please open my recent browsing record.	Please open my recent browsing record.	{'plan': 'ACTION_VIEW_WEB_HISTORY', 'arguments': {}}	dial-936-ACTION_VIEW_CALL_LOG-1-ACTION_VIEW_WEB_HISTORY-1_NR	['open_settings', 'ACTION_VIEW_CALL_LOG', 'ACTION_SHOW_TIMERS', 'search_location', 'ACTION_VIEW_WEB_HISTORY']
"['turn 1: I want to inspect my current alarms. -> Current alarms set: [alarm_id: 1 - 6:45 AM, Weekday Wake-up; alarm_id: 2 - 7:30 AM, Gym; alarm_id: 3 - 8:00 AM, Standup Meeting; alarm_id: 4 - 5:00 PM, Yoga]', ""turn 2: Rename 'alarm_id: 2 - 7:30 AM, Gym' to Morning Gym and move 'alarm_id: 2 - 7:30 AM, Gym' to 7\xa0AM -> The 'Gym' alarm (ID:2) is now at 7:00 AM and renamed 'Morning Gym'.""]"	I would like to see my web visit history from this week.	I would like to see my web visit history from this week.	{'plan': 'ACTION_VIEW_WEB_HISTORY', 'arguments': {}}	ACTION_SHOW_ALARMS-694-ACTION_EDIT_ALARM-1-ACTION_VIEW_WEB_HISTORY-1_NR	['launch_application', 'ACTION_VIEW_WEB_HISTORY', 'open_settings', 'dial', 'get_contact_info']
"['turn 1: Find the GPS coordinates for the summit of Mount Fuji. -> Mount Fuji peak is at approximately 35.3606°\xa0N, 138.7274°\xa0E.', ""turn 2: Email 35.3606°\xa0N, 138.7274°\xa0E to mountaineer@example.com with the subject 'Mount Fuji GPS' -> Coordinates have been emailed to mountaineer@example.com.""]"	فضلا أظهر سجل التصفح الأخير الخاص بي.	فضلا أظهر سجل التصفح الأخير الخاص بي.	{'plan': 'ACTION_VIEW_WEB_HISTORY', 'arguments': {}}	search_location-1136-send_email-1-ACTION_VIEW_WEB_HISTORY-1_NR	['send_email', 'ACTION_VIEW_WEB_HISTORY', 'ACTION_SET_RINGTONE', 'web_search', 'ACTION_VIEW_RECENT_APPS']
"['turn 1: Add \'Confidential – internal use only\' to content://documents/doc/637. -> Inserted ""Confidential – internal use only"" into document content://documents/doc/637. Ready for your next edits.', 'turn 2: Can you get the phone number that belongs to /contacts/mary_phone? -> Mary’s phone number is +1‑800‑123‑4567.']"	Bana son tarayıcı geçmişimi gösterin, lütfen.	Bana son tarayıcı geçmişimi gösterin, lütfen.	{'plan': 'ACTION_VIEW_WEB_HISTORY', 'arguments': {}}	ACTION_EDIT_DOCUMENT-1563-get_contact_info-1_NR-ACTION_VIEW_WEB_HISTORY-1_NR	['ACTION_VIEW_CONTACT', 'ACTION_VIEW_WEB_HISTORY', 'ACTION_CREATE_DOCUMENT', 'ACTION_OPEN_DOCUMENT', 'play_video']
"[""turn 1: Give me a rundown of today's outgoing and incoming calls. -> Here's a summary of today's incoming and outgoing calls:\n• Incoming - Charlie +1-555-0199 at 9:30 AM\n• Incoming - Mom +1-800-123-4567 at 6:00 AM\n• Outgoing - John +44-20-7946-0958 at 11:45 AM"", ""turn 2: I need to choose a person's email address from my contacts. -> Sure thing—select an email address from your contacts to continue.""]"	请显示我最近浏览网页的历史记录。	请显示我最近浏览网页的历史记录。	{'plan': 'ACTION_VIEW_WEB_HISTORY', 'arguments': {}}	ACTION_VIEW_CALL_LOG-1914-ACTION_PICK-1_NR-ACTION_VIEW_WEB_HISTORY-1_NR	['ACTION_NAVIGATE_TO_LOCATION', 'web_search', 'get_contact_info', 'ACTION_VIEW_WEB_HISTORY', 'ACTION_SET_RINGTONE']
['turn 1: I want to see the cellular number at content://contacts/435/phone_cell. -> Cell number found: +1-202-555-0143.', 'turn 2: Where is +1-202-555-0143 geographically? -> This DC-based number is located around Washington, DC (approx. 38.9072°\xa0N, 77.0369°\xa0W).']	Просмотр моей недавней истории браузера, пожалуйста.	Просмотр моей недавней истории браузера, пожалуйста.	{'plan': 'ACTION_VIEW_WEB_HISTORY', 'arguments': {}}	get_contact_info_from_uri-1049-search_location-1-ACTION_VIEW_WEB_HISTORY-1_NR	['open_settings', 'ACTION_SHOW_ALARMS', 'ACTION_VIEW_WEB_HISTORY', 'ACTION_OPEN_DOCUMENT', 'ACTION_EDIT_VIDEO']
"['turn 1: Please run the Calendar app and show me today’s events. -> Calendar has been launched successfully. Here’s today’s agenda.', 'turn 2: Show the editing view for the document at content://docs/schedule; please prefill it using \'Meeting schedule updated\'. -> Here’s your schedule document ready for editing: content://docs/schedule. I’ve prefilled it with ""Meeting schedule updated.""']"	最近のウェブ閲覧履歴を表示してください。	最近のウェブ閲覧履歴を表示してください。	{'plan': 'ACTION_VIEW_WEB_HISTORY', 'arguments': {}}	launch_application-1511-ACTION_EDIT_DOCUMENT-1_NR-ACTION_VIEW_WEB_HISTORY-1_NR	['ACTION_VIEW_WEB_HISTORY', 'search_location', 'open_settings', 'ACTION_EDIT_VIDEO', 'ACTION_OPEN_DOCUMENT']
"[""turn 1: Access my 'Indie Discoveries' playlist. -> Playlist 'Indie Discoveries': Tame Impala – The Less I Know The Better; Arctic Monkeys – Do I Wanna Know?; Florence + The Machine – Dog Days Are Over; Vampire Weekend – A-Punk"", 'turn 2: Get my phone ready for taking a photo by launching its still image camera. -> Still image camera launched—ready when you are.']"	Per favore mostra la mia cronologia web recente.	Per favore mostra la mia cronologia web recente.	{'plan': 'ACTION_VIEW_WEB_HISTORY', 'arguments': {}}	ACTION_VIEW_PLAYLIST-2134-INTENT_ACTION_STILL_IMAGE_CAMERA-1_NR-ACTION_VIEW_WEB_HISTORY-1_NR	['launch_application', 'ACTION_EDIT_ALARM', 'ACTION_VIEW_WEB_HISTORY', 'ACTION_SET_TIMER', 'ACTION_VIEW_CONTACT']
"['turn 1: Invoke device camera for recording. -> Video mode activated. Ready to capture your moments.', ""turn 2: Begin recording a video. -> Video recording has started. I'll save your clip when you're done.""]"	Zeig mir meinen kürzlichen Browserverlauf.	Zeig mir meinen kürzlichen Browserverlauf.	{'plan': 'ACTION_VIEW_WEB_HISTORY', 'arguments': {}}	INTENT_ACTION_VIDEO_CAMERA-907-ACTION_VIDEO_CAPTURE-1-ACTION_VIEW_WEB_HISTORY-1_NR	['ACTION_SHOW_TIMERS', 'ACTION_GET_CONTENT', 'ACTION_SHOW_ALARMS', 'ACTION_VIEW_CONTACT', 'ACTION_VIEW_WEB_HISTORY']
"[""turn 1: Please schedule 'Web Development Class' on May 5, 2024 from 5 PM to 7 PM at Tech Hub classroom. -> Web Development Class on May\xa05,\xa02024 from 5:00\xa0PM to 7:00\xa0PM at Tech Hub classroom has been added to your calendar. Event URI: content://calendar/event/1"", ""turn 2: I want to review my device's safety features; please open the security settings. -> You're in the Security settings now—check out your privacy and protection features.""]"	Can you perform a web search on how to start an online business successfully?	Can you perform a web search on how to start an online business successfully?	{'plan': 'web_search', 'arguments': {'query': 'how to start an online business successfully'}}	ACTION_INSERT_EVENT-476-open_settings-1_NR-web_search-1_NR	['ACTION_VIEW_CONTACT', 'ACTION_VIEW_RECENT_APPS', 'ACTION_CREATE_DOCUMENT', 'web_search', 'ACTION_SHOW_ALARMS']
"[""turn 1: Please switch the ringtone to this OGG clip: content://storage/emulated/0/Movies/ringtone.ogg -> All set! Incoming calls will now ring with 'ringtone.ogg'."", ""turn 2: Browse available ringtones -> Sure thing—'ringtone2.ogg' is now your tone (content://storage/emulated/0/Movies/ringtone2.ogg)""]"	I'm curious about recent advances in quantum computing; can you look it up?	I'm curious about recent advances in quantum computing; can you look it up?	{'plan': 'web_search', 'arguments': {'query': 'recent advances in quantum computing'}}	ACTION_SET_RINGTONE-1577-ACTION_GET_RINGTONE-1-web_search-1_NR	['ACTION_IMAGE_CAPTURE', 'send_email', 'web_search', 'play_video', 'ACTION_VIEW_RECENT_APPS']
"[""turn 1: Start the device's camera in photo mode for me. -> Camera app opened in photo mode, ready to capture."", ""turn 2: Shoot the device's camera in photo mode now. -> Photo taken—find it at content://media/external/images/media/9812.""]"	Check the internet for discoveries of exoplanets reported in the last year.	Check the internet for discoveries of exoplanets reported in the last year.	{'plan': 'web_search', 'arguments': {'query': 'exoplanets discovery last year'}}	INTENT_ACTION_STILL_IMAGE_CAMERA-824-ACTION_IMAGE_CAPTURE-1-web_search-1_NR	['ACTION_GET_CONTENT', 'ACTION_EDIT_DOCUMENT', 'ACTION_VIEW_EVENT', 'web_search', 'ACTION_SHOW_ALARMS']
['turn 1: Load up the video capture app. -> Successfully opened the video camera app.', 'turn 2: Pick multiple videos and share them -> Opening the picker—go ahead and select the videos you want to share.']	Could you look for reliable sources that discuss the causes of urban pollution?	Could you look for reliable sources that discuss the causes of urban pollution?	{'plan': 'web_search', 'arguments': {'query': 'causes of urban pollution sources'}}	INTENT_ACTION_VIDEO_CAMERA-908-ACTION_GET_CONTENT-1-web_search-1_NR	['web_search', 'ACTION_VIEW_SENT_EMAILS', 'ACTION_EDIT_VIDEO', 'ACTION_VIDEO_CAPTURE', 'ACTION_VIEW_WEB_HISTORY']
"['turn 1: Could you retrieve the phone call history for me? -> Recent calls: Diana +44-20-7946-0958 (Incoming) - Today 8:30 AM; Emma +1-415-555-2671 (Missed) - Yesterday 6:20 PM; Frank +1-629-555-0148 (Outgoing) - Today 11:05 AM', ""turn 2: Create a new contact with +44-20-7946-0958 and name her Diana -> 'Diana' saved! You can view her details here: content://contacts/people/diana""]"	I'm looking for reviews of the top fitness trackers right now; can you search that for me?	I'm looking for reviews of the top fitness trackers right now; can you search that for me?	{'plan': 'web_search', 'arguments': {'query': 'reviews of top fitness trackers'}}	ACTION_VIEW_CALL_LOG-1892-ACTION_INSERT_CONTACT-1-web_search-1_NR	['launch_application', 'play_music', 'web_search', 'dial', 'ACTION_EDIT_DOCUMENT']
"[""turn 1: Can you display contact content://contacts/people/1005? -> Here's the info you requested (content://contacts/people/1005):\nEmma Brown\nPhone: 555-0105\nEmail: emma.brown@example.com"", ""turn 2: Pick someone for me from my phone's contact list. -> Alright, here's your contact list. Choose someone when you’re ready.""]"	Please initiate a search for updates on new sustainable fashion collections.	Please initiate a search for updates on new sustainable fashion collections.	{'plan': 'web_search', 'arguments': {'query': 'new sustainable fashion collections updates'}}	ACTION_VIEW_CONTACT-762-ACTION_PICK-1_NR-web_search-1_NR	['ACTION_SHOW_ALARMS', 'INTENT_ACTION_VIDEO_CAMERA', 'dial', 'web_search', 'search_location']
"[""turn 1: Schedule a study session 'Physics Group' on July 3, 2024 from 6pm to 8pm, location: Science Building room 5. -> Your 'Physics Group' study session is booked for July 3, 2024, 6:00\xa0PM–8:00\xa0PM in Science Building room\xa05. View it at content://calendar/event/1006"", 'turn 2: Please open the photo camera function on my device so I can take a snapshot. -> Photo camera is now open. Feel free to capture your moment.']"	Fetch web results regarding the current best practices in cybersecurity.	Fetch web results regarding the current best practices in cybersecurity.	{'plan': 'web_search', 'arguments': {'query': 'current best cybersecurity practices'}}	ACTION_INSERT_EVENT-471-INTENT_ACTION_STILL_IMAGE_CAMERA-1_NR-web_search-1_NR	['ACTION_SET_RINGTONE', 'send_email', 'web_search', 'get_contact_info', 'ACTION_SET_TIMER']
['turn 1: Pull up event 171. -> UX design workshop takes place July 11 at 2:00\xa0PM in Studio 5.', 'turn 2: List out all timers that are presently set and running. -> Active timers: [15 minutes – Call with Alex, 30 minutes – File upload, 2 hours – Meeting reminder]']	I'm interested in the advancements in 3D printing; can you check that online?	I'm interested in the advancements in 3D printing; can you check that online?	{'plan': 'web_search', 'arguments': {'query': 'advancements in 3D printing'}}	ACTION_VIEW_EVENT-1833-ACTION_SHOW_TIMERS-1_NR-web_search-1_NR	['send_message', 'web_search', 'ACTION_VIEW_CALL_LOG', 'ACTION_SHOW_ALARMS', 'ACTION_INSERT_EVENT']
['turn 1: Cut content://tutorials/design.mp4 so that it ends at 2:30. -> All done! design.mp4 now finishes at 2:30. Here’s your trimmed file: content://media/edited_video_002.mp4. Would you like to preview it?', 'turn 2: Turn on the camera app to capture a still image. -> Camera app in still-photo mode is now active.']	Look up recent developments in smart home technology for me.	Look up recent developments in smart home technology for me.	{'plan': 'web_search', 'arguments': {'query': 'recent smart home technology developments'}}	ACTION_EDIT_VIDEO-1727-INTENT_ACTION_STILL_IMAGE_CAMERA-1_NR-web_search-1_NR	['ACTION_VIDEO_CAPTURE', 'ACTION_GET_RINGTONE', 'ACTION_VIEW_CALL_LOG', 'web_search', 'ACTION_VIEW_SENT_EMAILS']
['turn 1: Show the default video interface -> Opening the default video player now.', 'turn 2: Trim content://videos/demo.mp4 from 0 ms to 15000 ms -> Trim successful: demo.mp4 is now clipped to the first 15 seconds. Get it here: content://media/edited_demo_007.mp4.']	I need information on the benefits of mindfulness meditation.	I need information on the benefits of mindfulness meditation.	{'plan': 'web_search', 'arguments': {'query': 'benefits of mindfulness meditation'}}	play_video-1428-ACTION_EDIT_VIDEO-1-web_search-1_NR	['ACTION_SHOW_ALARMS', 'ACTION_INSERT_CONTACT', 'ACTION_VIEW_SENT_MESSAGES', 'web_search', 'ACTION_VIEW_CALL_LOG']
['turn 1: Would you bring up the entry stored at content://contacts/people/1034? -> Bringing up the entry at content://contacts/people/1034.', 'turn 2: Change the phone number of the entry at content://contacts/people/1034 to 555-1234 -> Updated the phone number to 555-1234 for the contact at content://contacts/people/1034.']	Could you fetch online details on major archaeological discoveries in the last decade?	Could you fetch online details on major archaeological discoveries in the last decade?	{'plan': 'web_search', 'arguments': {'query': 'major archaeological discoveries past decade'}}	ACTION_VIEW_CONTACT-785-ACTION_EDIT_CONTACT-1-web_search-1_NR	['ACTION_INSERT_EVENT', 'web_search', 'search_location', 'ACTION_EDIT_VIDEO', 'ACTION_SHOW_TIMERS']
"[""turn 1: Please put down a lunch meetup 'Catch‑Up with Sarah' on June 30, 2024 at 12:00 PM to 1:00 PM at Central Café. -> Logged: “Catch‑Up with Sarah” (Lunch meetup) on June 30, 2024, 12:00\xa0PM–1:00\xa0PM at Central\xa0Café. Details: content://calendar/event/6"", 'turn 2: What are the details of content://calendar/event/6? -> Catch‑Up with Sarah (Lunch meetup): June 30, 2024, 12:00\xa0PM–1:00\xa0PM at Central Café.']"	Search online for practical dieting tips for maintaining a healthy lifestyle.	Search online for practical dieting tips for maintaining a healthy lifestyle.	{'plan': 'web_search', 'arguments': {'query': 'practical dieting tips healthy lifestyle'}}	ACTION_INSERT_EVENT-461-ACTION_VIEW_EVENT-1-web_search-1_NR	['open_settings', 'play_music', 'ACTION_INSERT_EVENT', 'web_search', 'ACTION_EDIT_VIDEO']
['turn 1: Make incoming calls play the file found at content://media/external/audio/media/30. -> Your default ringtone has been updated to the audio at content://media/external/audio/media/30.', 'turn 2: Let me choose a different ringtone -> Selected new ringtone: content://media/external/audio/media/35']	I'm curious about breakthroughs in nanotechnology; please initiate a search.	I'm curious about breakthroughs in nanotechnology; please initiate a search.	{'plan': 'web_search', 'arguments': {'query': 'breakthroughs in nanotechnology'}}	ACTION_SET_RINGTONE-1576-ACTION_GET_RINGTONE-1-web_search-1_NR	['ACTION_GET_CONTENT', 'ACTION_SHOW_ALARMS', 'ACTION_VIEW_SENT_EMAILS', 'INTENT_ACTION_STILL_IMAGE_CAMERA', 'web_search']
"[""turn 1: Kindly email subscribe@newsletter.com with subject 'Please subscribe me' and no body. -> Subscription request sent to subscribe@newsletter.com with the subject 'Please subscribe me'."", 'turn 2: Please fetch the email address for the contact located at /profile/john.doe. -> John\xa0Doe’s email is john.doe@personalmail.com.']"	Could you search for the latest trends in sustainable architecture?	Could you search for the latest trends in sustainable architecture?	{'plan': 'web_search', 'arguments': {'query': 'latest sustainable architecture trends'}}	send_email-1221-get_contact_info-1_NR-web_search-1_NR	['ACTION_EDIT_DOCUMENT', 'web_search', 'ACTION_PICK', 'ACTION_SHOW_ALARMS', 'ACTION_SET_RINGTONE']
"[""turn 1: I want to choose a single PDF report. -> Here's the report you selected: content://docs/annual_report.pdf"", 'turn 2: Could you let me pick a single text file from my device? -> Sure—opening your text files. Pick one to proceed.']"	Would you kindly open the Meditation app so I can relax?	Would you kindly open the Meditation app so I can relax?	{'plan': 'launch_application', 'arguments': {'application_name': 'Meditation'}}	ACTION_GET_CONTENT-174-ACTION_OPEN_DOCUMENT-1_NR-launch_application-1_NR	['ACTION_VIEW_SENT_EMAILS', 'ACTION_CREATE_DOCUMENT', 'send_message', 'launch_application', 'ACTION_VIEW_PLAYLIST']
