conversation_history	query	rewrited_query	answer	unique_idx	candidates
['turn 1: Could you please play the recording at blob://videos/recording123 -> Playing recording123 from blob://videos/recording123 now.', 'turn 2: Trim blob://videos/recording123 from 50000 ms to 60000 ms -> Trim complete! recording123 is now limited to 50s–60s. Your edited file is here: content://media/edited_recording123_010.mp4.']	I want to access and update the document at content://letter/form.	I want to access and update the document at content://letter/form.	{'plan': 'ACTION_EDIT_DOCUMENT', 'arguments': {'document_uri': 'content://letter/form'}}	play_video-1431-ACTION_EDIT_VIDEO-1-ACTION_EDIT_DOCUMENT-1_NR	['ACTION_EDIT_DOCUMENT', 'INTENT_ACTION_VIDEO_CAMERA', 'ACTION_IMAGE_CAPTURE', 'dial', 'launch_application']
['turn 1: Please amend content://contacts/people/anthony by updating the email to ant.hony@mail.com. -> Opening editor for Anthony (content://contacts/people/anthony), pre-filling email: ant.hony@mail.com.', 'turn 2: Retrieve the address from the contact record at /user/info/sandra. -> Sandra’s address is 123 Cherry Lane, Apt.\xa04, Denver, CO\xa080220.']	Show the editing view for the document at content://docs/schedule; please prefill it using 'Meeting schedule updated'.	Show the editing view for the document at content://docs/schedule; please prefill it using 'Meeting schedule updated'.	{'plan': 'ACTION_EDIT_DOCUMENT', 'arguments': {'document_uri': 'content://docs/schedule', 'content': 'Meeting schedule updated'}}	ACTION_EDIT_CONTACT-90-get_contact_info-1_NR-ACTION_EDIT_DOCUMENT-1_NR	['dial', 'ACTION_INSERT_CONTACT', 'ACTION_EDIT_DOCUMENT', 'play_video', 'open_settings']
"[""turn 1: Can you show the sites I've opened? -> Take a look at your browsing trail: Google (search 'best noise-cancelling headphones'), Wikipedia (Active Noise Control), YouTube (Sony WH-1000XM4 Review), Amazon (Bose QuietComfort 35 II), OpenAI Blog (GPT-4 Release Highlights), Reddit (r/headphones)."", ""turn 2: Search Reddit (r/headphones) again. -> Search results for 'r/headphones Reddit': The r/headphones subreddit page featuring user discussions, headphone recommendations, and community reviews.""]"	Edit the file at content://files/essay and load it with 'Thesis revision in progress'.	Edit the file at content://files/essay and load it with 'Thesis revision in progress'.	{'plan': 'ACTION_EDIT_DOCUMENT', 'arguments': {'document_uri': 'content://files/essay', 'content': 'Thesis revision in progress'}}	ACTION_VIEW_WEB_HISTORY-2088-web_search-1-ACTION_EDIT_DOCUMENT-1_NR	['play_music', 'ACTION_EDIT_ALARM', 'open_settings', 'ACTION_EDIT_DOCUMENT', 'ACTION_VIEW_PLAYLIST']
"[""turn 1: I want to dispatch an email to contact@vendor.org with subject 'RFQ Submission' and attach file:///rfq.docx and file:///pricing.xlsx. -> RFQ Submission email sent to contact@vendor.org with both RFQ and pricing files attached."", ""turn 2: Show the RFQ Submission I sent to contact@vendor.org. -> Here’s a record of your sent email: to contact@vendor.org – 'RFQ Submission'.""]"	I want an alarm at 22:40 with a custom ringtone from http://sound.com/alert.mp3, and please do not show the UI pop-up.	I want an alarm at 22:40 with a custom ringtone from http://sound.com/alert.mp3, and please do not show the UI pop-up.	{'plan': 'ACTION_SET_ALARM', 'arguments': {'EXTRA_HOUR': 22, 'EXTRA_MINUTES': 40, 'EXTRA_RINGTONE': 'http://sound.com/alert.mp3', 'EXTRA_SKIP_UI': True}}	send_email-1225-ACTION_VIEW_SENT_EMAILS-1-ACTION_SET_ALARM-1_NR	['ACTION_SET_ALARM', 'ACTION_SHOW_TIMERS', 'ACTION_VIDEO_CAPTURE', 'send_message', 'ACTION_VIEW_CALL_LOG']
"['turn 1: Give me a ring at 7077778888. -> Dialing 7077778888 now...', ""turn 2: Plan an event 'Restaurant Reservation' for a dinner with friends at Bella Italia to celebrate a special occasion. It should run from 1701700000000 to 1701705400000. -> Your dinner event 'Restaurant Reservation' is booked on December 5, 2023 at Bella Italia. (content://calender/event/10)""]"	Set a non-vibrating alarm at 20:00 with the message 'News Update'.	Set a non-vibrating alarm at 20:00 with the message 'News Update'.	{'plan': 'ACTION_SET_ALARM', 'arguments': {'EXTRA_HOUR': 20, 'EXTRA_MINUTES': 0, 'EXTRA_MESSAGE': 'News Update', 'EXTRA_VIBRATE': False}}	dial-941-ACTION_INSERT_EVENT-1_NR-ACTION_SET_ALARM-1_NR	['ACTION_EDIT_CONTACT', 'ACTION_SET_ALARM', 'ACTION_VIDEO_CAPTURE', 'ACTION_VIEW_SENT_MESSAGES', 'ACTION_OPEN_CONTENT']
['turn 1: Could you launch the MX Player to play this segment: rtsp://example.com/segment.sdp -> MX Player is streaming rtsp://example.com/segment.sdp now. Playback has started.', 'turn 2: From my device, I want to open a single image file for persistent use. -> Alright, opening your images—please select one file for ongoing use.']	Kindly create an alarm at 19:05 with the label 'Gym' that repeats on Friday and Saturday.	Kindly create an alarm at 19:05 with the label 'Gym' that repeats on Friday and Saturday.	{'plan': 'ACTION_SET_ALARM', 'arguments': {'EXTRA_HOUR': 19, 'EXTRA_MINUTES': 5, 'EXTRA_MESSAGE': 'Gym', 'EXTRA_DAYS': ['Friday', 'Saturday']}}	play_video-1437-ACTION_OPEN_DOCUMENT-1_NR-ACTION_SET_ALARM-1_NR	['open_settings', 'ACTION_INSERT_EVENT', 'ACTION_SET_ALARM', 'INTENT_ACTION_STILL_IMAGE_CAMERA', 'ACTION_VIEW_SENT_MESSAGES']
['turn 1: Fetch the complete profile of contact at content://com.company.contacts/contact/678. -> Complete profile for content://com.company.contacts/contact/678: Michael Johnson, Phone: 212-555-3456, Email: mike.johnson@company.com, Address: 987 Cedar Blvd, New York, NY 10022.', 'turn 2: Open content://com.company.contacts/contact/678 contact -> Here’s the complete contact for content://com.company.contacts/contact/678:\nMichael Johnson\nPhone: 212-555-3456\nEmail: mike.johnson@company.com\nAddress: 987 Cedar Blvd, New York, NY 10022']	I need an alarm at 8:25 AM with no additional settings.	I need an alarm at 8:25 AM with no additional settings.	{'plan': 'ACTION_SET_ALARM', 'arguments': {'EXTRA_HOUR': 8, 'EXTRA_MINUTES': 25}}	get_contact_info-1017-ACTION_VIEW_CONTACT-1-ACTION_SET_ALARM-1_NR	['ACTION_SET_ALARM', 'INTENT_ACTION_STILL_IMAGE_CAMERA', 'INTENT_ACTION_VIDEO_CAMERA', 'play_video', 'launch_application']
"['turn 1: Expose entry 110. -> Lunch with Sarah is on your calendar for tomorrow at 12:00\xa0PM at Deli Delight.', ""turn 2: Could you please open my phone's video recording application? -> Video camera is now open and recording-ready.""]"	Please set an alarm at 16:15 using the sound from http://mysite.com/sound.mp3.	Please set an alarm at 16:15 using the sound from http://mysite.com/sound.mp3.	{'plan': 'ACTION_SET_ALARM', 'arguments': {'EXTRA_HOUR': 16, 'EXTRA_MINUTES': 15, 'EXTRA_RINGTONE': 'http://mysite.com/sound.mp3'}}	ACTION_VIEW_EVENT-1828-INTENT_ACTION_VIDEO_CAMERA-1_NR-ACTION_SET_ALARM-1_NR	['open_settings', 'ACTION_VIEW_CONTACT', 'play_music', 'ACTION_SET_ALARM', 'ACTION_SHOW_TIMERS']
"['turn 1: Timer for 20 seconds, message quick exercise. -> Timer set for 20 seconds: quick exercise.', ""turn 2: Could you open content://reports/monthly to edit it? I want to add 'Update for March' before starting. -> Monthly report is open in the editor with ‘Update for March’ inserted at the top. Access it here: content://reports/monthly.""]"	Set an alarm for 11:30 AM with the note 'Meeting Reminder'.	Set an alarm for 11:30 AM with the note 'Meeting Reminder'.	{'plan': 'ACTION_SET_ALARM', 'arguments': {'EXTRA_HOUR': 11, 'EXTRA_MINUTES': 30, 'EXTRA_MESSAGE': 'Meeting Reminder'}}	ACTION_SET_TIMER-608-ACTION_EDIT_DOCUMENT-1_NR-ACTION_SET_ALARM-1_NR	['ACTION_SET_ALARM', 'get_contact_info', 'ACTION_VIEW_CONTACT', 'ACTION_PICK', 'ACTION_OPEN_CONTENT']
['turn 1: Navigate to Language & Input so I can add another keyboard layout. -> Language & Input settings are now open so you can add a new keyboard.', 'turn 2: Please open the Bluetooth settings so I can pair my new headphones. -> Bluetooth settings opened successfully. You can now pair or manage your devices.']	Could you set an alarm at 5:50 AM that goes off only on Sundays?	Could you set an alarm at 5:50 AM that goes off only on Sundays?	{'plan': 'ACTION_SET_ALARM', 'arguments': {'EXTRA_HOUR': 5, 'EXTRA_MINUTES': 50, 'EXTRA_DAYS': ['Sunday']}}	open_settings-1099-open_settings-1_NR-ACTION_SET_ALARM-1_NR	['ACTION_SET_ALARM', 'play_music', 'ACTION_VIEW_WEB_HISTORY', 'ACTION_VIEW_SENT_MESSAGES', 'ACTION_SET_TIMER']
['turn 1: Get the street address for content://org.addressbook/entries/456. -> Street address for content://org.addressbook/entries/456: 456 Birch Lane, Gotham City, NJ 07097.', 'turn 2: Bring up content://org.addressbook/entries/456 -> Now viewing content://org.addressbook/entries/456. Address: 456 Birch Lane, Gotham City, NJ 07097. Scroll for more details.']	Change the ringtone on my device to content://media/echo_chime.	Change the ringtone on my device to content://media/echo_chime.	{'plan': 'ACTION_SET_RINGTONE', 'arguments': {'ringtone_uri': 'content://media/echo_chime'}}	get_contact_info-1016-ACTION_VIEW_CONTACT-1-ACTION_SET_RINGTONE-1_NR	['dial', 'launch_application', 'ACTION_SET_RINGTONE', 'ACTION_VIEW_SENT_MESSAGES', 'ACTION_OPEN_CONTENT']
['turn 1: Fire up the still photo camera. -> Still-photo camera is now active and ready to shoot.', 'turn 2: Snap one still photo for me. -> All set! Your still shot is stored at content://media/external/images/media/3344.']	Kindly adjust my phone's ringtone to content://media/vivid_beep.	Kindly adjust my phone's ringtone to content://media/vivid_beep.	{'plan': 'ACTION_SET_RINGTONE', 'arguments': {'ringtone_uri': 'content://media/vivid_beep'}}	INTENT_ACTION_STILL_IMAGE_CAMERA-825-ACTION_IMAGE_CAPTURE-1-ACTION_SET_RINGTONE-1_NR	['ACTION_VIDEO_CAPTURE', 'ACTION_VIEW_EVENT', 'ACTION_VIEW_RECENT_APPS', 'ACTION_SET_RINGTONE', 'ACTION_INSERT_EVENT']
['turn 1: Retrieve the secondary phone number in content://contacts/546/phone_secondary. -> Secondary phone number is (202) 555-0175.', 'turn 2: Map (202) 555-0175 -> That number is tied to Washington, D.C., but no exact address is available.']	Please update my incoming ringtone using the audio file at content://media/first_note.	Please update my incoming ringtone using the audio file at content://media/first_note.	{'plan': 'ACTION_SET_RINGTONE', 'arguments': {'ringtone_uri': 'content://media/first_note'}}	get_contact_info_from_uri-1050-search_location-1-ACTION_SET_RINGTONE-1_NR	['ACTION_SET_RINGTONE', 'ACTION_VIEW_PLAYLIST', 'ACTION_PICK', 'ACTION_VIEW_CALL_LOG', 'ACTION_EDIT_VIDEO']
"[""turn 1: Can you retrieve the email address of the contact for this URI: content://contacts/people/23? -> Sure thing—I've pulled up the email for that contact. It’s jane.doe23@example.com."", 'turn 2: Add phone number 555-123-4567 to content://contacts/people/23. -> All set—phone number 555-123-4567 added to the contact at content://contacts/people/23.']"	Establish content://media/cool_jingle as the new default ringtone on my device.	Establish content://media/cool_jingle as the new default ringtone on my device.	{'plan': 'ACTION_SET_RINGTONE', 'arguments': {'ringtone_uri': 'content://media/cool_jingle'}}	get_contact_info-968-ACTION_EDIT_CONTACT-1-ACTION_SET_RINGTONE-1_NR	['ACTION_GET_CONTENT', 'ACTION_SET_RINGTONE', 'ACTION_INSERT_EVENT', 'ACTION_OPEN_CONTENT', 'ACTION_VIEW_RECENT_APPS']
"['turn 1: Start playing music on YouTube Music. -> Getting YouTube Music ready for you.', ""turn 2: Let me see my 'Morning Motivation' playlist -> Opening Morning Motivation... Playlist 'Morning Motivation': Good Morning; Happy; Wake Me Up; Beautiful Day.""]"	I fancy the sound at content://media/chic_harmony as my ringtone. Could you update it?	I fancy the sound at content://media/chic_harmony as my ringtone. Could you update it?	{'plan': 'ACTION_SET_RINGTONE', 'arguments': {'ringtone_uri': 'content://media/chic_harmony'}}	play_music-1360-ACTION_VIEW_PLAYLIST-1-ACTION_SET_RINGTONE-1_NR	['ACTION_VIEW_SENT_EMAILS', 'ACTION_EDIT_DOCUMENT', 'ACTION_SET_RINGTONE', 'ACTION_INSERT_EVENT', 'send_email']
['turn 1: Show me where Mount Kilimanjaro stands. -> Mount Kilimanjaro is at 3.0674°\xa0S, 37.3556°\xa0E—displaying it on your map now.', 'turn 2: I need to adjust the clock on my device. Open the date and time settings, please. -> Date & Time settings opened. Set your clock as you wish.']	Set up the ringtone with URI content://media/pulse_tune for my incoming calls.	Set up the ringtone with URI content://media/pulse_tune for my incoming calls.	{'plan': 'ACTION_SET_RINGTONE', 'arguments': {'ringtone_uri': 'content://media/pulse_tune'}}	search_location-1162-open_settings-1_NR-ACTION_SET_RINGTONE-1_NR	['ACTION_SET_ALARM', 'ACTION_SET_RINGTONE', 'ACTION_CREATE_DOCUMENT', 'play_music', 'ACTION_SHOW_TIMERS']
"['turn 1: What are the alarms set up on my phone? -> Your phone currently has these alarms: [alarm_id: 1 - 6:10 AM, Jogging; alarm_id: 2 - 6:40 AM, Shower; alarm_id: 3 - 7:15 AM, Coffee; alarm_id: 4 - 8:30 AM, Department Meeting]', ""turn 2: I'm looking for someone’s mailing address in my contact list. -> Here are your saved addresses. Tap on a contact to grab their mailing address.""]"	I prefer the ringtone content://media/gentle_breeze; please change my phone sound.	I prefer the ringtone content://media/gentle_breeze; please change my phone sound.	{'plan': 'ACTION_SET_RINGTONE', 'arguments': {'ringtone_uri': 'content://media/gentle_breeze'}}	ACTION_SHOW_ALARMS-698-ACTION_PICK-1_NR-ACTION_SET_RINGTONE-1_NR	['ACTION_SET_ALARM', 'INTENT_ACTION_STILL_IMAGE_CAMERA', 'play_music', 'launch_application', 'ACTION_SET_RINGTONE']
['turn 1: Film a demonstration and store at content://media/demos/demo.mov. -> Demonstration recorded successfully: content://media/demos/demo.mov.', 'turn 2: Play content://media/demos/demo.mov now -> Playing your demonstration video now.']	Could you help me see which timers are operational right now?	Could you help me see which timers are operational right now?	{'plan': 'ACTION_SHOW_TIMERS', 'arguments': {}}	ACTION_VIDEO_CAPTURE-711-ACTION_OPEN_CONTENT-1-ACTION_SHOW_TIMERS-1_NR	['ACTION_SHOW_TIMERS', 'ACTION_VIEW_EVENT', 'web_search', 'play_video', 'ACTION_SHOW_ALARMS']
['turn 1: I want to save a draft web page as DraftPage.html. -> DraftPage.html is ready for you at content://documents/DraftPage.html.', 'turn 2: Could you activate the still photo camera on my phone? -> Still photo camera is now running—ready to click!']	I need to check what timers are still ticking. Could you display them?	I need to check what timers are still ticking. Could you display them?	{'plan': 'ACTION_SHOW_TIMERS', 'arguments': {}}	ACTION_CREATE_DOCUMENT-12-INTENT_ACTION_STILL_IMAGE_CAMERA-1_NR-ACTION_SHOW_TIMERS-1_NR	['get_contact_info', 'ACTION_PICK', 'ACTION_EDIT_ALARM', 'ACTION_VIEW_SENT_MESSAGES', 'ACTION_SHOW_TIMERS']
['turn 1: Open up the default system camera for video. -> Video camera initialized. Let’s roll!', 'turn 2: Capture the video for me. -> Sure, recording started. Your video will be saved automatically when you stop.']	List out all timers that are presently set and running.	List out all timers that are presently set and running.	{'plan': 'ACTION_SHOW_TIMERS', 'arguments': {}}	INTENT_ACTION_VIDEO_CAMERA-910-ACTION_VIDEO_CAPTURE-1-ACTION_SHOW_TIMERS-1_NR	['ACTION_SHOW_TIMERS', 'ACTION_OPEN_DOCUMENT', 'ACTION_GET_CONTENT', 'play_video', 'ACTION_SHOW_ALARMS']
"[""turn 1: Please retrieve the subscriber's email address on content://contacts/555/data/email_subscriber. -> Subscriber email retrieved: subscriber@service.com."", ""turn 2: Please schedule an event called 'Fitness Bootcamp'. It's described as an intense morning workout session at a local fitness center from 1701800000000 to 1701803600000. -> 'Fitness Bootcamp' has been logged for December 6, 2023 at Local fitness center. See it at content://calender/event/9""]"	Could you provide a snapshot of all the timers active right now?	Could you provide a snapshot of all the timers active right now?	{'plan': 'ACTION_SHOW_TIMERS', 'arguments': {}}	get_contact_info_from_uri-1059-ACTION_INSERT_EVENT-1_NR-ACTION_SHOW_TIMERS-1_NR	['ACTION_INSERT_CONTACT', 'ACTION_EDIT_CONTACT', 'ACTION_VIEW_RECENT_APPS', 'ACTION_SHOW_TIMERS', 'play_video']
['turn 1: Retrieve the mobile phone number for content://com.example.contacts/345. -> Mobile number for content://com.example.contacts/345 is 415-555-0123.', 'turn 2: Open content://com.example.contacts/345 contact -> Access granted to content://com.example.contacts/345. Mobile number: 415-555-0123. Full profile accessible on screen.']	I am interested in seeing the timers that are currently on.	I am interested in seeing the timers that are currently on.	{'plan': 'ACTION_SHOW_TIMERS', 'arguments': {}}	get_contact_info-1014-ACTION_VIEW_CONTACT-1-ACTION_SHOW_TIMERS-1_NR	['ACTION_EDIT_VIDEO', 'ACTION_EDIT_ALARM', 'ACTION_VIEW_EVENT', 'ACTION_SHOW_TIMERS', 'open_settings']
"[""turn 1: Could you buzz the client at +1 212 555 0148: 'Invoice #12345 is due tomorrow.' -> Sent! 'Invoice #12345 is due tomorrow.' has been delivered to +12125550148."", ""turn 2: Show me the messages I've sent recently -> Here's a quick look at your sent messages: Client +12125550148 – 'Invoice #12345 is due tomorrow.'.""]"	Show me the active timers list.	Show me the active timers list.	{'plan': 'ACTION_SHOW_TIMERS', 'arguments': {}}	send_message-1291-ACTION_VIEW_SENT_MESSAGES-1-ACTION_SHOW_TIMERS-1_NR	['ACTION_SHOW_TIMERS', 'ACTION_VIDEO_CAPTURE', 'open_settings', 'ACTION_VIEW_CALL_LOG', 'ACTION_EDIT_CONTACT']
['turn 1: Please run the Calendar app and show me today’s events. -> Calendar has been launched successfully. Here’s today’s agenda.', 'turn 2: What’s been opened after the Calendar app? -> After Calendar: Mail; Maps; Weather; News.']	What timers are counting down right now?	What timers are counting down right now?	{'plan': 'ACTION_SHOW_TIMERS', 'arguments': {}}	launch_application-1511-ACTION_VIEW_RECENT_APPS-1-ACTION_SHOW_TIMERS-1_NR	['ACTION_IMAGE_CAPTURE', 'send_message', 'ACTION_CREATE_DOCUMENT', 'ACTION_VIEW_CALL_LOG', 'ACTION_SHOW_TIMERS']
['turn 1: Take me to event number 89. -> Event 89: Coffee Chat at 4:00\xa0PM on July 14, Location: Java Cafe.', 'turn 2: Navigate to Java Cafe -> Launching navigation to Java Cafe. Enjoy your coffee chat!']	Could you display an inventory of active timers?	Could you display an inventory of active timers?	{'plan': 'ACTION_SHOW_TIMERS', 'arguments': {}}	ACTION_VIEW_EVENT-1793-ACTION_NAVIGATE_TO_LOCATION-1-ACTION_SHOW_TIMERS-1_NR	['ACTION_CREATE_DOCUMENT', 'ACTION_SET_TIMER', 'ACTION_GET_RINGTONE', 'ACTION_EDIT_VIDEO', 'ACTION_SHOW_TIMERS']
['turn 1: Present me the video camera. -> Camera opened in video mode. Start shooting!', 'turn 2: Show me the videos I just shot -> Here are your recent clips—tap the ones you just shot to view or share.']	Show me any timer that is still running at this moment.	Show me any timer that is still running at this moment.	{'plan': 'ACTION_SHOW_TIMERS', 'arguments': {}}	INTENT_ACTION_VIDEO_CAMERA-911-ACTION_GET_CONTENT-1-ACTION_SHOW_TIMERS-1_NR	['ACTION_EDIT_VIDEO', 'web_search', 'play_music', 'ACTION_SHOW_TIMERS', 'get_contact_info_from_uri']
"[""turn 1: Could you please set a yoga retreat called 'Sunset Stretch' on September 21, 2024 5:30 PM to 7:00 PM at Beachside? Description: Evening flow by the sea. -> Your yoga retreat “Sunset Stretch” is scheduled for September 21, 2024, 5:30\xa0PM–7:00\xa0PM at Beachside. See it: content://calendar/event/8"", 'turn 2: Open content://calendar/event/8. -> Sunset Stretch (Yoga retreat): September\xa021, 2024, 5:30\xa0PM–7:00\xa0PM at Beachside. Evening flow by the sea.']"	I need details on the timers that haven't finished yet.	I need details on the timers that haven't finished yet.	{'plan': 'ACTION_SHOW_TIMERS', 'arguments': {}}	ACTION_INSERT_EVENT-463-ACTION_VIEW_EVENT-1-ACTION_SHOW_TIMERS-1_NR	['ACTION_SHOW_TIMERS', 'play_music', 'ACTION_VIEW_PLAYLIST', 'ACTION_EDIT_ALARM', 'ACTION_SET_RINGTONE']
['turn 1: Get the still camera running. -> Still camera is up and running.', 'turn 2: Capture the still camera and save it to content://android/data/myapp/cache/captured.jpg -> Image snapped and stored at content://android/data/myapp/cache/captured.jpg.']	Provide all timers that are active at the moment.	Provide all timers that are active at the moment.	{'plan': 'ACTION_SHOW_TIMERS', 'arguments': {}}	INTENT_ACTION_STILL_IMAGE_CAMERA-843-ACTION_IMAGE_CAPTURE-1-ACTION_SHOW_TIMERS-1_NR	['ACTION_VIDEO_CAPTURE', 'ACTION_VIEW_SENT_EMAILS', 'ACTION_VIEW_WEB_HISTORY', 'play_video', 'ACTION_SHOW_TIMERS']
"[""turn 1: Please send an email to boss@company.com stating 'I will be on leave tomorrow'. -> Your message 'I will be on leave tomorrow' has been sent to boss@company.com."", ""turn 2: Display the leave note I sent. -> Sent emails: to boss@company.com – 'I will be on leave tomorrow'.""]"	Show me the currently operational timers.	Show me the currently operational timers.	{'plan': 'ACTION_SHOW_TIMERS', 'arguments': {}}	send_email-1224-ACTION_VIEW_SENT_EMAILS-1-ACTION_SHOW_TIMERS-1_NR	['ACTION_SHOW_TIMERS', 'ACTION_VIEW_WEB_HISTORY', 'play_video', 'ACTION_OPEN_CONTENT', 'ACTION_IMAGE_CAPTURE']
"['turn 1: Please open the cam for video. -> The camera app is now in video mode.', ""turn 2: Просмотр моей недавней истории браузера, пожалуйста. -> Here's your recent browsing history: Yandex (search 'weather today'), VK (news feed), YouTube (video 'world news'), Wikipedia (Russian version), GitHub (repositories).""]"	Could you list my active timers?	Could you list my active timers?	{'plan': 'ACTION_SHOW_TIMERS', 'arguments': {}}	INTENT_ACTION_VIDEO_CAMERA-909-ACTION_VIEW_WEB_HISTORY-1_NR-ACTION_SHOW_TIMERS-1_NR	['search_location', 'ACTION_EDIT_DOCUMENT', 'ACTION_IMAGE_CAPTURE', 'ACTION_SHOW_TIMERS', 'dial']
"[""turn 1: Show me a rundown of my recent app usage. -> Here's what you've accessed lately: News; Podcasts; Settings; Calculator"", 'turn 2: I need to capture a moving scene. Launch the video camera app for me. -> Launching video camera. Ready for action!']"	I want to view all the timers that are active at this time.	I want to view all the timers that are active at this time.	{'plan': 'ACTION_SHOW_TIMERS', 'arguments': {}}	ACTION_VIEW_RECENT_APPS-2203-INTENT_ACTION_VIDEO_CAMERA-1_NR-ACTION_SHOW_TIMERS-1_NR	['ACTION_VIEW_PLAYLIST', 'ACTION_SHOW_TIMERS', 'ACTION_VIDEO_CAPTURE', 'INTENT_ACTION_VIDEO_CAMERA', 'search_location']
"[""turn 1: Fetch the alternate email from content://contacts/324/data/email_alt. -> Here's the alternate email address: alt.email@provider.com."", ""turn 2: Locate alt.email@provider.com's domain on a map -> Sorry, I couldn’t find any HQ location for provider.com.""]"	I require an event 'Evening Swim' with the description 'Swimming session at the local pool'. There is no location provided. Please schedule it from 1703900000000 to 1703905400000.	I require an event 'Evening Swim' with the description 'Swimming session at the local pool'. There is no location provided. Please schedule it from 1703900000000 to 1703905400000.	{'plan': 'ACTION_INSERT_EVENT', 'arguments': {'TITLE': 'Evening Swim', 'DESCRIPTION': 'Swimming session at the local pool', 'BEGIN_TIME': 1703900000000, 'END_TIME': 1703905400000}}	get_contact_info_from_uri-1048-search_location-1-ACTION_INSERT_EVENT-1_NR	['ACTION_EDIT_CONTACT', 'ACTION_PICK', 'ACTION_SHOW_ALARMS', 'ACTION_INSERT_EVENT', 'send_email']
"['turn 1: I want to check recent calls I’ve made and received. -> Recent call entries: Mia +1-213-555-0156 (Missed) - Today 5:35 PM; Noah +1-415-555-0001 (Outgoing) - Yesterday 2:10 PM; Olivia +44-20-7946-0999 (Incoming) - Today 8:00 AM', ""turn 2: Save +44-20-7946-0999 as a new contact for Mia -> Mia's new contact (+44-20-7946-0999) is now saved. Check it: content://contacts/people/mia""]"	Schedule an event 'Workshop on AI' that dives deep into AI trends and technologies. It should be held at Innovation Hub, from 1703800000000 to 1703807200000.	Schedule an event 'Workshop on AI' that dives deep into AI trends and technologies. It should be held at Innovation Hub, from 1703800000000 to 1703807200000.	{'plan': 'ACTION_INSERT_EVENT', 'arguments': {'TITLE': 'Workshop on AI', 'DESCRIPTION': 'Deep dive into AI trends and technologies', 'EVENT_LOCATION': 'Innovation Hub', 'BEGIN_TIME': 1703800000000, 'END_TIME': 1703807200000}}	ACTION_VIEW_CALL_LOG-1895-ACTION_INSERT_CONTACT-1-ACTION_INSERT_EVENT-1_NR	['open_settings', 'ACTION_VIDEO_CAPTURE', 'ACTION_VIEW_PLAYLIST', 'ACTION_CREATE_DOCUMENT', 'ACTION_INSERT_EVENT']
['turn 1: Please call my aunt on 02-9876-5432. -> Connecting to your aunt at 02-9876-5432...', 'turn 2: I want an alarm at 22:40 with a custom ringtone from http://sound.com/alert.mp3, and please do not show the UI pop-up. -> Alarm (alarm_id: alarm_210) set for 10:40 PM with your custom ringtone (http://sound.com/alert.mp3) and UI skipped.']	Add a new calendar entry for 'Sales Presentation' to discuss new strategies. It will be hosted at Client Headquarters from 1703700000000 to 1703707200000.	Add a new calendar entry for 'Sales Presentation' to discuss new strategies. It will be hosted at Client Headquarters from 1703700000000 to 1703707200000.	{'plan': 'ACTION_INSERT_EVENT', 'arguments': {'TITLE': 'Sales Presentation', 'DESCRIPTION': 'Discuss new strategies', 'EVENT_LOCATION': 'Client Headquarters', 'BEGIN_TIME': 1703700000000, 'END_TIME': 1703707200000}}	dial-943-ACTION_SET_ALARM-1_NR-ACTION_INSERT_EVENT-1_NR	['dial', 'ACTION_NAVIGATE_TO_LOCATION', 'get_contact_info', 'ACTION_INSERT_EVENT', 'INTENT_ACTION_STILL_IMAGE_CAMERA']
