conversation_history	query	rewrited_query	answer	unique_idx	candidates
"[""turn 1: Show the playlist called 'Summer Chillout'. -> Playlist 'Summer Chillout': Sunset Lover; Ocean Eyes; Island in the Sun."", ""turn 2: Play Playlist 'Summer Chillout': Sunset Lover; Ocean Eyes; Island in the Sun. on Apple Music. -> Here we go! Playing your 'Summer Chillout' playlist on Apple Music: Sunset Lover, Ocean Eyes, Island in the Sun.""]"	I'm looking for someone's email contact details.	I'm looking for someone's email contact details.	{'plan': 'ACTION_PICK', 'arguments': {'data_type': 'email'}}	ACTION_VIEW_PLAYLIST-2144-play_music-1-ACTION_PICK-1_NR	['get_contact_info_from_uri', 'ACTION_PICK', 'launch_application', 'ACTION_VIDEO_CAPTURE', 'ACTION_NAVIGATE_TO_LOCATION']
"[""turn 1: Can you help me edit the contact content://contacts/people/mary_bell? I want to add her work email mary@bellcorp.com. -> Got it, launching Mary's contact. You can add her work email mary@bellcorp.com right away."", ""turn 2: Send content://contacts/people/mary_bell a reminder message asking if she saw my email. -> Reminder sent to Mary Bell (content://contacts/people/mary_bell): 'Did you see my email?'.""]"	Get me a phone contact from my list, please.	Get me a phone contact from my list, please.	{'plan': 'ACTION_PICK', 'arguments': {'data_type': 'phone'}}	ACTION_EDIT_CONTACT-57-send_message-1-ACTION_PICK-1_NR	['ACTION_EDIT_ALARM', 'ACTION_IMAGE_CAPTURE', 'ACTION_PICK', 'launch_application', 'ACTION_VIEW_SENT_MESSAGES']
"['turn 1: Please deliver the PDF report (https://reports.example.com/q1.pdf) to CFO at +49 151 76543210. -> Successfully sent the PDF report to +4915176543210.', ""turn 2: Can you list https://reports.example.com/q1.pdf I sent to the CFO and my recent sent messages? -> Here's a rundown of your recent messages: CFO +4915176543210 – 'PDF report delivered: https://reports.example.com/q1.pdf'.""]"	Can you help me pick a contact from my saved directory?	Can you help me pick a contact from my saved directory?	{'plan': 'ACTION_PICK', 'arguments': {}}	send_message-1282-ACTION_VIEW_SENT_MESSAGES-1-ACTION_PICK-1_NR	['ACTION_VIEW_CONTACT', 'ACTION_VIEW_WEB_HISTORY', 'ACTION_PICK', 'ACTION_EDIT_DOCUMENT', 'get_contact_info']
"[""turn 1: Could you play 'Blinding Lights' by The Weeknd on Spotify? -> Sure—now streaming 'Blinding Lights' by The Weeknd on Spotify."", ""turn 2: Show me my Favorites playlist. -> Playlist 'Favorites': Purple Rain; Hotel California; Smells Like Teen Spirit""]"	Pull an email from my stored contacts.	Pull an email from my stored contacts.	{'plan': 'ACTION_PICK', 'arguments': {'data_type': 'email'}}	play_music-1366-ACTION_VIEW_PLAYLIST-1-ACTION_PICK-1_NR	['get_contact_info', 'ACTION_PICK', 'ACTION_VIEW_EVENT', 'INTENT_ACTION_VIDEO_CAMERA', 'launch_application']
['turn 1: Could you send a motivational quote to my friend Lisa at 555-987-6543? -> Motivational quote sent to 555-987-6543.', 'turn 2: Ring 555-987-6543 up -> Connecting you to 555-987-6543 now...']	Grab a contact entry from my phone contacts list.	Grab a contact entry from my phone contacts list.	{'plan': 'ACTION_PICK', 'arguments': {}}	send_message-1242-dial-1-ACTION_PICK-1_NR	['ACTION_OPEN_DOCUMENT', 'ACTION_GET_RINGTONE', 'get_contact_info', 'send_message', 'ACTION_PICK']
['turn 1: Could you allow me to pick multiple image files to upload? -> You got it—tap on the images you want to upload. Multiple selections are allowed.', 'turn 2: If there are no images, create a new JPEG image file named SampleImage.jpg. -> Looks like your gallery’s empty. Let’s make a new photo—choose where to save “SampleImage.jpg.”']	I want to choose a contact number from my phone directory.	I want to choose a contact number from my phone directory.	{'plan': 'ACTION_PICK', 'arguments': {'data_type': 'phone'}}	ACTION_GET_CONTENT-198-ACTION_CREATE_DOCUMENT-1-ACTION_PICK-1_NR	['get_contact_info', 'ACTION_INSERT_EVENT', 'web_search', 'ACTION_PICK', 'INTENT_ACTION_STILL_IMAGE_CAMERA']
"['turn 1: Preview the alarms scheduled. -> Scheduled alarms: [alarm_id: 1 - 6:00 AM, Gym, alarm_id: 2 - 6:45 AM, Breakfast, alarm_id: 3 - 9:00 AM, Standup, alarm_id: 4 - 1:00 PM, Lunch, alarm_id: 5 - 8:30 PM, Wind Down]', ""turn 2: Set 'alarm_id: 4 - 1:00 PM, Lunch' to 1:15 PM and disable vibration for 'alarm_id: 4 - 1:00 PM, Lunch' -> Your Lunch alarm (ID:4) is now set for 1:15 PM with vibration turned off.""]"	Access one of my stored addresses from the contacts database.	Access one of my stored addresses from the contacts database.	{'plan': 'ACTION_PICK', 'arguments': {'data_type': 'address'}}	ACTION_SHOW_ALARMS-677-ACTION_EDIT_ALARM-1-ACTION_PICK-1_NR	['ACTION_CREATE_DOCUMENT', 'play_music', 'ACTION_PICK', 'ACTION_INSERT_EVENT', 'ACTION_SHOW_ALARMS']
['turn 1: Get me the finance department, dial extension 99. -> Dialing extension 99...', 'turn 2: Fetch my list of recent calls. -> Call log: Finance Dept Ext 99 +1-800-555-0099 (Outgoing) - Today 11:00 AM; David +1-646-555-0102 (Incoming) - Today 9:30 AM; Carol +1-718-555-0134 (Missed) - Yesterday 3:25 PM']	Could you please get an email address record from my contacts?	Could you please get an email address record from my contacts?	{'plan': 'ACTION_PICK', 'arguments': {'data_type': 'email'}}	dial-959-ACTION_VIEW_CALL_LOG-1-ACTION_PICK-1_NR	['ACTION_SET_ALARM', 'INTENT_ACTION_STILL_IMAGE_CAMERA', 'ACTION_EDIT_DOCUMENT', 'ACTION_PICK', 'ACTION_SET_TIMER']
"['turn 1: Load content://archive/film.mp4 so I can manually adjust it. -> Opening content://archive/film.mp4 in edit mode—feel free to make any adjustments.', ""turn 2: Assign my ringtone as content://media/ethereal_sound. -> The ringtone has been updated to 'ethereal_sound'.""]"	I require a contact from my people directory – please pull up one.	I require a contact from my people directory – please pull up one.	{'plan': 'ACTION_PICK', 'arguments': {}}	ACTION_EDIT_VIDEO-1725-ACTION_SET_RINGTONE-1_NR-ACTION_PICK-1_NR	['search_location', 'ACTION_CREATE_DOCUMENT', 'ACTION_PICK', 'ACTION_SET_RINGTONE', 'INTENT_ACTION_STILL_IMAGE_CAMERA']
['turn 1: Start streaming at rtmp://live.twitch.tv/app/stream_keyabc -> Connecting to rtmp://live.twitch.tv/app/stream_keyabc now. Your live stream is on!', 'turn 2: Can you start Snapchat? I want to see the latest stories. -> Snapchat is open—check out the newest stories.']	Select a personal contact entry from my list.	Select a personal contact entry from my list.	{'plan': 'ACTION_PICK', 'arguments': {}}	play_video-1440-launch_application-1_NR-ACTION_PICK-1_NR	['ACTION_OPEN_DOCUMENT', 'ACTION_PICK', 'INTENT_ACTION_STILL_IMAGE_CAMERA', 'ACTION_EDIT_ALARM', 'ACTION_CREATE_DOCUMENT']
['turn 1: Show the full record for content://profiles/contacts/104. -> Full details for contact 104:\n• Name: David Wilson\n• Phone: 202‑555‑0144\n• Email: dwilson@profiles.com\n• Address: 75 Sunset Blvd, Los Angeles, CA', 'turn 2: Show content://profiles/contacts/104 -> Here’s David Wilson’s complete record:\nPhone: 202‑555‑0144\nEmail: dwilson@profiles.com\nAddress: 75 Sunset Blvd, Los Angeles, CA']	Retrieve a mailing address from the contacts stored on my phone.	Retrieve a mailing address from the contacts stored on my phone.	{'plan': 'ACTION_PICK', 'arguments': {'data_type': 'address'}}	get_contact_info-1007-ACTION_VIEW_CONTACT-1-ACTION_PICK-1_NR	['ACTION_EDIT_ALARM', 'ACTION_GET_RINGTONE', 'ACTION_OPEN_DOCUMENT', 'ACTION_PICK', 'ACTION_VIEW_CALL_LOG']
"[""turn 1: Send a quick reminder to John at +15551234567 saying 'Don't forget the meeting at 3pm today.' -> Your reminder has been sent to +15551234567."", 'turn 2: Give +15551234567 a quick call -> Initiating call to +15551234567...']"	I need to dial someone soon; select their phone number from my phonebook.	I need to dial someone soon; select their phone number from my phonebook.	{'plan': 'ACTION_PICK', 'arguments': {'data_type': 'phone'}}	send_message-1241-dial-1-ACTION_PICK-1_NR	['ACTION_PICK', 'ACTION_IMAGE_CAPTURE', 'ACTION_SET_RINGTONE', 'launch_application', 'ACTION_EDIT_ALARM']
['turn 1: Start navigation to Masjid al-Haram, Mecca. -> Ready to go. navigation is started in a maps application: Masjid al-Haram, Mecca', 'turn 2: I need to see the trace of my online navigation; please show my web history. -> Your web history: Google Maps (Central Park); Booking.com (hotel search); TripAdvisor (reviews); Yelp (nearby restaurants)']	Can you extract an email address from my contact list?	Can you extract an email address from my contact list?	{'plan': 'ACTION_PICK', 'arguments': {'data_type': 'email'}}	ACTION_NAVIGATE_TO_LOCATION-1784-ACTION_VIEW_WEB_HISTORY-1_NR-ACTION_PICK-1_NR	['play_music', 'open_settings', 'ACTION_VIEW_CALL_LOG', 'ACTION_VIDEO_CAPTURE', 'ACTION_PICK']
['turn 1: Phone the helpline on 777-8888. -> Calling 777-8888...', 'turn 2: Save 777-8888 to my address book. -> Contact for 777-8888 saved. (URI: content://contacts/people/7778888)']	Fetch a telephone number from one of my contacts.	Fetch a telephone number from one of my contacts.	{'plan': 'ACTION_PICK', 'arguments': {'data_type': 'phone'}}	dial-925-ACTION_INSERT_CONTACT-1-ACTION_PICK-1_NR	['ACTION_EDIT_ALARM', 'ACTION_EDIT_DOCUMENT', 'ACTION_GET_CONTENT', 'ACTION_PICK', 'ACTION_EDIT_VIDEO']
"['turn 1: Launch the phone’s video camera. -> Phone’s video camera launched. Begin recording.', ""turn 2: Select two videos from the phone’s video camera. -> ['content://media/external/video/media/10', 'content://media/external/video/media/11']""]"	Please pick a contact from my saved contacts.	Please pick a contact from my saved contacts.	{'plan': 'ACTION_PICK', 'arguments': {}}	INTENT_ACTION_VIDEO_CAMERA-901-ACTION_GET_CONTENT-1-ACTION_PICK-1_NR	['ACTION_INSERT_CONTACT', 'send_email', 'ACTION_EDIT_CONTACT', 'ACTION_VIEW_CALL_LOG', 'ACTION_PICK']
['turn 1: Please open up the camera app so I can capture an image. -> Photo-taking camera is open and ready.', 'turn 2: Shoot an image. -> Your photo has been captured. You can find it at content://media/external/images/media/4751.']	Can you get me someone's phone number from my contact directory?	Can you get me someone's phone number from my contact directory?	{'plan': 'ACTION_PICK', 'arguments': {'data_type': 'phone'}}	INTENT_ACTION_STILL_IMAGE_CAMERA-822-ACTION_IMAGE_CAPTURE-1-ACTION_PICK-1_NR	['INTENT_ACTION_VIDEO_CAMERA', 'ACTION_VIEW_RECENT_APPS', 'ACTION_SET_TIMER', 'ACTION_PICK', 'send_email']
['turn 1: How can I edit content://courses/java_beginners.mp4? -> Sure thing! Opening content://courses/java_beginners.mp4 now so you can edit it.', 'turn 2: Play content://courses/java_beginners.mp4 back -> Playing content://courses/java_beginners.mp4 now. Let me know if you need anything else.']	Kindly pull the communication details from URI contact://comm/email/ceo@company.com.	Kindly pull the communication details from URI contact://comm/email/ceo@company.com.	{'plan': 'get_contact_info_from_uri', 'arguments': {'data_uri': 'contact://comm/email/ceo@company.com'}}	ACTION_EDIT_VIDEO-1716-play_video-1-get_contact_info_from_uri-1_NR	['ACTION_INSERT_CONTACT', 'open_settings', 'get_contact_info_from_uri', 'get_contact_info', 'ACTION_SHOW_TIMERS']
"[""turn 1: Can you send 'Check out this photo from the event.' to +353 1 234 5678 with the picture at https://photos.com/event.jpg? -> Photo message sent to +35312345678."", ""turn 2: Please show my sent text messages. -> Sent messages: +35312345678\xa0– 'Check out this photo from the event.' with attachment (event.jpg).""]"	Get contact data from the provided URI: contact://info/supplier.	Get contact data from the provided URI: contact://info/supplier.	{'plan': 'get_contact_info_from_uri', 'arguments': {'data_uri': 'contact://info/supplier'}}	send_message-1280-ACTION_VIEW_SENT_MESSAGES-1-get_contact_info_from_uri-1_NR	['play_music', 'get_contact_info_from_uri', 'ACTION_VIEW_SENT_MESSAGES', 'INTENT_ACTION_VIDEO_CAMERA', 'send_email']
"['turn 1: Load event 181. -> Effective Communication training session on July 13 at 11:00\xa0AM in Conference Hall\xa0B.', ""turn 2: Please select content://media/glittering_tone as the ringtone for my device. -> Your device’s ringtone is now 'glittering_tone'. Thanks for choosing it!""]"	I need to review the phone data from contact://phone/cell/999888.	I need to review the phone data from contact://phone/cell/999888.	{'plan': 'get_contact_info_from_uri', 'arguments': {'data_uri': 'contact://phone/cell/999888'}}	ACTION_VIEW_EVENT-1834-ACTION_SET_RINGTONE-1_NR-get_contact_info_from_uri-1_NR	['ACTION_PICK', 'get_contact_info_from_uri', 'launch_application', 'play_video', 'ACTION_VIEW_WEB_HISTORY']
"[""turn 1: Please open 'Focus Flow'. -> Focus Flow: Brainwave; Ambient Concentration; Study Time."", ""turn 2: Play Study Time. -> Playing 'Study Time' now. Let's focus!""]"	Please extract the contact details via content URI 'contact://customer_service/800'.	Please extract the contact details via content URI 'contact://customer_service/800'.	{'plan': 'get_contact_info_from_uri', 'arguments': {'data_uri': 'contact://customer_service/800'}}	ACTION_VIEW_PLAYLIST-2143-play_music-1-get_contact_info_from_uri-1_NR	['INTENT_ACTION_VIDEO_CAMERA', 'ACTION_SHOW_ALARMS', 'send_message', 'ACTION_IMAGE_CAPTURE', 'get_contact_info_from_uri']
"['turn 1: I need to record a video, open camera. -> You’re all set. Video camera is open and waiting.', ""turn 2: Grab that recorded clip for sharing. -> ['content://temp/shared_clip_01.mp4']""]"	Fetch the email address stored at contact://mail/jane.smith@workmail.com.	Fetch the email address stored at contact://mail/jane.smith@workmail.com.	{'plan': 'get_contact_info_from_uri', 'arguments': {'data_uri': 'contact://mail/jane.smith@workmail.com'}}	INTENT_ACTION_VIDEO_CAMERA-900-ACTION_GET_CONTENT-1-get_contact_info_from_uri-1_NR	['ACTION_VIEW_WEB_HISTORY', 'get_contact_info_from_uri', 'play_music', 'dial', 'search_location']
"[""turn 1: I need to change John’s phone number to 555-1234 for his contact (content://contacts/people/john). Can you do that? -> Sure thing! Opening John's contact now so you can update his phone number to 555‑1234."", ""turn 2: Send John a message saying 'Hi John, I've updated your number to 555-1234.' -> Your message to John was delivered: 'Hi John, I've updated your number to 555-1234.'""]"	Could you please retrieve the information detailed in contact://details/quincy?	Could you please retrieve the information detailed in contact://details/quincy?	{'plan': 'get_contact_info_from_uri', 'arguments': {'data_uri': 'contact://details/quincy'}}	ACTION_EDIT_CONTACT-56-send_message-1-get_contact_info_from_uri-1_NR	['ACTION_VIDEO_CAPTURE', 'dial', 'ACTION_IMAGE_CAPTURE', 'get_contact_info_from_uri', 'ACTION_GET_RINGTONE']
"['turn 1: Provide me with the active timer list. -> Your active timers: 10 minutes - Workout, 5 minutes - Tea, 20 minutes - Baking.', ""turn 2: Set a 5-minute timer for meditation and don't skip the confirmation screen -> Got it! 5-minute meditation timer is all set.""]"	Kindly get the contact specification via contact://contact/info/jkl.	Kindly get the contact specification via contact://contact/info/jkl.	{'plan': 'get_contact_info_from_uri', 'arguments': {'data_uri': 'contact://contact/info/jkl'}}	ACTION_SHOW_TIMERS-1883-ACTION_SET_TIMER-1-get_contact_info_from_uri-1_NR	['web_search', 'play_music', 'get_contact_info_from_uri', 'ACTION_GET_RINGTONE', 'ACTION_SHOW_TIMERS']
['turn 1: Activate the still-photo mode of the device camera. -> Camera is now open in photo mode and ready to use.', 'turn 2: Please take a photo for me. -> Got it! Picture taken and stored at content://media/external/images/media/8234.']	Extract the contact number from the URI contact://numbers/3210.	Extract the contact number from the URI contact://numbers/3210.	{'plan': 'get_contact_info_from_uri', 'arguments': {'data_uri': 'contact://numbers/3210'}}	INTENT_ACTION_STILL_IMAGE_CAMERA-820-ACTION_IMAGE_CAPTURE-1-get_contact_info_from_uri-1_NR	['get_contact_info_from_uri', 'ACTION_CREATE_DOCUMENT', 'ACTION_EDIT_ALARM', 'ACTION_SHOW_ALARMS', 'open_settings']
"['turn 1: Locate the Sagrada Familia church in Barcelona for me. -> Dropping a pin at Sagrada Família, Carrer de Mallorca, 401, 08013 Barcelona, Spain. Check it out!', ""turn 2: Please call up a contact's email address from my records. -> Alrighty! Email selected here: content://contacts/email/108""]"	Retrieve the electronic mail info from contact://email/seth@domain.com.	Retrieve the electronic mail info from contact://email/seth@domain.com.	{'plan': 'get_contact_info_from_uri', 'arguments': {'data_uri': 'contact://email/seth@domain.com'}}	search_location-1168-ACTION_PICK-1_NR-get_contact_info_from_uri-1_NR	['ACTION_VIEW_SENT_MESSAGES', 'ACTION_SHOW_TIMERS', 'ACTION_OPEN_DOCUMENT', 'dial', 'get_contact_info_from_uri']
['turn 1: Could you start PowerPoint? I have a presentation to review. -> Microsoft PowerPoint is up and running—ready for your presentation review!', 'turn 2: Open Messenger so I can chat with my colleague. -> Messenger launched successfully—go ahead and start your chat.']	Please fetch the SMS details available at contact://sms/123456.	Please fetch the SMS details available at contact://sms/123456.	{'plan': 'get_contact_info_from_uri', 'arguments': {'data_uri': 'contact://sms/123456'}}	launch_application-1509-launch_application-1_NR-get_contact_info_from_uri-1_NR	['INTENT_ACTION_VIDEO_CAMERA', 'get_contact_info_from_uri', 'ACTION_PICK', 'ACTION_EDIT_DOCUMENT', 'ACTION_VIEW_CONTACT']
"[""turn 1: Can I see the 'Movie Soundtracks' tracks? -> Movie Soundtracks includes: Time; My Heart Will Go On; Now We Are Free."", ""turn 2: Play Movie Soundtracks on Spotify. -> Launching Spotify and playing 'Movie Soundtracks' now.""]"	Can you show the phone details referenced at contact://phone/home/555?	Can you show the phone details referenced at contact://phone/home/555?	{'plan': 'get_contact_info_from_uri', 'arguments': {'data_uri': 'contact://phone/home/555'}}	ACTION_VIEW_PLAYLIST-2141-play_music-1-get_contact_info_from_uri-1_NR	['get_contact_info_from_uri', 'send_message', 'search_location', 'play_music', 'ACTION_SHOW_ALARMS']
"['turn 1: Let me see all my outbound messages from the past week. -> Outbound messages this week: Mom – ""+82-3512-0000"" – ""Recipes sent!""; Emma – ""+44 7911 123456"" – ""Let’s catch up soon.""; HR – ""+1-650-555-0143"" – ""Thanks for the update.""', ""turn 2: I'm curious about recent advances in quantum computing; can you look it up? -> Fetching 'recent advances in quantum computing'... Showing news on qubit improvements, algorithm developments, and hardware breakthroughs.""]"	Get the social media account from contact://social/twitter/@tech_guru.	Get the social media account from contact://social/twitter/@tech_guru.	{'plan': 'get_contact_info_from_uri', 'arguments': {'data_uri': 'contact://social/twitter/@tech_guru'}}	ACTION_VIEW_SENT_MESSAGES-2003-web_search-1_NR-get_contact_info_from_uri-1_NR	['ACTION_OPEN_DOCUMENT', 'ACTION_EDIT_ALARM', 'ACTION_SET_TIMER', 'ACTION_GET_CONTENT', 'get_contact_info_from_uri']
"[""turn 1: Remind my dentist at appointments@dentalcare.com about my check-up next Monday. Subject should read 'Appointment Reminder'. -> Appointment Reminder emailed to appointments@dentalcare.com."", ""turn 2: Could you show me the Appointment Reminder email I just sent? -> Sent emails: to appointments@dentalcare.com - 'Appointment Reminder'""]"	Retrieve the contact details using URI contact://contact/phone/+1987654321.	Retrieve the contact details using URI contact://contact/phone/+1987654321.	{'plan': 'get_contact_info_from_uri', 'arguments': {'data_uri': 'contact://contact/phone/+1987654321'}}	send_email-1211-ACTION_VIEW_SENT_EMAILS-1-get_contact_info_from_uri-1_NR	['get_contact_info_from_uri', 'ACTION_NAVIGATE_TO_LOCATION', 'get_contact_info', 'ACTION_EDIT_CONTACT', 'ACTION_SHOW_ALARMS']
['turn 1: Open content://files/lecture.mp4 without any edits. -> Opening lecture.mp4 in the video editor now. Let me know if you want to trim or mute anything once it’s loaded!', 'turn 2: Play content://files/lecture.mp4 now -> Opening content://files/lecture.mp4 in the video player now.']	Kindly extract the info pointed by contact://info/employee.	Kindly extract the info pointed by contact://info/employee.	{'plan': 'get_contact_info_from_uri', 'arguments': {'data_uri': 'contact://info/employee'}}	ACTION_EDIT_VIDEO-1730-play_video-1-get_contact_info_from_uri-1_NR	['ACTION_SHOW_ALARMS', 'get_contact_info_from_uri', 'search_location', 'ACTION_VIEW_CALL_LOG', 'ACTION_EDIT_ALARM']
['turn 1: Please open the settings XML file: content://data/settings.xml (application/xml). -> Displaying settings.xml (application/xml) at content://data/settings.xml.', 'turn 2: Activate the video recording mode on my phone, please. -> Video camera mode is now on. You can begin filming.']	Fetch data from contact URI contact://data/extension_101.	Fetch data from contact URI contact://data/extension_101.	{'plan': 'get_contact_info_from_uri', 'arguments': {'data_uri': 'contact://data/extension_101'}}	ACTION_OPEN_CONTENT-254-INTENT_ACTION_VIDEO_CAMERA-1_NR-get_contact_info_from_uri-1_NR	['ACTION_SET_RINGTONE', 'ACTION_VIEW_RECENT_APPS', 'get_contact_info_from_uri', 'search_location', 'ACTION_OPEN_DOCUMENT']
['turn 1: Trim and mute content://performances/theater.mp4 between 10s and 120s. -> Perfect! I’ve extracted the 10s–2m segment from theater.mp4 and muted the audio. Your edited file is here: content://media/edited_video_004.mp4.', 'turn 2: Play content://media/edited_video_004.mp4 -> Playing the 10s–2m muted theater clip now. Here you go!']	Show me the work mobile number at contact://work/mobile/112233.	Show me the work mobile number at contact://work/mobile/112233.	{'plan': 'get_contact_info_from_uri', 'arguments': {'data_uri': 'contact://work/mobile/112233'}}	ACTION_EDIT_VIDEO-1729-play_video-1-get_contact_info_from_uri-1_NR	['ACTION_VIEW_EVENT', 'ACTION_GET_RINGTONE', 'launch_application', 'ACTION_IMAGE_CAPTURE', 'get_contact_info_from_uri']
"[""turn 1: Load the playlist named 'Kids' Favorites'. -> Here's 'Kids' Favorites': Baby Shark; Twinkle Twinkle Little Star; Wheels on the Bus."", ""turn 2: Play Baby Shark first song. -> Got it! Starting 'Baby Shark' now.""]"	Could you provide contact details from URI contact://email/support@helpdesk.com?	Could you provide contact details from URI contact://email/support@helpdesk.com?	{'plan': 'get_contact_info_from_uri', 'arguments': {'data_uri': 'contact://email/support@helpdesk.com'}}	ACTION_VIEW_PLAYLIST-2142-play_music-1-get_contact_info_from_uri-1_NR	['ACTION_EDIT_VIDEO', 'get_contact_info_from_uri', 'ACTION_VIEW_SENT_EMAILS', 'ACTION_EDIT_DOCUMENT', 'search_location']
"[""turn 1: Can you create an SVG diagram file called diagram.svg? -> Done creating 'diagram.svg'. You can find it here: content://documents/diagram.svg"", 'turn 2: Please view content://documents/diagram.svg -> Rendering SVG diagram from content://documents/diagram.svg.']"	Obtain the fax contact via contact://fax/007.	Obtain the fax contact via contact://fax/007.	{'plan': 'get_contact_info_from_uri', 'arguments': {'data_uri': 'contact://fax/007'}}	ACTION_CREATE_DOCUMENT-33-ACTION_OPEN_CONTENT-1-get_contact_info_from_uri-1_NR	['get_contact_info', 'ACTION_SHOW_ALARMS', 'get_contact_info_from_uri', 'ACTION_VIEW_CALL_LOG', 'ACTION_VIEW_EVENT']
"[""turn 1: Create a calendar entry for 'Board Meeting' on November 8, 2024, 9:30 AM to 12:00 PM at Headquarters, details: 'Quarterly board review'. -> Done! ‘Board Meeting’ (Quarterly board review) is set for November 8, 2024, 9:30\xa0AM–12:00\xa0PM at Headquarters. View it here: content://calendar/event/3"", 'turn 2: Get directions to Headquarters -> Kickstarting navigation: navigation is started in a maps application: Headquarters.']"	Retrieve additional info from contact://info/emergency.	Retrieve additional info from contact://info/emergency.	{'plan': 'get_contact_info_from_uri', 'arguments': {'data_uri': 'contact://info/emergency'}}	ACTION_INSERT_EVENT-458-ACTION_NAVIGATE_TO_LOCATION-1-get_contact_info_from_uri-1_NR	['ACTION_VIEW_SENT_MESSAGES', 'ACTION_SET_RINGTONE', 'ACTION_INSERT_CONTACT', 'get_contact_info_from_uri', 'ACTION_VIDEO_CAPTURE']
['turn 1: Generate an SVG icon file named icon.svg. -> SVG icon generated successfully. You can edit it here: content://documents/icon.svg', 'turn 2: Open content://documents/icon.svg and change its fill color to green -> Fill color has been changed to green in icon.svg. Your updated icon is ready at content://documents/icon.svg.']	Please check the contact record at contact://record/phone/+441234567890.	Please check the contact record at contact://record/phone/+441234567890.	{'plan': 'get_contact_info_from_uri', 'arguments': {'data_uri': 'contact://record/phone/+441234567890'}}	ACTION_CREATE_DOCUMENT-44-ACTION_EDIT_DOCUMENT-1-get_contact_info_from_uri-1_NR	['get_contact_info_from_uri', 'ACTION_EDIT_VIDEO', 'ACTION_EDIT_DOCUMENT', 'ACTION_VIEW_PLAYLIST', 'ACTION_SET_ALARM']
"[""turn 1: Add Rosalind Franklin: email rosie@chemistry.co.uk, note 'Scientist'. -> Rosalind Franklin’s contact entry is now in your list. (content://contacts/people/rosalind_franklin)"", 'turn 2: I need a list of all timers that are in progress right now. -> All timers currently in progress: [15 minutes – Report drafting; 6 minutes – Quick break; 25 minutes – Pasta cooking].']"	I require the phone info from contact://phone/office/321.	I require the phone info from contact://phone/office/321.	{'plan': 'get_contact_info_from_uri', 'arguments': {'data_uri': 'contact://phone/office/321'}}	ACTION_INSERT_CONTACT-430-ACTION_SHOW_TIMERS-1_NR-get_contact_info_from_uri-1_NR	['ACTION_INSERT_EVENT', 'get_contact_info_from_uri', 'search_location', 'launch_application', 'ACTION_OPEN_DOCUMENT']
