conversation_history	query	rewrited_query	answer	unique_idx	candidates
['turn 1: Can you open the ringtone list so I can choose a new tone? -> Absolutely, opening up the ringtone list for you.', 'turn 2: Could you start the Shopping application so I can browse for deals? -> Shopping app opened. Happy deal hunting!']	Acquire the phone info from the record located at /info/mark.	Acquire the phone info from the record located at /info/mark.	{'plan': 'get_contact_info', 'arguments': {'contact_uri': '/info/mark', 'info_type': 'phone'}}	ACTION_GET_RINGTONE-310-launch_application-1_NR-get_contact_info-1_NR	['play_music', 'ACTION_VIDEO_CAPTURE', 'ACTION_VIEW_SENT_EMAILS', 'ACTION_SHOW_TIMERS', 'get_contact_info']
"['turn 1: Play track with URI spotify:track:6rqhFgbbKwnb9MLmUQDhG6. -> Now playing track spotify:track:6rqhFgbbKwnb9MLmUQDhG6.', ""turn 2: Show me my 'Favorites' playlist -> Got your Favorites playlist: Bohemian Rhapsody; Hotel California; Imagine; Hey Jude.""]"	I desire to see the email address linked to the contact at /user/julia.	I desire to see the email address linked to the contact at /user/julia.	{'plan': 'get_contact_info', 'arguments': {'contact_uri': '/user/julia', 'info_type': 'email'}}	play_music-1356-ACTION_VIEW_PLAYLIST-1-get_contact_info-1_NR	['send_email', 'ACTION_IMAGE_CAPTURE', 'ACTION_SHOW_TIMERS', 'INTENT_ACTION_VIDEO_CAMERA', 'get_contact_info']
['turn 1: Please load content://documents/doc/638. -> The file at content://documents/doc/638 has been loaded. You can start editing as soon as you like.', 'turn 2: I want to know the address for the contact listed at /user/profile/jack. -> Jack’s address is 456 Oak Avenue, Building 12, Floor 3, New York, NY 10001.']	Can you obtain the address for the contact at /contacts/chris?	Can you obtain the address for the contact at /contacts/chris?	{'plan': 'get_contact_info', 'arguments': {'contact_uri': '/contacts/chris', 'info_type': 'address'}}	ACTION_EDIT_DOCUMENT-1564-get_contact_info-1_NR-get_contact_info-1_NR	['get_contact_info', 'ACTION_INSERT_EVENT', 'ACTION_SET_TIMER', 'ACTION_INSERT_CONTACT', 'ACTION_GET_CONTENT']
['turn 1: Start the Calculator app; I have some quick math to do. -> Calculator launched. Ready for your calculations.', 'turn 2: Show me the apps I opened in the last few uses. -> Just opened apps: Calculator; Notes; Weather; Clock.']	Please get the contact summary for /contacts/mia.	Please get the contact summary for /contacts/mia.	{'plan': 'get_contact_info', 'arguments': {'contact_uri': '/contacts/mia'}}	launch_application-1464-ACTION_VIEW_RECENT_APPS-1-get_contact_info-1_NR	['ACTION_EDIT_CONTACT', 'ACTION_SET_TIMER', 'get_contact_info', 'ACTION_GET_CONTENT', 'ACTION_VIEW_SENT_EMAILS']
"['turn 1: Fetch full details for this contact: content://com.app.addressbook/contacts/555 -> Full profile:\n• Name: Emma Johnson\n• Phone: 555-555-5555\n• Email: emma.johnson@appbook.com\n• Address: 789 Maple Ave, Lakeview, MN 56098', ""turn 2: Navigate to 789 Maple Ave, Lakeview, MN 56098 -> Your route to 789 Maple Ave, Lakeview, MN 56098 is ready. Let's go!""]"	I want the phone number for the contact at /data/steve.	I want the phone number for the contact at /data/steve.	{'plan': 'get_contact_info', 'arguments': {'contact_uri': '/data/steve', 'info_type': 'phone'}}	get_contact_info-972-search_location-1-get_contact_info-1_NR	['get_contact_info', 'ACTION_SET_TIMER', 'ACTION_INSERT_CONTACT', 'INTENT_ACTION_STILL_IMAGE_CAMERA', 'ACTION_NAVIGATE_TO_LOCATION']
"[""turn 1: Execute ACTION_VIEW_CONTACT on content://contacts/people/1010. -> Executing view for content://contacts/people/1010, here's the contact:\nEthan Wilson\nPhone: 555-0110\nEmail: ethan.wilson@example.com"", ""turn 2: Please arrange an event 'Stand-up Comedy Night' with the description 'Enjoy a night of laughter and entertainment' at the Comedy Club. It should be scheduled from 1702400000000 to 1702405400000. -> Fantastic! 'Stand-up Comedy Night' is set for December 12, 2023 at the Comedy Club. (content://calender/event/3)""]"	Retrieve the email information from /contacts/kevin.	Retrieve the email information from /contacts/kevin.	{'plan': 'get_contact_info', 'arguments': {'contact_uri': '/contacts/kevin', 'info_type': 'email'}}	ACTION_VIEW_CONTACT-767-ACTION_INSERT_EVENT-1_NR-get_contact_info-1_NR	['get_contact_info', 'INTENT_ACTION_VIDEO_CAMERA', 'ACTION_SHOW_TIMERS', 'ACTION_CREATE_DOCUMENT', 'play_music']
"['turn 1: Open up my browser log. -> Your last visited sites are: Google Search – best noise-cancelling headphones; Wikipedia – Active Noise Control; YouTube – Sony WH-1000XM4 Review; Amazon – Bose QuietComfort 35 II; OpenAI Blog – GPT-4 Release Highlights; Reddit – r/headphones discussion.', ""turn 2: Search Wikipedia – Active Noise Control again. -> Search results for 'Active Noise Control Wikipedia': Wikipedia entry detailing active noise control principles, applications in audio devices, and engineering techniques.""]"	Fetch the contact summary for /directory/linda_contact.	Fetch the contact summary for /directory/linda_contact.	{'plan': 'get_contact_info', 'arguments': {'contact_uri': '/directory/linda_contact'}}	ACTION_VIEW_WEB_HISTORY-2084-web_search-1-get_contact_info-1_NR	['get_contact_info_from_uri', 'ACTION_SET_RINGTONE', 'get_contact_info', 'ACTION_GET_CONTENT', 'ACTION_VIEW_CALL_LOG']
"['turn 1: Could you let me choose multiple text files for batch processing? -> Sure thing! Select all the text files you want to include.', ""turn 2: Send all the text files you want to include to me saying 'Batch files attached.' -> Your batch message 'Batch files attached.' has been delivered to you along with the selected text files.""]"	Could you deliver the address info for the URI /user/contact/paul?	Could you deliver the address info for the URI /user/contact/paul?	{'plan': 'get_contact_info', 'arguments': {'contact_uri': '/user/contact/paul', 'info_type': 'address'}}	ACTION_GET_CONTENT-177-send_message-1-get_contact_info-1_NR	['ACTION_INSERT_EVENT', 'ACTION_VIEW_SENT_MESSAGES', 'ACTION_EDIT_CONTACT', 'get_contact_info', 'INTENT_ACTION_VIDEO_CAMERA']
"[""turn 1: Could you register a 'Team Offsite' on September 27, 2024 from 8:00 AM until 5:00 PM at Mountain Resort, description: Team-building activities. -> Your Team Offsite is scheduled for September\xa027,\xa02024 from 8:00\xa0AM to 5:00\xa0PM at Mountain Resort (Team‑building activities). Event saved: content://calendar/event/8"", 'turn 2: Open content://calendar/event/8 offsite event. -> Team Offsite is all arranged for September\xa027,\xa02024, 8:00\xa0AM–5:00\xa0PM at Mountain Resort (Team‑building activities).']"	Give me the phone information from the contact record located at /contacts/oliver.	Give me the phone information from the contact record located at /contacts/oliver.	{'plan': 'get_contact_info', 'arguments': {'contact_uri': '/contacts/oliver', 'info_type': 'phone'}}	ACTION_INSERT_EVENT-483-ACTION_VIEW_EVENT-1-get_contact_info-1_NR	['ACTION_EDIT_DOCUMENT', 'send_email', 'ACTION_VIEW_CALL_LOG', 'get_contact_info', 'ACTION_EDIT_VIDEO']
"['turn 1: Open calendar event 161. -> Coffee chat with Mike slated for 4:00\xa0PM today at Central Perk.', ""turn 2: I would like to add an event called 'Sculpture Workshop'. The description is 'Learn sculpting basics under expert guidance'. It will be hosted at the Art Institute from 1702500000000 to 1702505400000. -> Event 'Sculpture Workshop' has been added on December 13, 2023 at Art Institute. Here's the link: content://calender/event/2""]"	I need to see the email details from /users/info/nina.	I need to see the email details from /users/info/nina.	{'plan': 'get_contact_info', 'arguments': {'contact_uri': '/users/info/nina', 'info_type': 'email'}}	ACTION_VIEW_EVENT-1832-ACTION_INSERT_EVENT-1_NR-get_contact_info-1_NR	['ACTION_SET_TIMER', 'get_contact_info', 'send_message', 'ACTION_INSERT_CONTACT', 'play_video']
"['turn 1: Timer for 20 seconds, message quick exercise. -> Timer set for 20 seconds: quick exercise.', ""turn 2: List the timers I'm running. -> Currently active timers: [20 seconds – quick exercise]""]"	Get me the contact summary for /contacts/henry.	Get me the contact summary for /contacts/henry.	{'plan': 'get_contact_info', 'arguments': {'contact_uri': '/contacts/henry'}}	ACTION_SET_TIMER-608-ACTION_SHOW_TIMERS-1-get_contact_info-1_NR	['get_contact_info', 'play_music', 'ACTION_OPEN_CONTENT', 'send_email', 'ACTION_GET_RINGTONE']
['turn 1: Let me pick a melody from the ringtone list. -> Sure—opening the melody list so you can pick a ringtone.', 'turn 2: I need to retrieve a PDF document from my cloud storage. Let me pick one file, please. -> On it—opening the PDF selector. Please pick the file from your cloud storage.']	What is the phone number associated with /contacts/rita?	What is the phone number associated with /contacts/rita?	{'plan': 'get_contact_info', 'arguments': {'contact_uri': '/contacts/rita', 'info_type': 'phone'}}	ACTION_GET_RINGTONE-324-ACTION_OPEN_DOCUMENT-1_NR-get_contact_info-1_NR	['ACTION_INSERT_CONTACT', 'INTENT_ACTION_STILL_IMAGE_CAMERA', 'ACTION_SET_RINGTONE', 'get_contact_info', 'open_settings']
"['turn 1: Please adjust alarm 40 to 10:10, schedule it daily. -> Alarm 40 has been adjusted to 10:10 and is now scheduled to go off every day.', ""turn 2: Please show me all the alarms. -> Here's all the alarms you've configured: [alarm_id: 24 – Sat 10:10\xa0PM (no vibration), alarm_id: 26 – Wed 4:35\xa0PM (pop_tune), alarm_id: 27 – Mon–Wed 8:05\xa0AM (Gentle Bell), alarm_id: 28 – 10:10\xa0AM “Meeting” (Office Bell), alarm_id: 29 – 3:15\xa0PM “Pick up kids” (Kids Tune), alarm_id: 30 – Sat 6:50\xa0AM, alarm_id: 31 – Mon–Fri 1:13\xa0PM “Lunchtime” (Lunch Jingle; no vib), alarm_id: 37 – 9:09\xa0AM (classic; vibrate), alarm_id: 38 – Mon/Wed/Fri 9:21\xa0PM “Study” (study_track), alarm_id: 40 – daily 10:10\xa0AM]""]"	I require the address details of the contact at /user/info/samuel.	I require the address details of the contact at /user/info/samuel.	{'plan': 'get_contact_info', 'arguments': {'contact_uri': '/user/info/samuel', 'info_type': 'address'}}	ACTION_EDIT_ALARM-1674-ACTION_SHOW_ALARMS-1-get_contact_info-1_NR	['ACTION_VIEW_CONTACT', 'ACTION_PICK', 'ACTION_EDIT_VIDEO', 'web_search', 'get_contact_info']
['turn 1: Capture a quick video. -> Done! Your video has been recorded. Here’s the URI: content://videos/quickcap_001.mp4', 'turn 2: Play content://videos/quickcap_001.mp4 back -> Playing your quick video now.']	Can you retrieve the email info for the record at /contacts/laura?	Can you retrieve the email info for the record at /contacts/laura?	{'plan': 'get_contact_info', 'arguments': {'contact_uri': '/contacts/laura', 'info_type': 'email'}}	ACTION_VIDEO_CAPTURE-706-ACTION_OPEN_CONTENT-1-get_contact_info-1_NR	['ACTION_SET_TIMER', 'get_contact_info', 'play_music', 'ACTION_VIEW_CONTACT', 'ACTION_SET_ALARM']
['turn 1: Can you spin up a PDF named AnnualReport2023.pdf for me? -> Your PDF AnnualReport2023.pdf is now available at content://documents/AnnualReport2023.pdf.', 'turn 2: Append a conclusion page with key takeaways to content://documents/AnnualReport2023.pdf. -> Your AnnualReport2023.pdf is open for editing, and the conclusion page with key takeaways has been added. Check it out here: content://documents/AnnualReport2023.pdf.']	Please pull the phone number from the contact at /contacts/david.	Please pull the phone number from the contact at /contacts/david.	{'plan': 'get_contact_info', 'arguments': {'contact_uri': '/contacts/david', 'info_type': 'phone'}}	ACTION_CREATE_DOCUMENT-18-ACTION_EDIT_DOCUMENT-1-get_contact_info-1_NR	['ACTION_EDIT_DOCUMENT', 'play_music', 'get_contact_info', 'ACTION_VIEW_SENT_EMAILS', 'ACTION_OPEN_DOCUMENT']
['turn 1: Choose several PPT slideshows. -> Got it! Feel free to pick multiple PowerPoint slideshow files (.ppt).', 'turn 2: Access the internal storage settings for my device, please. -> Internal storage settings are now open—manage your device storage as needed.']	Show me a complete summary for /data/alex.	Show me a complete summary for /data/alex.	{'plan': 'get_contact_info', 'arguments': {'contact_uri': '/data/alex'}}	ACTION_OPEN_DOCUMENT-153-open_settings-1_NR-get_contact_info-1_NR	['get_contact_info', 'ACTION_EDIT_DOCUMENT', 'play_video', 'ACTION_VIEW_RECENT_APPS', 'INTENT_ACTION_VIDEO_CAMERA']
['turn 1: Please display the list of ringtones so I can pick one. -> Ringtone chosen: content://media/ringtone/chime_alert.mp3', 'turn 2: Make content://media/ringtone/chime_alert.mp3 my default ringtone. -> Great choice! Your default ringtone is now content://media/ringtone/chime_alert.mp3.']	I want to know the address for the contact listed at /user/profile/jack.	I want to know the address for the contact listed at /user/profile/jack.	{'plan': 'get_contact_info', 'arguments': {'contact_uri': '/user/profile/jack', 'info_type': 'address'}}	ACTION_GET_RINGTONE-305-ACTION_SET_RINGTONE-1-get_contact_info-1_NR	['get_contact_info', 'search_location', 'ACTION_VIEW_EVENT', 'ACTION_INSERT_CONTACT', 'web_search']
['turn 1: Please start the camera in photo capture mode. -> Photo mode enabled, ready for capture.', 'turn 2: Initiate the video camera on my phone, I need to shoot some footage. -> Switched to video recording mode. Camera is live.']	Fetch the email information for the contact at /directory/evelyn.email.	Fetch the email information for the contact at /directory/evelyn.email.	{'plan': 'get_contact_info', 'arguments': {'contact_uri': '/directory/evelyn.email', 'info_type': 'email'}}	INTENT_ACTION_STILL_IMAGE_CAMERA-858-INTENT_ACTION_VIDEO_CAMERA-1_NR-get_contact_info-1_NR	['ACTION_OPEN_CONTENT', 'ACTION_PICK', 'get_contact_info', 'ACTION_NAVIGATE_TO_LOCATION', 'ACTION_VIEW_SENT_EMAILS']
['turn 1: Press camera shutter and save the image to content://photos/app_saved/new_photo.jpeg -> Done! Your photo is now stored at content://photos/app_saved/new_photo.jpeg.', 'turn 2: Let me see content://photos/app_saved/new_photo.jpeg -> Got it—here’s your new photo.']	Could you fetch the phone information from /contacts/amy_2023?	Could you fetch the phone information from /contacts/amy_2023?	{'plan': 'get_contact_info', 'arguments': {'contact_uri': '/contacts/amy_2023', 'info_type': 'phone'}}	ACTION_IMAGE_CAPTURE-340-ACTION_OPEN_CONTENT-1-get_contact_info-1_NR	['ACTION_NAVIGATE_TO_LOCATION', 'get_contact_info', 'ACTION_PICK', 'get_contact_info_from_uri', 'ACTION_SET_RINGTONE']
['turn 1: Select various file types to include in the package. -> Opening file selector—please pick multiple files of any type.', 'turn 2: If there aren’t any files, create a new PDF document named PackageContents.pdf. -> No files detected. Let’s generate a PDF—pick a folder for “PackageContents.pdf.”']	Help me bring up a file picker to choose multiple plain text documents for review.	Help me bring up a file picker to choose multiple plain text documents for review.	{'plan': 'ACTION_OPEN_DOCUMENT', 'arguments': {'mime_types': ['text/plain'], 'allow_multiple': True}}	ACTION_GET_CONTENT-200-ACTION_CREATE_DOCUMENT-1-ACTION_OPEN_DOCUMENT-1_NR	['get_contact_info_from_uri', 'ACTION_EDIT_VIDEO', 'ACTION_VIDEO_CAPTURE', 'ACTION_OPEN_DOCUMENT', 'ACTION_EDIT_ALARM']
['turn 1: Might you seize an image of the current scene? -> All set—image captured and saved to content://camera_app/photos/98765.', 'turn 2: Display content://camera_app/photos/98765 -> Displaying the captured image for you.']	I want to use the document picker to select a PDF for some editing tasks.	I want to use the document picker to select a PDF for some editing tasks.	{'plan': 'ACTION_OPEN_DOCUMENT', 'arguments': {'mime_types': ['application/pdf']}}	ACTION_IMAGE_CAPTURE-339-ACTION_OPEN_CONTENT-1-ACTION_OPEN_DOCUMENT-1_NR	['ACTION_INSERT_EVENT', 'ACTION_SET_ALARM', 'ACTION_EDIT_ALARM', 'ACTION_OPEN_DOCUMENT', 'ACTION_NAVIGATE_TO_LOCATION']
"['turn 1: Select a video file of any format to preview. -> Please select a video file to preview.', ""turn 2: Send a video file to Dave in a text message saying 'Check this video.' -> Message 'Check this video.' delivered to Dave successfully.""]"	Launch the file selector to choose an image file from my photos.	Launch the file selector to choose an image file from my photos.	{'plan': 'ACTION_OPEN_DOCUMENT', 'arguments': {'mime_types': ['image/*']}}	ACTION_OPEN_DOCUMENT-117-send_message-1-ACTION_OPEN_DOCUMENT-1_NR	['ACTION_OPEN_CONTENT', 'ACTION_INSERT_EVENT', 'ACTION_VIEW_PLAYLIST', 'ACTION_OPEN_DOCUMENT', 'ACTION_PICK']
"['turn 1: Bring up the device’s missed and dialed calls list. -> Call log: Jack +1-718-555-0145 (Outgoing) - Today 1:00 PM; Karen +49-30-1234-5678 (Incoming) - Yesterday 9:45 AM; Leo +1-305-555-0199 (Missed) - Today 7:20 AM', ""turn 2: Return Leo +1-305-555-0199's call -> Dialing +1-305-555-0199...""]"	I'm looking to attach documents in both PDF and plain text formats; let me pick multiple files.	I'm looking to attach documents in both PDF and plain text formats; let me pick multiple files.	{'plan': 'ACTION_OPEN_DOCUMENT', 'arguments': {'mime_types': ['application/pdf', 'text/plain'], 'allow_multiple': True}}	ACTION_VIEW_CALL_LOG-1894-dial-1-ACTION_OPEN_DOCUMENT-1_NR	['ACTION_SET_RINGTONE', 'ACTION_OPEN_DOCUMENT', 'ACTION_NAVIGATE_TO_LOCATION', 'ACTION_EDIT_ALARM', 'ACTION_VIEW_CONTACT']
['turn 1: Could you retrieve the phone call history for me? -> Recent calls: Diana +44-20-7946-0958 (Incoming) - Today 8:30 AM; Emma +1-415-555-2671 (Missed) - Yesterday 6:20 PM; Frank +1-629-555-0148 (Outgoing) - Today 11:05 AM', 'turn 2: Give Diana +44-20-7946-0958 a ring -> Initiating call to +44-20-7946-0958...']	Provide a file selection for multiple images; I need to choose several.	Provide a file selection for multiple images; I need to choose several.	{'plan': 'ACTION_OPEN_DOCUMENT', 'arguments': {'mime_types': ['image/*'], 'allow_multiple': True}}	ACTION_VIEW_CALL_LOG-1892-dial-1-ACTION_OPEN_DOCUMENT-1_NR	['open_settings', 'ACTION_SET_RINGTONE', 'ACTION_EDIT_ALARM', 'dial', 'ACTION_OPEN_DOCUMENT']
['turn 1: Launch the camera interface and snap a photo. -> Okay, picture taken! You can find it at content://media/external/images/media/12345.', 'turn 2: Show me content://media/external/images/media/12345 -> Here’s the photo you snapped—bringing it up now.']	Open a plain text file from my documents — just one file, please.	Open a plain text file from my documents — just one file, please.	{'plan': 'ACTION_OPEN_DOCUMENT', 'arguments': {'mime_types': ['text/plain']}}	ACTION_IMAGE_CAPTURE-337-ACTION_OPEN_CONTENT-1-ACTION_OPEN_DOCUMENT-1_NR	['ACTION_VIEW_CALL_LOG', 'ACTION_SET_RINGTONE', 'ACTION_VIEW_CONTACT', 'ACTION_OPEN_DOCUMENT', 'ACTION_SHOW_TIMERS']
"['turn 1: Could you connect me to the number 4044044044? -> Starting a call to 4044044044...', ""turn 2: Add 4044044044 to my contact list. -> I've added 4044044044 to your contact list. (URI: content://contacts/people/4044044044)""]"	I want to choose one PDF document for permanent access. Please open the file chooser.	I want to choose one PDF document for permanent access. Please open the file chooser.	{'plan': 'ACTION_OPEN_DOCUMENT', 'arguments': {'mime_types': ['application/pdf']}}	dial-927-ACTION_INSERT_CONTACT-1-ACTION_OPEN_DOCUMENT-1_NR	['ACTION_OPEN_DOCUMENT', 'ACTION_VIEW_CALL_LOG', 'ACTION_VIEW_CONTACT', 'ACTION_SET_TIMER', 'ACTION_INSERT_EVENT']
['turn 1: Select a ringtone for the reminder alert. -> Reminder alert tone set to: content://media/ringtone/reminder_ping.mp3', 'turn 2: Set content://media/ringtone/reminder_ping.mp3 as the reminder ringtone. -> Reminder ringtone updated to content://media/ringtone/reminder_ping.mp3.']	Could I select one image only? I just need access to a single image document.	Could I select one image only? I just need access to a single image document.	{'plan': 'ACTION_OPEN_DOCUMENT', 'arguments': {'mime_types': ['image/*']}}	ACTION_GET_RINGTONE-304-ACTION_SET_RINGTONE-1-ACTION_OPEN_DOCUMENT-1_NR	['ACTION_VIEW_RECENT_APPS', 'web_search', 'get_contact_info_from_uri', 'ACTION_OPEN_DOCUMENT', 'ACTION_SHOW_TIMERS']
"[""turn 1: Open Apple Music and play 'Shape of You'. -> Starting 'Shape of You' on Apple Music for you."", 'turn 2: Show the songs in my Chill Vibes playlist. -> Here’s what’s in your Chill Vibes playlist: Lo‑fi Chill; Sunday Morning; Ocean Drive; Night Owl.']"	I'm searching for a text document to open; nothing fancy, just one file will do.	I'm searching for a text document to open; nothing fancy, just one file will do.	{'plan': 'ACTION_OPEN_DOCUMENT', 'arguments': {'mime_types': ['text/plain']}}	play_music-1369-ACTION_VIEW_PLAYLIST-1-ACTION_OPEN_DOCUMENT-1_NR	['ACTION_CREATE_DOCUMENT', 'ACTION_OPEN_DOCUMENT', 'ACTION_VIEW_RECENT_APPS', 'ACTION_GET_RINGTONE', 'ACTION_VIEW_SENT_EMAILS']
['turn 1: Give me a summary of the contact at content://contacts/people/42. -> Here’s what I found:\n• Name: Michael Lee\n• Phone: 555-987-6543\n• Email: michael.lee42@example.com\n• Address: 321 Oak St, Centerville, OH 45459', 'turn 2: Pin 321 Oak St, Centerville, OH 45459 -> Done! 321 Oak St, Centerville, OH 45459 has been pinned.']	Please allow me to choose a single PDF file from my list; one is enough.	Please allow me to choose a single PDF file from my list; one is enough.	{'plan': 'ACTION_OPEN_DOCUMENT', 'arguments': {'mime_types': ['application/pdf']}}	get_contact_info-970-search_location-1-ACTION_OPEN_DOCUMENT-1_NR	['launch_application', 'web_search', 'ACTION_CREATE_DOCUMENT', 'ACTION_OPEN_DOCUMENT', 'ACTION_VIEW_PLAYLIST']
"['turn 1: I want to update the conclusion of the document at content://documents/doc/350 with ""In conclusion, we achieved our goals."" -> Sure—opening content://documents/doc/350 and updating the conclusion to: ""In conclusion, we achieved our goals.""', ""turn 2: Organize an event titled 'Coding Bootcamp' that is an intensive programming course covering Python and JavaScript. It should be held at Tech Center from 1702600000000 to 1702607200000. -> Great! 'Coding Bootcamp' at Tech Center on December 16, 2023, 10:00\xa0AM–12:00\xa0PM has been added to your calendar. URI: content://calendar/event/10.""]"	I want to open a file picker for my images; if possible, allow selecting multiple images.	I want to open a file picker for my images; if possible, allow selecting multiple images.	{'plan': 'ACTION_OPEN_DOCUMENT', 'arguments': {'mime_types': ['image/*'], 'allow_multiple': True}}	ACTION_EDIT_DOCUMENT-1520-ACTION_INSERT_EVENT-1_NR-ACTION_OPEN_DOCUMENT-1_NR	['ACTION_OPEN_DOCUMENT', 'web_search', 'ACTION_VIEW_EVENT', 'ACTION_IMAGE_CAPTURE', 'play_video']
['turn 1: Make a call to 030-1234-5678 now! -> Placing a call to 030-1234-5678...', 'turn 2: Record 030-1234-5678 in my contacts. -> Done! 030-1234-5678 has been recorded in your contacts. (content://contacts/people/03012345678)']	I wish to pick multiple documents—one in PDF and one in plain text. Let me choose them together.	I wish to pick multiple documents—one in PDF and one in plain text. Let me choose them together.	{'plan': 'ACTION_OPEN_DOCUMENT', 'arguments': {'mime_types': ['application/pdf', 'text/plain'], 'allow_multiple': True}}	dial-928-ACTION_INSERT_CONTACT-1-ACTION_OPEN_DOCUMENT-1_NR	['ACTION_EDIT_ALARM', 'ACTION_OPEN_DOCUMENT', 'launch_application', 'ACTION_VIEW_SENT_EMAILS', 'INTENT_ACTION_STILL_IMAGE_CAMERA']
"[""turn 1: Text my colleague with ID 7890 the message 'Project deadline extended to next Monday. Check your email for details.' Use their contact +1 (800) 555-0000. -> Project update delivered to +18005550000."", 'turn 2: Call +18005550000 now -> Dialing +18005550000 now...']"	Could you bring up the file selector for a plain text file, please?	Could you bring up the file selector for a plain text file, please?	{'plan': 'ACTION_OPEN_DOCUMENT', 'arguments': {'mime_types': ['text/plain']}}	send_message-1245-dial-1-ACTION_OPEN_DOCUMENT-1_NR	['play_video', 'get_contact_info', 'ACTION_OPEN_DOCUMENT', 'ACTION_SET_RINGTONE', 'ACTION_VIEW_WEB_HISTORY']
"[""turn 1: Send a quick note to Gina at 5552345678: 'Lunch at noon sounds good.' -> Note to Gina (5552345678) sent successfully."", ""turn 2: Display the note 'Lunch at noon sounds good.' to Gina and other recent sent messages. -> Here's what you sent: Gina +5552345678 – 'Lunch at noon sounds good.'.""]"	I'm trying to open one PDF file that I can work on later; please open the file picker.	I'm trying to open one PDF file that I can work on later; please open the file picker.	{'plan': 'ACTION_OPEN_DOCUMENT', 'arguments': {'mime_types': ['application/pdf']}}	send_message-1284-ACTION_VIEW_SENT_MESSAGES-1-ACTION_OPEN_DOCUMENT-1_NR	['ACTION_VIEW_SENT_EMAILS', 'ACTION_OPEN_DOCUMENT', 'ACTION_SHOW_ALARMS', 'search_location', 'ACTION_VIEW_PLAYLIST']
"[""turn 1: I'd like to hear 'Bohemian Rhapsody' by Queen. -> Absolutely, playing 'Bohemian Rhapsody' by Queen."", 'turn 2: What songs are in my Workout playlist? -> Your Workout playlist includes: Eye of the Tiger; Can’t Hold Us; Thunderstruck; Remember the Name.']"	I need to select an image from my device for an upcoming editing session.	I need to select an image from my device for an upcoming editing session.	{'plan': 'ACTION_OPEN_DOCUMENT', 'arguments': {'mime_types': ['image/*']}}	play_music-1368-ACTION_VIEW_PLAYLIST-1-ACTION_OPEN_DOCUMENT-1_NR	['ACTION_OPEN_DOCUMENT', 'ACTION_CREATE_DOCUMENT', 'play_video', 'ACTION_GET_CONTENT', 'ACTION_SET_TIMER']
